Fri Sep 04 16:43:45 MSK 2015	World news	Europe set for bruising battle over sharing refugee burden	[Refugees, Migration, Germany, France, Hungary, Czech Republic, Slovakia, European Union, Europe, World news]
Fri Sep 04 16:41:46 MSK 2015	Comment is free	This refugee crisis is too big for Europe to handle - its institutions are broken	[Refugees, World news, Migration, Syria, Middle East and North Africa, Politics, UK news, Economic policy]
Fri Sep 04 16:38:20 MSK 2015	World news	Refugee crisis: Hundreds set off from Budapest on foot – as it happened	[Refugees, World news, Migration, Europe, Hungary, Humanitarian response, Syria, Middle East and North Africa]
Fri Sep 04 16:28:17 MSK 2015	Life and style	'Necrophilia legislator' on a crusade to outlaw loophole of arcane era	[Sex, Massachusetts, Law, US news, US crime]
Fri Sep 04 16:26:55 MSK 2015	Books	Reading American cities: books about Austin	[Books, Culture, Fiction, Austin, Austin, Texas, Texas holidays, United States, North and Central America]
Fri Sep 04 16:26:03 MSK 2015	US news	2015 may be one of the safest years for law enforcement in a quarter century	[US policing, US news, Black Lives Matter movement]
Fri Sep 04 16:24:53 MSK 2015	World news	Men tell Polish TV they have 'irrefutable proof' Nazi gold train exists	[Poland, Second world war, Nazism, Europe, World news]
Fri Sep 04 16:24:50 MSK 2015	Art and design	Aylan Kurdi – and six other shots that shook the world	[Art and design, Culture, Syria, Migration, Vietnam, Tiananmen Square protests 1989, Iraq, Sudan, Alan Kurdi]
Fri Sep 04 16:24:08 MSK 2015	World news	Cameron limits UK's Syrian refugee intake 'to discourage risky journeys'	[Refugees, Syria, UK news, David Cameron, Middle East and North Africa, Politics, World news]
Fri Sep 04 16:21:03 MSK 2015	Sport	Are more women jockeys ready to follow in Hayley Turner’s riding boots?	[Hayley Turner, Horse racing, Sport]
Fri Sep 04 16:20:13 MSK 2015	Music	Michael Janisch's Paradigm Shift review – brilliant, but infuriating	[Jazz, Music, Culture]
Fri Sep 04 16:12:03 MSK 2015	Music	Demi Lovato's out and out summer anthem	[Pop and rock, Music, Culture, LGBT rights, Sexuality, Society]
Fri Sep 04 16:12:02 MSK 2015	Music	Alice Coote/English Concert/Bicket – a confused meditation on Handel's sexual ambiguities	[BBC Proms 2015, Proms, Opera, Classical music, Culture, Music, Festivals]
Fri Sep 04 16:10:21 MSK 2015	Music	Janet Jackson: is her past pop stardom 'Unbreakable' enough to stay relevant?	[Janet Jackson, Pop and rock, Music, Culture]
Fri Sep 04 16:06:22 MSK 2015	Music	BBCNOW/Søndergård review – the Albert Hall's great beast is unleashed	[BBC Proms 2015, Proms, Classical music, Music, Culture, BBC National Orchestra of Wales, Festivals]
Fri Sep 04 16:05:50 MSK 2015	Politics	Scottish independence referendum cost £2m more than expected	[Scottish independence, Scotland, Scottish politics, Politics, UK news]
Fri Sep 04 16:00:08 MSK 2015	xAd partner zone	Mobile disruptors: Imran Khan, xAd Inc – video	[xAd partner zone]
Fri Sep 04 15:58:23 MSK 2015	Football	Quick, hide the fruit bowl	[Football, Sport]
Fri Sep 04 15:46:49 MSK 2015	Football	Why Wayne Rooney, England’s most chastised player, deserves a cheer | Barney Ronay	[Wayne Rooney, England, Euro 2016 qualifiers, Bobby Charlton, Football, Sport]
Fri Sep 04 15:41:52 MSK 2015	US news	Kentucky county grants first same-sex couple marriage license after clerk jailed	[Kentucky, Same-sex marriage (US), LGBT rights, US news, World news]
Fri Sep 04 15:41:23 MSK 2015	Public Leaders Network	Refugee crisis: the UK local government response so far	[Public Leaders Network, Local government, Local government, Politics, Society, UK news, Refugees, Migration, World news, Collaboration, Syria, Middle East and North Africa, Immigration and asylum]
Fri Sep 04 15:40:19 MSK 2015	Football	USA turn page with Peru and Brazil friendlies as Mexico showdown looms	[USA, Friendlies, Football, US sports, Sport]
Fri Sep 04 15:39:57 MSK 2015	US news	Can Bernie Sanders really beat Hillary Clinton in Iowa?	[Bernie Sanders, US news, Democrats, US politics, US elections 2016, Iowa, World news]
Fri Sep 04 15:37:27 MSK 2015	Technology	When people say Nicholas Fraser's vine isn't the best of 2015: why you always lyin'?	[Vine, Technology, Twitter, Internet, Media, Instagram]
Fri Sep 04 15:34:39 MSK 2015	Books	Panel beaters: the comic book tech revolution is here	[Comics and graphic novels, Books, Culture, Art and design, Technology, Publishing, Apple]
Fri Sep 04 15:33:53 MSK 2015	World news	Russian town besieged by hungry bears	[Russia, Animals, World news]
Fri Sep 04 15:33:50 MSK 2015	Environment	Climate stalemate prompts call for world leaders to intervene	[COP 21: UN climate change conference | Paris, Global climate talks, Environment, Climate change, United Nations, World news, Kofi Annan]
Fri Sep 04 15:32:33 MSK 2015	Comment is free	The question is not how many refugees we take, but what practical steps must take | Damian Green	[Migration, World news, European Union, Europe, Syria, Middle East and North Africa, Germany, Jordan, Lebanon, Turkey, European commission]
Fri Sep 04 15:30:10 MSK 2015	Media Network	The four keys to future advertising success	[Media & Tech Network, Television, Mobile phones, Internet, Technology, Telecoms, Marketing & PR, Media]
Fri Sep 04 15:30:07 MSK 2015	Money	Let’s move to St Asaph, Denbighshire	[Property, Homes, Money, Life and style]
Fri Sep 04 15:28:42 MSK 2015	UK news	Borders railway reopens signalling fresh hope for more Scottish lines	[Scotland, UK news, Transport, Rail transport, Borders, Business]
Fri Sep 04 15:26:00 MSK 2015	Info	Guardian and Observer style guide: B	[]
Fri Sep 04 15:25:10 MSK 2015	Music	The personal touch: how musicians choose their festivals	[Music festivals, Sufjan Stevens, Culture, Music, Festivals, End of the Road festival, Other Voices festival, Glastonbury festival]
Fri Sep 04 15:23:03 MSK 2015	Film	Johnny Depp: 'I killed my dogs and ate them'	[Black Mass, Venice film festival 2015, Venice film festival, Johnny Depp, Crime, US crime, Film, Culture, US news, World news, Festivals, Film adaptations]
Fri Sep 04 15:22:17 MSK 2015	UK news	Bob Geldof offers to house four refugee families	[UK news, Refugees, Migration, World news, Bob Geldof, JK Rowling, Mary Portas, Stan Collymore, Social media]
Fri Sep 04 15:21:31 MSK 2015	UK news	Shoreham airshow crash plane working normally, interim report suggests	[Shoreham airshow crash, Plane crashes, UK news]
Fri Sep 04 15:19:21 MSK 2015	Comment is free	The US must do more to help Syria. Step one: let more refugees resettle here | Sarab Al-Jijakli	[Syria, Migration, Refugees]
Fri Sep 04 15:17:37 MSK 2015	Sport	Scotland bank on John Hardie proving his worth in France warm-up	[Scotland rugby union team, France rugby union team, Rugby World Cup 2015, Rugby World Cup, Rugby union, Sport]
Fri Sep 04 15:13:05 MSK 2015	UK news	Hugo Boss fined £1.2m over boy's mirror death	[UK news]
Fri Sep 04 15:11:10 MSK 2015	Marketing Agencies Association partner zone	Engagement: are likes and clicks all they're cracked up to be?	[Marketing Agencies Association partner zone]
Fri Sep 04 15:10:00 MSK 2015	Info	Guardian and Observer style guide: A	[]
Fri Sep 04 15:00:19 MSK 2015	Culture	The 10 best things to do this week	[Culture, Music, Film, Clubbing, Theatre, Comedy]
Fri Sep 04 15:00:07 MSK 2015	Comment is free	By denying poor people justice, we are denying ourselves a functioning justice system	[UK criminal justice, Law, Barristers]
Fri Sep 04 14:59:29 MSK 2015	Higher Education Network	Academics are being hoodwinked into writing books nobody can buy	[Higher Education Network, Academics, Research, Publishing, Higher education, Education]
Fri Sep 04 14:59:07 MSK 2015	Art and design	That’s me in the picture: Joe Massian flees the World Trade Center South Tower on 9/11	[Photography, September 11 2001, Art and design, Al-Qaida, New York]
Fri Sep 04 14:58:37 MSK 2015	Television & radio	Lady Chatterley's Lover: no sex please, we're on British TV	[Drama, BBC, Television & radio, Culture, DH Lawrence, Books, Television]
Fri Sep 04 14:58:13 MSK 2015	Selfridges Meet the Makers	The sweet taste of success	[Selfridges Meet the Makers]
Fri Sep 04 14:57:35 MSK 2015	Comment is free	Christian politicians won’t say it, but the Bible is clear: let the refugees in, every last one | Giles Fraser: Loose canon	[Refugees, Anglicanism, Christianity, Religion, London, UK news, World news, Syria, Middle East and North Africa, David Cameron, Politics, Hungary, Europe]
Fri Sep 04 14:49:37 MSK 2015	Sport	County cricket: Surrey seal promotion to Division One – as it happened	[Cricket, County Championship Division One, County Championship Division Two, Sport, Worcestershire, Sussex, Surrey, Derbyshire]
Fri Sep 04 14:47:51 MSK 2015	Sport	Sports quiz of the week: US Open, Anthony Martial and transfer madness	[Sport, Football, Transfer window, Tennis, US Open Cup, Premier League, Serena Williams, US sports]
Fri Sep 04 14:45:07 MSK 2015	Comment is free	Victory against secret fake cell phone towers shows privacy isn't dead | Trevor Timm	[Privacy, Edward Snowden, Surveillance]
Fri Sep 04 14:41:00 MSK 2015	Sport	Leonard Barden on Chess	[Magnus Carlsen, Chess, Sport]
Fri Sep 04 14:35:11 MSK 2015	Music	New band of the week: Halsey (No 69)	[Music, Pop and rock, R&B, Electronic music, Lorde, Lana Del Rey, Rihanna, Culture, Taylor Swift]
Fri Sep 04 14:34:50 MSK 2015	Television & radio	Have you been watching The Last Man on Earth?	[Comedy, Comedy, Culture, Television, Television & radio]
Fri Sep 04 14:23:30 MSK 2015	Comment is free	Part of me hates ‘gotcha’ questions – even when the person being got is Donald Trump | Marina Hyde	[Donald Trump, US news, Hamas, Palestinian territories, World news, Hezbollah, George Bush]
Fri Sep 04 14:14:47 MSK 2015	Technology	Have smartwatches finally had the injection of style they need?	[Smartwatches, Wearable technology, Samsung, Lenovo, Apple, Apple Watch, Technology, Fashion, Life and style]
Fri Sep 04 14:02:01 MSK 2015	US news	School reform divides Chicago as protesters vow to continue hunger strike	[Chicago, US news, US education, Schools]
Fri Sep 04 14:00:06 MSK 2015	Children's books	All The Bright Places by Jennifer Niven - review	[Children and teenagers, Books, Culture, Teen books, Teen romance (childrens and teens), Friendship (children and teens)]
Fri Sep 04 14:00:06 MSK 2015	Books	Tea with Oliver Sacks: Will Self, Andrew Solomon and Sue Halpern pay tribute	[Books, Culture, Oliver Sacks, Science and nature, Psychology]
Fri Sep 04 14:00:06 MSK 2015	Crosswords	Annotated solutions for Prize 26,663	[Crosswords]
Fri Sep 04 14:00:05 MSK 2015	Life and style	If I don’t see it, why should I clean it?	[Health & wellbeing, Life and style, Psychology, Science]
Fri Sep 04 13:52:54 MSK 2015	Business	The road to recovery: furloughs, layoffs and job numbers that shade the truth	[US economy, US unemployment and employment statistics, US unemployment and employment data, Oil, US news, Commodities, Economics, Business]
Fri Sep 04 13:52:44 MSK 2015	Sport	Rugby World Cup 2015: Pool A carries risks for England, Wales and Australia	[Rugby World Cup 2015, England rugby union team, Australia rugby union team, Australia sport, Wales rugby union team, Fiji rugby union team, Uruguay rugby union team, Rugby World Cup, Rugby union, Sport]
Fri Sep 04 13:50:34 MSK 2015	Guardian Masterclasses	Writers’ workshop with Tim Lott	[Guardian Masterclasses, New Masterclasses, writing and publishing courses]
Fri Sep 04 13:48:39 MSK 2015	World news	Pope Francis's abortion pardon 'a great gift' for Catholics in Boston	[Pope Francis, Abortion, Boston, Massachusetts, Catholicism, Christianity, Religion, US news, World news, The papacy]
Fri Sep 04 13:48:35 MSK 2015	Environment	Why I donated my bike to people at Calais refugee camp	[Refugees, Environment, UK news, Migration, Immigration and asylum]
Fri Sep 04 13:43:47 MSK 2015	Football	Carlton Fairweather’s Sunderland fight for Women’s Super League dream	[Women's Super League, Women's football, Football, Sport]
Fri Sep 04 13:42:27 MSK 2015	Music	Today's top orchestra and conductor? The critics have spoken; here's my list	[Classical music, Music, Culture]
Fri Sep 04 13:39:30 MSK 2015	Comment is free	Rebekah Brooks is back – to make sure Murdoch becomes even more dominant | Martin Hickman	[News UK, News Corporation, Rupert Murdoch, Media, UK news, Sky plc, Television industry, Media business, Leveson report, Newspapers & magazines, Leveson inquiry]
Fri Sep 04 13:29:53 MSK 2015	O2 tech future	Britain's top five Silicon Roundabout rivals	[O2 tech future]
Fri Sep 04 13:28:50 MSK 2015	Children's books	Patrick Ness and his super-author team raise £200,000 for Syrian refugees	[Children and teenagers, Children's books: 8-12 years, Teen books, Patrick Ness, John Green, David Nicholls, Books, Culture, Refugees, Syria, Rainbow Rowell]
Fri Sep 04 13:25:20 MSK 2015	UK news	From tartan to tippling: A to Z of things two queens have in common	[The Queen, Monarchy, UK news, Heritage, Queen Victoria]
Fri Sep 04 13:20:57 MSK 2015	Books	Leading writers hope to shift refugee debate with crowdfunded anthology	[Publishing, Fiction, Books, Culture, Crowdfunding, Technology, Refugees, Poetry, Sebastian Barry, William Boyd, Monica Ali, Hanif Kureishi, Ruth Padel]
Fri Sep 04 13:19:34 MSK 2015	Culture	This week’s new talks	[Culture]
Fri Sep 04 13:15:53 MSK 2015	Global Development Professionals Network	Climate change: western states fail to fulfil pledges to developing countries	[Global development professionals network, Climate change, Environment, Cop 20: UN climate change conference | Lima, Global climate talks]
Fri Sep 04 13:09:40 MSK 2015	Comment is free	David Cameron is allowing Nigel Farage to run his asylum policy | Guy Verhofstadt	[Refugees, Nigel Farage, European Union, Migration, UK Independence party (Ukip), Politics, Europe, World news, David Cameron]
Fri Sep 04 13:08:58 MSK 2015	Stage	Couples therapy? Partners play out their relationships on stage	[Stage, Theatre, Culture, Relationships]
Fri Sep 04 13:06:15 MSK 2015	Technology	How the duck army stormed the internet	[Technology, Vine, YouTube, Internet, Twitter]
Fri Sep 04 13:00:04 MSK 2015	Life and style	Taberna Do Mercado, London E1 – restaurant review | Marina O’Loughlin	[Restaurants, London holidays, United Kingdom holidays, Europe, Travel, Food & drink, Life and style]
Fri Sep 04 13:00:04 MSK 2015	Life and style	Experience: I ran a school bus over a cow	[Life and style]
Fri Sep 04 00:53:35 MSK 2015	Art and design	This week’s new exhibitions	[Art, Exhibitions, Art and design, Culture]
Fri Sep 04 00:48:35 MSK 2015	Global development	Migration crisis: ‘Who can refuse these human beings? Who?’ asks UN official	[Migration and development, Conflict and development, Aid, Global development, Migration, United Nations]
Fri Sep 04 00:42:56 MSK 2015	Business	US economy adds 173,000 jobs as unemployment rate drops to 5.1%	[US unemployment and employment data, US unemployment and employment statistics, US economy, Business, Economics]
Fri Sep 04 00:39:09 MSK 2015	Sport	Bradley Wiggins using Tour of Britain as training for pursuit success at Rio 2016	[Sir Bradley Wiggins, Tour of Britain, Cycling, Sport]
Fri Sep 04 00:37:09 MSK 2015	US news	Donald Trump: I will know the difference between Hamas and Hezbollah 'when it's appropriate'	[Donald Trump, US elections 2016, US news, World news, Middle East and North Africa]
Fri Sep 04 00:36:27 MSK 2015	Film	Are superhero movies really set to go the way of the western?	[Superhero movies, Film, Culture, Marvel, Steven Spielberg, DC Comics, Comics and graphic novels]
Fri Sep 04 00:35:20 MSK 2015	Guardian Masterclasses	The secrets to a successful job interview | Corinne Mills	[New Masterclasses, Guardian Masterclasses, Business masterclasses, Culture courses]
Fri Sep 04 00:33:19 MSK 2015	Football	Kevin Davies announces retirement from football	[Football, Preston North End, Bolton Wanderers, Sport]
Fri Sep 04 00:30:03 MSK 2015	Life and style	How I crushed my eight-year-old’s innocence at Dismaland	[Family, Parents and parenting, Children, Banksy, Art and design, Society, Life and style]
Fri Sep 04 00:28:39 MSK 2015	Comment is free	Life with HIV has changed enormously. It’s time public perception followed suit | Tom Hayes	[Aids and HIV, Health, Privacy, Society, World news, UK news]
Fri Sep 04 00:28:14 MSK 2015	Technology	Man takes to the skies in world-first pentacontakaitetracopter	[Drones (non-military), Technology]
Fri Sep 04 00:27:34 MSK 2015	World news	Hungary closes Serbian border crossing as refugees make for Austria on foot	[Migration, Hungary, Europe, World news, Serbia, Refugees, Austria, Germany]
Fri Sep 04 00:26:05 MSK 2015	Culture	Bloc Party's new look, some bad anime, 'deflategate' and more: reviewed	[Culture, Music, Metal, Anime, Television, Pop and rock, Television & radio]
Fri Sep 04 00:13:35 MSK 2015	UK news	David Cameron's refugee promise needs to be more than a gesture	[UK news, David Cameron, Politics, World news, Europe, Migration]
Fri Sep 04 00:10:56 MSK 2015	Travel	Following the Volga – Thom Wheeler's journey through 500 years of Russian history	[Russia, Europe, Cultural trips, Heritage, Travel, Asia]
Fri Sep 04 00:10:26 MSK 2015	Stage	The Oresteia review – a vigorous, vivid, but inconsistent take on Aeschylus	[Aeschylus, Theatre, Stage, Shakespeare's Globe, Culture]
Fri Sep 04 00:09:51 MSK 2015	US news	Republicans step up attack campaign – and the target is Black Lives Matter	[Black Lives Matter movement, Republicans, US news, US elections 2016, US politics, Race issues]
Fri Sep 04 00:08:42 MSK 2015	Media	Cilla Black coverage leads to sales boost for UK tabloids	[ABCs, Media, Newspapers & magazines, Newspapers, Media business, UK news]
Fri Sep 04 00:05:50 MSK 2015	Science	Why your bathroom scales are lying to you and how to find your true weight	[Science, Health, Obesity, Diets and dieting, Nutrition]
Fri Sep 04 00:05:18 MSK 2015	World news	Syrian refugee crisis: why has it become so bad?	[Refugees, Migration, Syria, Middle East and North Africa, World news]
Fri Sep 04 00:00:05 MSK 2015	Stage	This week’s new dance	[Dance, Culture, Stage]
Fri Sep 04 00:00:05 MSK 2015	Television & radio	Hand of God: Amazon's hands-off approach creates an unholy mess	[Amazon Prime Instant Video, Television, Culture, Television & radio, Ron Perlman]
Fri Sep 04 00:00:05 MSK 2015	Books	The book I'm sending a prisoner	[Books, Culture, Prisons and probation, Society, Law, UK criminal justice]
Fri Sep 04 00:00:05 MSK 2015	Books	'Black characters are still revolutionary’: writers talk about the complexity of race	[Books, Race issues, Culture, James Baldwin, Toni Morrison]
Fri Sep 04 00:00:05 MSK 2015	Stage	This week’s new theatre	[Theatre, Stage, Culture]
Fri Sep 04 00:00:05 MSK 2015	Stage	This week’s new live comedy	[Comedy, Stage, Culture]
Fri Sep 04 00:00:04 MSK 2015	Music	The Black Madonna’s favourite tracks	[Dance music, Music, Culture]
Fri Sep 04 00:00:04 MSK 2015	Music	This week’s new live music	[Pop and rock, Music, Culture]
Fri Sep 04 00:00:03 MSK 2015	Fashion	What I wore this week: pink without a hint of Barbie (or the Queen Mother)	[Fashion, Life and style, Skirts, Women's shirts, Women's shoes]
Fri Sep 04 00:00:03 MSK 2015	Music	Clubs picks of the week	[Clubbing, Music, Culture]
Fri Sep 04 00:00:03 MSK 2015	Music	This week’s new tracks: Show Me The Body’s Vernon is a stoned, stately, half-speed thrash	[Pop and rock, Music, Culture]
Fri Sep 04 11:59:03 MSK 2015	Life and style	Amanda Redman: My family values	[Family, Parents and parenting, Television, Life and style]
Fri Sep 04 11:57:00 MSK 2015	Film	Francofonia review – eerie look at the Louvre's vulnerable freight	[Film, Culture, Museums]
Fri Sep 04 11:54:29 MSK 2015	Environment	Badger cull gets under way in Dorset, Gloucestershire and Somerset	[Badgers, Bovine tuberculosis, Rural affairs, Environment, Wildlife, Animal welfare, UK news, Farming]
Fri Sep 04 11:50:31 MSK 2015	World news	Aylan Kurdi: funeral held for Syrian boy who drowned off Turkey	[Migration, Refugees, Syria, Turkey, European Union, Europe, Middle East and North Africa, World news, Alan Kurdi]
Fri Sep 04 11:45:35 MSK 2015	UK news	Preacher Anjem Choudary to leave prison after being granted bail	[UK news]
Fri Sep 04 11:45:03 MSK 2015	US news	Alleged arsons at Planned Parenthood clinics reported in wake of 'sting' videos	[Planned Parenthood, US news]
Fri Sep 04 11:38:02 MSK 2015	UK news	Cardiff removes Israeli football exhibition after protests	[Cardiff, Wales, UK news, Israel, Palestinian territories, Middle East and North Africa, World news, Photography, Football, Art and design, Sport, Culture]
Fri Sep 04 11:37:08 MSK 2015	Comment is free	Nigeria’s new president is no messiah, but he is showing potential | Remi Adekoya	[Nigeria, Muhammadu Buhari, Africa, World news, Boko Haram]
Fri Sep 04 11:36:16 MSK 2015	Comment is free	We need to welcome many more refugees than Cameron suggests | Caroline Lucas	[Refugees, Migration, David Cameron, Syria, UK news, Politics, Middle East and North Africa, World news]
Fri Sep 04 11:30:03 MSK 2015	Books	Poster poems: the alphabet	[Poetry, Books, Culture]
Fri Sep 04 11:30:03 MSK 2015	Guardian Sustainable Business	California's healthcare industry can lead the way on stronger climate change regulation	[Guardian sustainable business, California, Health, Health, Climate change, COP 21: UN climate change conference | Paris, Climate change, Environment, Society]
Fri Sep 04 11:30:02 MSK 2015	Life and style	Raymond Blanc’s final meal | Last Bites	[Food & drink, Life and style, Chefs, Raymond Blanc, Vegetables]
Fri Sep 04 11:29:35 MSK 2015	Music	Glastonbury festival 2016 ticket sales begin in October	[Music, Glastonbury 2016, Music festivals, Festivals, Culture]
Fri Sep 04 11:27:26 MSK 2015	Football	Bournemouth’s record signing Tyrone Mings ruled out for the season	[Bournemouth, Premier League, Football, Sport]
Fri Sep 04 11:25:50 MSK 2015	World news	Ukraine's government bears more responsibility for ongoing conflict than the far-right	[Ukraine, Europe, World news, Russia, Protest, Petro Poroshenko, Viktor Yanukovych]
Fri Sep 04 11:24:28 MSK 2015	Business	SABMiller and Diageo could benefit from a merger, say analysts	[Business, Stock markets, SABMiller, Diageo]
Fri Sep 04 11:21:17 MSK 2015	Music	Meat Puppets live review – fiery rock beamed in from another universe	[Pop and rock, Music, Culture]
Fri Sep 04 11:18:09 MSK 2015	Sport	Tom Youngs should benefit from Geoff Parling’s lineout knowledge | Dean Ryan	[England rugby union team, Rugby union, Rugby World Cup, Sport]
Fri Sep 04 11:15:40 MSK 2015	Media	John Bercow follows Tony Blair in criticising Ipso Daily Mail decision	[Ipso, Media, Newspapers & magazines, Press regulation, Daily Mail, National newspapers, Newspapers, John Bercow, Politics, Tony Blair, UK news]
Fri Sep 04 11:15:03 MSK 2015	Comment is free	Serena Williams isn't just an athlete – she shows black girls their bodies are perfect | Victoria Brown	[Serena Williams, Race issues, Tennis, Family]
Fri Sep 04 11:12:19 MSK 2015	Cities	Ride, hustle, kill, repeat: the underground cycle gangs of Los Angeles	[Cities, Los Angeles, Cycling, US news, World news, Cycling holidays, Travel, Los Angeles holidays, United States, North and Central America, Transport policy, City transport, Gangs, Communities, Society]
Fri Sep 04 11:09:30 MSK 2015	Sport	IOC pledges help for refugees with launch of $2m fund	[International Olympic Committee, Refugees, World news, Sport]
Fri Sep 04 11:08:48 MSK 2015	Society	Depersonalisation disorder: the condition you’ve never heard of that affects millions
	[Mental health, Health, Society, Psychiatry, Psychology, Depression, Drugs, Neuroscience]
Fri Sep 04 11:07:29 MSK 2015	Money	A million interest-only mortgage holders 'face repossession'	[Mortgages, Borrowing & debt, Remortgaging, Property, Money, UK news]
Fri Sep 04 11:00:03 MSK 2015	Film	Superhero smackdowns: why we love to see caped crusaders fight each other	[Batman v Superman: Dawn of Justice, Superhero movies, Science fiction and fantasy, Film, Culture, Marvel]
Fri Sep 04 11:00:03 MSK 2015	Music	Watch Swim Deep's video for Namaste	[Music, Culture, Indie]
Fri Sep 04 11:00:02 MSK 2015	Life and style	An end-of-summer picnic feast with salmon en croute and salads | Feasting	[Fish, Food & drink, Life and style, Chefs, Summer food and drink, Seafood, Main course]
Fri Sep 04 11:00:02 MSK 2015	Sport	USA welcome Australia to Chicago with Rugby World Cup in mind	[USA rugby union team, Australia rugby union team, Rugby union, US sports, Australia sport, Sport, Rugby World Cup, Rugby World Cup 2015]
Fri Sep 04 11:00:02 MSK 2015	Children's books	Whale Boy by Nicola Davies – review	[Children and teenagers, Books, Culture, Children's books: 8-12 years, Adventure (children and teens), Animals]
Fri Sep 04 11:00:02 MSK 2015	Life and style	On Godwin, gerunds and the art of cocktailing | Empire of Drinks	[Food & drink, Alcohol, Cocktails, Life and style]
Fri Sep 04 10:52:08 MSK 2015	Sport	Talking Horses: Friday’s best bets plus the latest racing news	[Horse racing tips, Horse racing, Sport]
Fri Sep 04 10:50:12 MSK 2015	Politics	Corbyn-led Labour could lose 500 council seats - Burnham camp	[Labour party leadership, Jeremy Corbyn, Andy Burnham, Opinion polls, Labour, Politics, UK news, Local government, Local politics, Society]
Fri Sep 04 10:48:51 MSK 2015	Environment	EU car pollution laws have improved UK's air quality, say carmakers	[Pollution, Travel and transport, Environment, Automotive industry, Business, UK news, Health, European Union, Europe]
Fri Sep 04 10:46:54 MSK 2015	Comment is free	Jeremy Corbyn must become the soldiers’ champion | Owen Jones	[Jeremy Corbyn, Military, Defence policy, Labour party leadership, Labour, Politics, UK news]
