Mon Aug 31 07:33:43 MSK 2015	Australia news	'Here, Jo, have a real one': Jo-Ann Miller given Louis Vuitton belt by constituent	[Queensland, Queensland politics, Australia news, Annastacia Palaszczuk, Labor party]
Mon Aug 31 07:31:00 MSK 2015	Australia news	Dyson Heydon to stay on at helm of trade union royal commission – as it happened	[Royal commission into trade union governance and corruption, Australian trade unions, Labor party, Liberal party, Coalition, Tony Abbott, Bill Shorten]
Mon Aug 31 07:30:18 MSK 2015	World news	All children should be removed from Nauru detention, Senate inquiry finds	[Nauru, Australian immigration and asylum, Australia news, Australian politics, Sarah Hanson-Young, Australian Greens, Human rights]
Mon Aug 31 07:29:28 MSK 2015	Technology	The Diamond Minecart becomes most popular YouTube channel	[YouTube, Minecraft, Online TV, Technology, Game culture, Games, Media, Digital media, Children's tech, Culture, Television industry, Internet, Television, Television & radio]
Mon Aug 31 07:18:01 MSK 2015	Film	Wes Craven reinvented horror three times: cinema looks scary without him	[Wes Craven, Culture, Film, Horror]
Mon Aug 31 07:14:01 MSK 2015	Football	Premier League: 10 talking points from the weekend's action	[Premier League, Manchester City, Watford, Liverpool, West Ham United, Football, Sport, Tottenham Hotspur, Everton, Stoke City, West Bromwich Albion, Chelsea, Crystal Palace, Sunderland, Aston Villa, Southampton, Norwich City, Bournemouth, Leicester City, Swansea City, Manchester United, Newcastle United, Arsenal]
Mon Aug 31 07:00:08 MSK 2015	Art and design	Cracking the code: how patterns make you more mindful	[Design, Art and design, Culture, Mathematics, Fashion, Life and style, Art and design, Blogging, Festivals, Science, Digital media, Books, Media, Architecture]
Mon Aug 31 07:00:07 MSK 2015	Life and style	Mummies know best: the pharaohs giving up their secrets about heart disease	[Health & wellbeing, Life and style, Science, Egyptology, Archaeology]
Mon Aug 31 07:00:06 MSK 2015	Teacher Network	What sort of back to school teacher are you? Take our test (no cheating)	[Teacher Network, Education, Schools, Primary schools, Secondary schools, Teaching]
Mon Aug 31 07:00:06 MSK 2015	Life and style	My husband’s operation has ruined our sex life	[Sex, Relationships, Life and style]
Mon Aug 31 06:49:14 MSK 2015	Environment	Shenhua coalmine faces legal challenge over risk to koala population	[Coal, Mining, New South Wales, Mining, Activism, Energy, Environment, Fossil fuels, Protest, Australia news, Animal welfare, Conservation, Wildlife, Animals]
Mon Aug 31 06:45:06 MSK 2015	Life and style	Will fish oil keep my brain young? | Luisa Dillner	[Health & wellbeing, Life and style, Health, Society, Fish, Food & drink, Seafood]
Mon Aug 31 06:27:42 MSK 2015	Australia news	Dyson Heydon: I read emails only after they have been printed out for me	[Royal commission into trade union governance and corruption, Email, Internet, Twitter, Computing]
Mon Aug 31 06:15:05 MSK 2015	Guardian Small Business Network	How to protect your business from intellectual property theft	[Business essentials, Guardian Small Business Network, Business, Small business, Entrepreneurs, Law, Intellectual property]
Mon Aug 31 06:10:05 MSK 2015	Television & radio	The X Factor review: the new team is getting along famously but the old snarks and smirks live on	[The X Factor, Simon Cowell, Entertainment, Television, Television & radio, Culture]
Mon Aug 31 06:10:05 MSK 2015	Life and style	The big summer quiz 2015: Kids Co, Calais and ketchup	[Life and style]
Mon Aug 31 06:04:05 MSK 2015	Fashion	What John Waters taught me about eyeliner	[Beauty, Fashion, Life and style, John Waters, Film, Culture]
Mon Aug 31 06:03:05 MSK 2015	Science	Can you solve it? Professor Povey's perplexing problem	[Mathematics, Mathematics, Physics, Physics, Education, Science]
Mon Aug 31 06:00:09 MSK 2015	Money	Ticket prices will only go in one direction due to government U-turn	[Ticket prices, Consumer affairs, Money, One Direction, UK news, Sajid Javid, Music, Culture, Politics]
Mon Aug 31 06:00:09 MSK 2015	Simply Business partner zone	Seven things we wish we'd known before starting a business	[Simply Business partner zone]
Mon Aug 31 06:00:06 MSK 2015	Stage	Plan your week’s theatre: top tickets	[Culture, Theatre, Stage, Matthew Warchus, Ivo van Hove, Simon Stephens, Michael Grandage, Rob Brydon, Nicole Kidman]
Mon Aug 31 06:00:06 MSK 2015	Media	How to sneeze in Japanese. LOL (or, as they say in  Indonesia, wkwkwk)	[Media, Language, Meryl Streep, Joan Rivers, Science]
Mon Aug 31 06:00:05 MSK 2015	World news	No regrets, no remorse: Isis mastermind who sent out 15 suicide bombers	[Islamic State, Iraq, Middle East and North Africa, World news]
Mon Aug 31 05:59:05 MSK 2015	Technology	LBX: Little Battlers eXperience; Zombi; Picross e6 review – cutting-edge robots, but these zombies are a shambles	[Games, Puzzle games, Technology, Culture]
Mon Aug 31 05:48:45 MSK 2015	World news	China's army drafts in troop of monkeys to keep skies clear for victory parade	[China, Animals, Asia Pacific, World news, Second world war, Vladimir Putin]
Mon Aug 31 05:40:48 MSK 2015	Australia news	Victoria to curb 'unlawful association' between criminals in bikie gang blitz	[Bikie gangs, Victoria, Australian police and policing, Victorian politics, New South Wales, South Australia, Human rights]
Mon Aug 31 05:15:03 MSK 2015	Film	Wes Craven: professional scaremonger who rewrote his own horror rules	[Wes Craven, Film, Culture, Horror]
Mon Aug 31 05:04:38 MSK 2015	World news	Porn star to be featured on Taiwan travel cards to 'cheer commuters up'	[Taiwan, Japan, Asia Pacific, World news, Pornography, Culture]
Mon Aug 31 05:00:04 MSK 2015	Science	First picture drawn in space to appear in cosmonauts show in London	[Space, UK news, Art, Science, Art and design, Russia, World news, Europe, Culture]
Mon Aug 31 05:00:04 MSK 2015	Television & radio	Monday’s best TV	[Television, Television & radio, Culture]
Mon Aug 31 04:59:04 MSK 2015	Comment is free	Our schools should be less like Singapore and more like Silicon Valley | Zoe Williams	[Teaching, Education, Education policy, Politics, Ofsted, UK news]
Mon Aug 31 04:44:53 MSK 2015	Sport	Worn brake pads a factor in crash death of race driver, Brisbane inquest told	[Motor sport, Brisbane, Queensland, Australia news, UK news, World news]
Mon Aug 31 04:31:10 MSK 2015	World news	Families of China's 'disappeared' say country is a place of fear and panic	[China, Human rights, Asia Pacific, Law, World news]
Mon Aug 31 04:30:03 MSK 2015	Environment	Pure water from the depth of the mountain	[Environment, Mountains, Water, Rural affairs, UK news, Lake District]
Mon Aug 31 04:00:02 MSK 2015	World news	For art to survive in Iran, trendy urbanites have to like it	[Iran, Art and design, Culture, Middle East and North Africa, World news]
Mon Aug 31 03:55:13 MSK 2015	Music	VMAs 2015: the MTV Video Music Awards – as it happened	[MTV VMAs 2015, Miley Cyrus, MTV, Music, Awards and prizes, Culture, Taylor Swift, Nicki Minaj]
Mon Aug 31 03:39:52 MSK 2015	Environment	India: No country for wild tigers? | Janaki Lenin	[Wildlife, Animals, Conservation, Endangered habitats, India, Environment, Endangered species, South and Central Asia, Trees and forests]
Mon Aug 31 03:32:07 MSK 2015	Film	Putuparri and the Rainmakers wins best film at 2015 CinéfestOz festival	[Australian film, Documentary, Festivals, Awards and prizes, Indigenous Australians, Western Australia, Culture, Film, Australia news]
Mon Aug 31 03:27:15 MSK 2015	Music	Kanye West announces 2020 run for US president at VMAs	[MTV VMAs 2015, Kanye West, World news, US news, Music, Culture]
Mon Aug 31 03:25:43 MSK 2015	Australia news	Dutton staffer replied 'thanks for letting me know' to border force press release	[Australian immigration and asylum, Peter Dutton, Australia news, Australian politics, Victoria, Melbourne, Australian police and policing]
Mon Aug 31 03:25:38 MSK 2015	Australia news	NSW Young Nationals endorse marriage equality and back conscience vote	[Marriage equality (Australia), Liberal party, Coalition, Australia news, Tony Abbott]
Mon Aug 31 03:08:59 MSK 2015	Australia news	Indigenous Queenslanders turning to ice to beat alcohol ban, says police chief	[Indigenous Australians, Alcohol, Australian police and policing, Queensland]
Mon Aug 31 03:00:01 MSK 2015	Television & radio	Fear the Walking Dead: Season one, episode two – So Close, Yet So Far	[Fear the Walking Dead, US television, Television & radio, Culture, Television, Zombies]
Mon Aug 31 02:49:57 MSK 2015	Music	VMAs 2015: Nicki Minaj calls Miley Cyrus 'bitch' on stage at MTV awards	[MTV VMAs 2015, Music, World news, US news, Culture, Miley Cyrus, Nicki Minaj, Taylor Swift]
Mon Aug 31 02:40:57 MSK 2015	Australia news	Human rights act 'to head off Newman excess' supported by Queensland Labor	[Queensland, Human rights, Queensland politics, Australian trade unions, Australia news, Australian law]
Mon Aug 31 02:36:33 MSK 2015	World news	Transfield named Coalition's 'preferred tenderer' for Manus and Nauru centres	[Nauru, Manus Island, Australian immigration and asylum, Australia news, Asia Pacific, Coalition, Australian politics]
Mon Aug 31 02:24:29 MSK 2015	Film	Wes Craven, Nightmare on Elm Street and Scream director, dies at 76	[Wes Craven, Horror, Film, Culture, US news, California]
Mon Aug 31 01:50:13 MSK 2015	Australia news	Arthur Sinodinos says Abbott ministers leaking on Hockey should be sacked	[Australian politics, Joe Hockey, Arthur Sinodinos, Coalition, Liberal party, Australia news, Scott Morrison]
Mon Aug 31 01:23:34 MSK 2015	Comment is free	Australia's treatment of asylum seekers was bound to lead to something like Border Force | Richard Flanagan	[Australian immigration and asylum, Richard Flanagan, Australia news, World news, Australian police and policing, Melbourne, Australian security and counter-terrorism, Victoria, Peter Dutton, Australian politics, Coalition, Tony Abbott, Australian law, Liberal party]
Mon Aug 31 01:19:24 MSK 2015	Sport	Adam Goodes: more booing but Eddie McGuire says message getting through	[Adam Goodes, AFL, Sydney Swans, Australia sport, Australian rules football, St Kilda, Sport, Australia news]
Mon Aug 31 01:09:13 MSK 2015	Business	It's a weak ray of sunshine trying to disperse dark clouds over mining sector	[Business, Australian economy, Mining, Joe Hockey, Australian politics, Australia news]
Sun Aug 30 23:42:13 MSK 2015	Music	Greg Gould tells his fans: I'm gay and I'm backing marriage equality	[Pop and rock, LGBT rights, Culture, Music, Australian television, Australian media, Marriage equality (Australia), Australia news]
Sun Aug 30 23:27:19 MSK 2015	World news	Cambodia deal doomed after just four Nauru refugees resettled for $55m	[Cambodia, Australian immigration and asylum, Australia news, Refugees, Asia Pacific, Australian politics, Nauru, Labor party, Coalition, Peter Dutton, United Nations]
Sun Aug 30 23:05:00 MSK 2015	Football	You are the Ref No337: Claudio Ranieri	[Laws of football, Sport, Football]
Sun Aug 30 23:01:18 MSK 2015	Media	National newspaper rivals launch £3m campaign to fight ad slump	[National newspapers, Newspapers, Newspapers & magazines, Advertising, Media]
Sun Aug 30 23:01:18 MSK 2015	World news	Osborne announces £500m for Faslane and says Corbyn threatens UK security	[Nuclear weapons, Royal Navy, Defence policy, Scotland, Military, Politics, UK news, George Osborne, Ministry of Defence]
Sun Aug 30 23:01:18 MSK 2015	Society	Hangovers deprive drinkers of 22 hours of summer, Dryathlon charity finds	[Alcohol, Health, Society, Cancer, UK news]
Sun Aug 30 23:00:00 MSK 2015	Crosswords	Quick crossword No 14,137	[Crosswords]
Sun Aug 30 23:00:00 MSK 2015	Crosswords	Quiptic crossword No 824	[Crosswords]
Sun Aug 30 23:00:00 MSK 2015	Crosswords	Cryptic crossword No 26,664	[Crosswords]
Sun Aug 30 22:57:00 MSK 2015	Sport	Dafne Schippers’ world championship success should not mean instant suspicion | Sean Ingle	[World Athletics Championships, Drugs in sport, Athletics, Sport]
Sun Aug 30 22:49:00 MSK 2015	Sport	Scotland’s longstanding injuries plague Vern Cotter’s decision making	[Scotland rugby union team, Rugby union, Sport, Italy rugby union team, Rugby World Cup, Rugby World Cup 2015]
Sun Aug 30 22:19:00 MSK 2015	Sport	England’s Chris Robshaw urges team to regain momentum against Ireland	[England rugby union team, Rugby World Cup, Rugby union, Sport, Rugby World Cup 2015, Chris Robshaw]
Sun Aug 30 22:03:00 MSK 2015	Football	Eddie Howe sticks to Bournemouth’s passing principles despite costly late slip	[Premier League, Bournemouth, Leicester City, Football, Sport]
Sun Aug 30 21:57:14 MSK 2015	Art and design	The Goods Line: it's no High Line, but a welcome green corridor for Sydney	[Architecture, Sydney, Australia news, Art and design, New South Wales, Culture, Urbanisation, Cities]
Sun Aug 30 21:54:00 MSK 2015	Football	Arsenal’s Wenger and Newcastle’s McClaren need strikers, and quickly	[Premier League, Newcastle United, Manchester United, Football, Sport]
Sun Aug 30 21:47:00 MSK 2015	Football	Chelsea shortcomings exposed by energy and motivation of Crystal Palace	[Premier League, Chelsea, Crystal Palace, Football, Sport]
Sun Aug 30 21:36:00 MSK 2015	Football	Tim Sherwood urges Aston Villa’s Gabriel Agbonlahor to show bottle	[Premier League, Aston Villa, Sunderland, Football, Sport]
Sun Aug 30 21:30:17 MSK 2015	Football	Manuel Pellegrini looking relaxed at record-breaking Manchester City	[Manchester City, Football, Raheem Sterling, Sport, Premier League]
Sun Aug 30 21:30:17 MSK 2015	Football	West Brom’s Tony Pulis sees patience rewarded after Stoke see red	[Premier League, Stoke City, West Bromwich Albion, Football, Sport]
Sun Aug 30 21:30:17 MSK 2015	Football	Hartlepool’s August optimism dented by un-neighbourly Carlisle United | Jeremy Alexander	[League Two, Hartlepool, Carlisle, Football, Sport]
