Mon Aug 31 16:30:21 MSK 2015	Global	Isis karaoke: satire’s answer to hate preachers with microphones	[Islamic State, World news, Comedy, Music, Culture, Twitter, Media, Internet]
Mon Aug 31 16:29:01 MSK 2015	Football	David de Gea in limbo after missed deadline threatens Real Madrid move	[Manchester United, Real Madrid, Transfer window, Football, Sport]
Mon Aug 31 16:24:44 MSK 2015	Technology	Testing Favor: app aims to bring users whatever they need – but does it deliver?	[Apps, Canada, Austin, Texas, Technology, US news, World news, Americas]
Mon Aug 31 16:12:30 MSK 2015	UK news	Family pay tribute to triathlete who went missing during Kent race	[UK news, Triathlon, Fitness]
Mon Aug 31 16:02:29 MSK 2015	Science	Did you solve it? Professor Povey's perplexing problem	[Mathematics, Mathematics, Physics, Physics, Education, Science, Chess]
Mon Aug 31 15:59:55 MSK 2015	Life and style	A shed of one’s own: how women are reclaiming the garden	[Women, Work & careers, Life and style, Business]
Mon Aug 31 15:57:35 MSK 2015	World news	Battle of Britain was won as much by German ineptitude as British heroism	[Second world war, Royal Air Force, Military, UK news, Winston Churchill, Adolf Hitler, Politics past]
Mon Aug 31 15:55:22 MSK 2015	Football	Borussia Dortmund sign Adnan Januzaj on season’s loan from Manchester United	[Borussia Dortmund, Manchester United, Bundesliga, European club football, Football, Sport]
Mon Aug 31 15:54:15 MSK 2015	Books	Terry Pratchett's books are the opposite of 'ordinary potboilers'	[Terry Pratchett, Fiction, Books, Culture, Fantasy, Jane Austen]
Mon Aug 31 15:52:28 MSK 2015	World news	Ukrainian guardsman killed in protests against vote on rebel autonomy	[Ukraine, Russia, Europe, World news]
Mon Aug 31 15:47:32 MSK 2015	Stage	Passion, pain and Picasso: the ballet bringing his Three Dancers to life	[Dance, Pablo Picasso, Art and design, Culture, Stage, Rambert Dance Company, Ballets Russes, Ballet]
Mon Aug 31 15:46:22 MSK 2015	Business	US stock markets finish down to close out worst August in three years	[US markets, Stock markets, Federal Reserve, US news, China, World news, Business, US economy]
Mon Aug 31 15:42:33 MSK 2015	Comment is free	Why I swam across the Mediterranean in solidarity with refugees | Nina Hall	[Refugees, World news, Europe, UK news, Greece, Syria, Middle East and North Africa, United Nations]
Mon Aug 31 15:39:49 MSK 2015	Life and style	Festival de la Poutine: Quebec celebrates cheesy fries, gravy and music	[Food & drink, Quebec, Life and style, Canada, World news, Americas]
Mon Aug 31 15:31:14 MSK 2015	Television & radio	Fall TV report cards: which networks need to do some serious homework?	[US television, NBC, ABC, Fox, CBS, Media, Culture, Television, Television & radio]
Mon Aug 31 15:15:04 MSK 2015	Comment is free	Required gun insurance would put two powerful lobbies at odds. We'd benefit | David Ferguson	[US gun control, Insurance industry, Health insurance, NRA]
Mon Aug 31 15:01:43 MSK 2015	Sport	Horse racing tips: Tuesday 1 September	[Horse racing tips, Horse racing, Sport]
Mon Aug 31 14:54:46 MSK 2015	Film	Max & Lenny review – friendship and rap bask in the Mediterranean hood	[Film, Drama, Culture, Festivals, World cinema, France, Europe, World news]
Mon Aug 31 14:49:14 MSK 2015	Film	The Next Generation Patlabor: Tokyo War review – beyond the uncanny valley	[Film, Culture, Action and adventure, Japan, Anime, Asia Pacific, World news, Festivals]
Mon Aug 31 14:47:30 MSK 2015	Football	Eibar, joint-leaders of La Liga despite being relegated last season | Sid Lowe	[La Liga, European club football, Eibar, Football, Sport]
Mon Aug 31 14:43:31 MSK 2015	Sport	Mark Webber and Porsche take win at Six Hours of Nürburgring	[Mark Webber, World Endurance Championship, Motor sport, Australia sport, Sport]
Mon Aug 31 14:42:45 MSK 2015	Music	The playlist – new bands: Vogue Dots, Gold Celeste, Palace Winter and more	[Music, Pop and rock, Indie, Electronic music, Culture]
Mon Aug 31 14:42:21 MSK 2015	World news	Indecision replaces hope in buildup to Greek elections	[Greece, Syriza, Europe, World news, Alexis Tsipras, Eurozone, European Union]
Mon Aug 31 14:37:44 MSK 2015	UK news	Republican trio jailed for total of 38 years over UDA murder plot	[Scotland, UK news, Northern Ireland, Crime]
Mon Aug 31 14:35:38 MSK 2015	Television & radio	Sign of the times: how Show Me a Hero captures our political mood	[Television, Culture, Television & radio, Drama, The Wire, HBO, US television, US television industry, Media, Television industry, Crime drama, Politics]
Mon Aug 31 14:34:27 MSK 2015	Politics	DUP to call for revival of Northern Ireland ceasefire monitoring system	[Democratic Unionist party (DUP), Northern Ireland, Northern Irish politics, Ulster Unionist Party (UUP), UK news, IRA, UK security and counter-terrorism, Politics]
Mon Aug 31 14:33:23 MSK 2015	UK news	Sarah Ferguson’s busy summer: shopping channels and Swiss chalets	[Sarah Ferguson, Monarchy, UK news]
Mon Aug 31 14:30:48 MSK 2015	Comment is free	We in Alaska see that climate change is real. The time to act is now | Othniel Art Oomittuk	[Climate change, Arctic, Alaska, Obama administration, Royal Dutch Shell, Oil, Oil spills]
Mon Aug 31 14:22:43 MSK 2015	Comment is free	With so many Republicans vying for the wingnut vote, it was only a matter of time before one solved immigration	[US politics, Politics, UK news, US news, Donald Trump, Republicans, Immigration and asylum]
Mon Aug 31 14:19:45 MSK 2015	Sport	Washington to start Kirk Cousins, not Robert Griffin III, for Dolphins opener	[Robert Griffin III, NFL, Sport, US sports, Washington (NFL team)]
Mon Aug 31 14:17:35 MSK 2015	Business	Pfizer resists calls for greater clinical trial transparency	[Pfizer, Pharmaceuticals industry, Business, Drugs, Science]
Mon Aug 31 14:15:03 MSK 2015	Comment is free	Trump's immigration plan would require every Latino to show their papers, please | Julio Ricard Varela	[]
Mon Aug 31 14:13:22 MSK 2015	Books	Books kept me alive in prison	[Society, Books, Culture, Prisons and probation, UK criminal justice, Society]
Mon Aug 31 14:11:44 MSK 2015	Society	Dabbing: the ‘cannabis crack’ that makes skunk seem weak	[Cannabis, Drugs, Society, Health & wellbeing, Life and style]
Mon Aug 31 14:07:13 MSK 2015	Comment is free	Jeremy Corbyn’s first move as leader? Remove the Labour whip | Julian Baggini	[Jeremy Corbyn, Labour party leadership, House of Commons, Labour, Politics, UK news]
Mon Aug 31 14:05:13 MSK 2015	Politics	Spin-doctored wellies, sweary texts and other lessons from a new David Cameron biography	[David Cameron, Conservatives, Politics, Politics, Books]
Mon Aug 31 14:00:03 MSK 2015	Children's books	Girl, Missing by Sophie McKenzie – review	[Children and teenagers, Books, Culture, Teen books, Adventure (children and teens), Friendship (children and teens)]
Mon Aug 31 13:58:33 MSK 2015	World news	French journalists accused of blackmailing Moroccan king claim entrapment	[France, Morocco, Europe, Journalist safety, Books, Media, Middle East and North Africa, Africa, World news, Culture]
Mon Aug 31 13:58:31 MSK 2015	UK news	Lord Montagu of Beaulieu	[UK news, Museums, Conservatives, Rural affairs, LGBT rights, Motoring, Technology, Automotive industry, Conservation, John Osborne, Media]
Mon Aug 31 13:38:38 MSK 2015	Music	Sufjan Stevens review – songs of death delivered with high-wire intensity	[Sufjan Stevens, Edinburgh festival 2015, Pop and rock, Folk music, Culture, Music, Bereavement, Edinburgh festival, Festivals]
Mon Aug 31 13:38:31 MSK 2015	Society	John Winkler obituary	[GPs, NHS, Health, Society]
Mon Aug 31 13:35:33 MSK 2015	Music	Miley Cyrus & Her Dead Petz: first-listen review – leaving her wrecking ball behind	[Miley Cyrus, Music, Culture, Pop and rock, The Flaming Lips, MTV VMAs 2015]
Mon Aug 31 13:28:14 MSK 2015	Comment is free	There’s only one reason for this badger cull – votes | Patrick Barkham	[Badgers, Wildlife, Animals, Environment, Bovine tuberculosis, Rural affairs, Farming, Animal welfare, UK news, Green politics, Conservatives, Politics]
Mon Aug 31 13:26:36 MSK 2015	Stage	Max and Ivan at Edinburgh festival review – vivid cast of comedy eccentrics	[Edinburgh festival 2015, Comedy, Stage, Culture, Edinburgh festival, Festivals, Comedy]
Mon Aug 31 00:48:43 MSK 2015	Media	New York reporter strips off for a piece of undercover journalism	[New York Post, Media, Newspapers, US news, New York, Women, NYPD]
Mon Aug 31 00:48:16 MSK 2015	Comment is free	Nicki Minaj has something serious to say about race. We should listen to her | Suzanne Moore	[Women, Nicki Minaj, Race issues, Music, Miley Cyrus, Kanye West, Taylor Swift, World news, Life and style]
Mon Aug 31 00:44:02 MSK 2015	Sport	Natalie Sciver leads England to T20 consolation Ashes win over Australia	[Women's Ashes, England women's cricket team, Southern Stars, Australia sport, Sport]
Mon Aug 31 00:40:48 MSK 2015	Life and style	Why you should forget ‘nutraceuticals’ and focus on a healthy diet instead	[Food science, Food & drink, Life and style, Science, Food & drink industry, Business]
Mon Aug 31 00:35:19 MSK 2015	Comment is free	Chrissie Hynde is a heroine to me, but she is so wrong on victim blaming | Rhiannon Lucy Cosslett	[Rape, Chrissie Hynde, World news, UK news, Sunday Times, Society, Gender, Women, Life and style]
Mon Aug 31 00:29:10 MSK 2015	Business	Maersk Oil's Culzean gasfield given go-ahead	[Oil, Business, Gas, Commodities]
Mon Aug 31 00:25:12 MSK 2015	Music	Ratking review – hip-hop's mellow punks spark and crackle	[Hip-hop, Music, Rap, Culture, Pop and rock]
Mon Aug 31 00:22:02 MSK 2015	World news	Thai police pay themselves £55,000 reward for bombing arrest	[Thailand, Asia Pacific, World news]
Mon Aug 31 00:17:48 MSK 2015	World news	Chinese reporter makes on-air 'confession' after market chaos	[China, Stock markets, Censorship, Asia Pacific, Business, World news]
Mon Aug 31 00:16:45 MSK 2015	Music	Leeds festival review – Metallica reign in the sun and Foals play a storming secret set	[Reading and Leeds festival, Pop and rock, Music, Culture, Festivals, Music festivals, Metallica, Foals, Kendrick Lamar, The Libertines, Alt-J, Slaves]
Mon Aug 31 00:15:30 MSK 2015	World news	Temple of Bel still standing, says Syria's antiquities chief	[Syria, Religion, Architecture, Islamic State, Middle East and North Africa, Archaeology]
Mon Aug 31 00:14:41 MSK 2015	Sport	Dancing, onesies, magicians ... is baseball in danger of becoming fun?	[Chicago Cubs, MLB, Baseball, US sports, Sport]
Mon Aug 31 00:08:48 MSK 2015	Television & radio	Harry Enfield and Paul Whitehouse: a double act that gets better with age	[Television, Harry Enfield, Comedy, Comedy, Culture, Television & radio]
Mon Aug 31 00:03:01 MSK 2015	Music	San Francisco Symphony/Tilson Thomas review – Jeremy Denk is all fists on the piano … in a good way	[BBC Proms 2015, Classical music, Music, Culture, Proms, Festivals, Music festivals]
Mon Aug 31 00:00:00 MSK 2015	World news	In Paraguay's remote north guerrillas are still at large, armed and dangerous	[Paraguay, World news, Americas]
Mon Aug 31 11:58:50 MSK 2015	Sport	Silvestre de Sousa on top of the pile after riding the highs and lows	[Horse racing, Sport]
Mon Aug 31 11:58:47 MSK 2015	Football	Manchester United’s Javier Hernández joins Bayer Leverkusen	[Manchester United, Bayer Leverkusen, Bundesliga, Transfer window, Football, Sport]
Mon Aug 31 11:57:44 MSK 2015	Business	Burma's minimum wage pledge welcomed by UK retailers	[Retail industry, Employment, Business, Global development, South and Central Asia, World news, Myanmar]
Mon Aug 31 11:51:38 MSK 2015	Football	Chelsea close in on £2.7m deal for Nantes defender Papy Djilobodji	[Chelsea, Nantes, Transfer window, Football, Sport]
Mon Aug 31 11:41:55 MSK 2015	Books	Günter Grass criticises refugee treatment from beyond the grave	[Günter Grass, Refugees, Germany, Books, World news, Migration, Culture, Europe]
Mon Aug 31 11:41:49 MSK 2015	Sport	Talking Horses: Monday’s best bets plus the latest racing news	[Victoria Pendleton, Horse racing tips, Horse racing, Sport]
Mon Aug 31 11:39:46 MSK 2015	World news	Japan plans largest ever defence budget to counter China's reach	[Japan, Asia Pacific, World news, China, Senkaku Islands]
Mon Aug 31 11:30:01 MSK 2015	US news	Why border walls – even with Canada – are not the Republicans' Trump card	[US immigration, US elections 2016, US politics, US news, Republicans, Donald Trump, Scott Walker, Jeb Bush, Ben Carson, World news, Mexico, Canada, Americas]
Mon Aug 31 11:29:56 MSK 2015	Film	Can Michael Fassbender's Assassin's Creed save the video game movie?	[Film, Michael Fassbender, Culture, Games, Assassin's Creed, Technology, Action and adventure, Science fiction and fantasy]
Mon Aug 31 11:25:51 MSK 2015	Sport	Wales name Samson Lee and Liam Williams in Rugby World Cup squad	[Wales rugby union team, Rugby World Cup 2015, Rugby World Cup, Rugby union, Sport]
Mon Aug 31 11:23:47 MSK 2015	Football	Anthony Martial leaves France squad to join Manchester United for £36m	[Manchester United, Monaco, Transfer window, France, Football, Sport]
Mon Aug 31 11:00:01 MSK 2015	Children's books	Why my alternative second world war story is from a female point of view	[Children and teenagers, Books, Culture, Teen books, Second world war, Fiction, Nazism, History, Women]
Mon Aug 31 11:00:00 MSK 2015	Children's books	The Death Cure by James Dashner – review	[Children and teenagers, Books, Culture, Teen books, Adventure (children and teens), Sci-fi (children and teens), Dystopian fiction (children and teens)]
Mon Aug 31 11:00:00 MSK 2015	Cities	The magic of Montréal's metro – in pictures	[Cities, Architecture, Design, Montreal, Canada, Instagram, Art and design, Canada, Culture, North and Central America, Travel]
Mon Aug 31 11:00:00 MSK 2015	US news	Alcohol sales get higher after weed legalization contrary to industry fears	[Colorado, Alcohol, Cannabis, Business, US news]
Mon Aug 31 11:00:00 MSK 2015	Television & radio	Matthew Rhys’s favourite TV	[Television, Television & radio, Culture]
Mon Aug 31 11:00:00 MSK 2015	World news	Escape casts spotlight on Washington use of juvenile inmates to fight wildfires	[Wildfires, US prisons, Washington state, California, US news, World news]
Mon Aug 31 10:53:53 MSK 2015	World news	Syrian family said to be among refugees suffocated in lorry	[Migration, Austria, Hungary, Europe, World news]
Mon Aug 31 10:49:28 MSK 2015	Music	The Moonlandingz review – fictional band stalked by Maxine Peake prove exciting in flesh	[Pop and rock, Music, Culture, Maxine Peake, Electronic music]
Mon Aug 31 10:49:07 MSK 2015	Books	The Swimmer by John Cheever – into a suburban darkness	[John Cheever, Books, Culture, Fiction, Short stories]
Mon Aug 31 10:45:20 MSK 2015	Comment is free	Serena Williams is the best because of her brains – not just her body | Patrick A Wilson	[Serena Williams, Race issues, Sport, Tennis, Women, US sports, US Open tennis, US Open 2015]
Mon Aug 31 10:45:18 MSK 2015	Film	James Bond author Anthony Horowitz lambasts recent films	[Film, James Bond, Culture, Thriller, Skyfall, Spectre, Quantum of Solace, Daniel Craig, Film adaptations, Books, Idris Elba, Children and teenagers, Action and adventure]
Mon Aug 31 10:41:15 MSK 2015	Art and design	Get real. Terry Pratchett is not a literary genius	[Art and design, Books, Terry Pratchett, Culture]
Mon Aug 31 10:40:28 MSK 2015	Sport	New York Red Bulls have plenty to thank their rivals for	[MLS, Montreal Impact, New York City FC, Football, Sport, US sports, Seattle Sounders, New York Red Bulls, DC United, San Jose Earthquakes, LA Galaxy]
Mon Aug 31 10:22:27 MSK 2015	Football	Juventus rocked by Roma defeat which sees them roll to bottom of Serie A | Paolo Bandini	[Serie A, European club football, Juventus, Roma, Football, Sport]
Mon Aug 31 10:14:03 MSK 2015	Music	Evian Christ was 'not in a very good state' when he was detained at Leeds festival	[Reading and Leeds festival, Music, Pop and rock, Culture, Festivals, Music festivals]
Mon Aug 31 10:03:10 MSK 2015	Film	Phantom review – India's Jack Bauer blows diplomacy out of the water	[Bollywood, Film, Mumbai terror attacks, India, Culture, South and Central Asia, World news]
Mon Aug 31 10:00:10 MSK 2015	Environment	Citi report: slowing global warming would save tens of trillions of dollars | Dana Nuccitelli	[Climate change scepticism, COP 21: UN climate change conference | Paris, Climate change, Environment, Carbon tax, Greenhouse gas emissions, Economic policy, Climate change, Politics, US economic growth and recession, Economics]
Mon Aug 31 10:00:07 MSK 2015	UK news	George Osborne making 'wrong moral choice' on nuclear weapons	[Trident, Nuclear weapons, Defence policy, Scotland, Scottish politics, George Osborne, Politics, UK news, Tax and spending, Military]
Mon Aug 31 09:55:49 MSK 2015	World news	Austria defends border checks amid migration crisis	[Migration, Austria, Europe, World news]
Mon Aug 31 09:51:25 MSK 2015	Comment is free	He's staying! No-bias Dyson Heydon slices his reasons deli-thin | Richard Ackland	[Royal commission into trade union governance and corruption, Australia news, Australian law, Australian politics, Australian trade unions]
Mon Aug 31 09:42:07 MSK 2015	Comment is free	Don’t call me a neurotic, I prefer ‘original thinker’ | Fay Schopen	[Mental health, Society, UK news, Psychology, Science, Neuroscience]
Mon Aug 31 09:41:03 MSK 2015	Technology	Tidal takes shot at Apple after block on live stream of Drake festival set	[Apple Music, Tidal, Apple, Drake, Technology, Music, Culture, Digital music and audio]
Mon Aug 31 09:36:17 MSK 2015	Books	Poem of the week: from The Bard. A Pindaric Ode by Thomas Gray	[Poetry, Books, Culture]
Mon Aug 31 09:30:57 MSK 2015	Music	Five albums to try this week: Beach House, Yo La Tengo and more	[Music, Culture, Pop and rock, Motorhead, Americana, Indie, Yo La Tengo, The Weeknd, R&B]
Mon Aug 31 09:27:18 MSK 2015	Music	Miley Cyrus releases surprise new album featuring Ariel Pink and Wayne Coyne	[Miley Cyrus, Music, MTV VMAs 2015, Pop and rock, Culture]
Mon Aug 31 09:16:54 MSK 2015	Politics	First minister criticises UUP for quitting Northern Ireland's power-sharing deal	[Northern Irish politics, Northern Ireland, Democratic Unionist party (DUP), Ulster Unionist Party (UUP), Politics, UK news, Sinn Féin, IRA, UK security and counter-terrorism]
Mon Aug 31 09:16:47 MSK 2015	Environment	Queensland 'relying on meanie greenies' to oppose Acland coal plan	[Mining, Queensland, Mining, Environment, Annastacia Palaszczuk, Queensland politics, Labor party, Coalition, Coal, Fossil fuels, Activism]
Mon Aug 31 09:08:31 MSK 2015	Technology	Twitter publishes targets for a 'more diverse' workforce in 2016	[Twitter, Technology, Internet, Social networking, Business, Women, Race issues, Media]
Mon Aug 31 09:00:11 MSK 2015	Global development	An African story, told through the lives of 10 children born in 2005 | Sam Jones	[Global development, Millennium development goals, Education, Health, Infant and child mortality, Africa, World news]
Mon Aug 31 09:00:11 MSK 2015	Football	Louis van Gaal’s quest for control brings scant consolation at Swansea | Jonathan Wilson	[Manchester United, Louis van Gaal, Swansea City, Football, Sport]
Mon Aug 31 09:00:10 MSK 2015	Global development	Africa's children: how to donate	[Global development, Africa, Infant and child mortality, Millennium development goals, Ghana, Tanzania, Democratic Republic of the Congo, South Africa, South Sudan, Nigeria, Malawi, Uganda, Kenya, Zambia]
Mon Aug 31 09:00:10 MSK 2015	Global development	A Kenyan child's tale: Debrah Matei Mwololo at 10 years old | Murithi Mutiga	[Global development, Millennium development goals, Education, Infant and child mortality, Kenya, Africa, World news, Health]
Mon Aug 31 09:00:10 MSK 2015	Global development	Africa's children: 10 years on – interactive	[Global development, Millennium development goals, Education, Health, World news, Africa]
Mon Aug 31 09:00:10 MSK 2015	Football	Interview: Danny Williams happy to be in three worlds as USMNT career resumes	[USA, Reading, US sports, Football, Sport]
Mon Aug 31 09:00:10 MSK 2015	Global development	A Ghanaian child's tale: Hannah Adzo Klutsey at 10 years old | Sam Jones	[Global development, Millennium development goals, Ghana, Africa, World news, Education, Infant and child mortality, Health]
Mon Aug 31 09:00:09 MSK 2015	Global development	A Nigerian child's tale: Confidant Danjuma Martins at 10 years old | Isaac Abrak	[Global development, Millennium development goals, Education, Nigeria, Infant and child mortality, Africa, World news, Health]
Mon Aug 31 09:00:09 MSK 2015	Global development	A Tanzanian child's tale: Zainab Salehe Abu at 10 years old | Sam Jones	[Global development, Millennium development goals, Tanzania, Africa, Education, World news, Infant and child mortality, Health]
Mon Aug 31 09:00:09 MSK 2015	Global development	A Congolese child's tale: David Dieumerci Lewis at 10 years old | Aaron Ross	[Global development, Millennium development goals, Infant and child mortality, Democratic Republic of the Congo, Education, Africa, World news, Health]
Mon Aug 31 09:00:09 MSK 2015	Global development	A Ugandan child's tale: Wyclif Kukiriza at 10 years old | Liz Ford	[Global development, Millennium development goals, Uganda, Africa, World news, Education, Infant and child mortality, Health]
Mon Aug 31 09:00:08 MSK 2015	Global development	A South African child's tale: Angel Siyavuya Swartbooi at 10 years old | David Smith	[Global development, Millennium development goals, South Africa, Africa, World news, Infant and child mortality, Education, Health]
Mon Aug 31 09:00:08 MSK 2015	Global development	A Malawian child's tale: Innocent Smoke at 10 years old | John Vidal	[Global development, Millennium development goals, Malawi, Africa, World news, Infant and child mortality, Education, Health]
Mon Aug 31 08:50:53 MSK 2015	Football	Construction workers at Russian World Cup stadium complain of not being paid	[World Cup 2018, Russia, Europe, Football, Sport, World Cup, World news]
Mon Aug 31 08:44:06 MSK 2015	Media	Mozambique journalist is shot dead while jogging	[Media, Press freedom, Journalist safety, Human rights, Mozambique, Africa, Digital media, World news, Newspapers]
Mon Aug 31 08:28:12 MSK 2015	Australia news	Australia's deal to resettle asylum seekers in Cambodia goes flat	[Australian immigration and asylum, Australia news, Cambodia, Scott Morrison, Peter Dutton, Julie Bishop, Tony Abbott, Coalition, Manus Island, Papua New Guinea, Asia Pacific]
Mon Aug 31 08:11:07 MSK 2015	Environment	Five near-blind monk seals become ambassadors for vanishing species	[Conservation, Hawaii, Marine life, Environment, Endangered species, Animals, US news, Wildlife, World news, Oceans]
Mon Aug 31 08:09:45 MSK 2015	Australia news	Border force launches internal review in wake of 'badly worded' press release	[Australian immigration and asylum, Australia news, Australian politics, Victoria, Melbourne, Peter Dutton]
Mon Aug 31 08:05:25 MSK 2015	Film	Universal makes a minion of the competition in 2015's summer battle	[Film, Culture, Pixels, Universal Pictures, Warner Bros, Minions, Jurassic World, Fast & Furious 7, Mad Max: Fury Road]
Mon Aug 31 08:01:51 MSK 2015	Australia news	Dyson Heydon rejects call to disqualify himself from union royal commission	[Royal commission into trade union governance and corruption, Australian trade unions, Australia news, Australian politics, George Brandis, Labor party]
Mon Aug 31 08:01:16 MSK 2015	Film	Wes Craven: the mainstream horror maestro inspired by Ingmar Bergman	[Wes Craven, Horror, Film, Culture, Ingmar Bergman]
Mon Aug 31 08:00:08 MSK 2015	Children's books	What it's like to top banned book lists around the world	[Children and teenagers, Books, Culture, Children's books: 8-12 years, Children's books: 7 and under, Censorship, Libraries, Funny books (children and teens), Literacy]
Mon Aug 31 08:00:08 MSK 2015	Sport	Rugby World Cup warm-ups: talking points from the weekend action	[Rugby World Cup 2015, Canada rugby union team, Japan rugby union team, Scotland rugby union team, Uruguay rugby union team, Italy rugby union team, Samoa rugby union team, Rugby World Cup, Rugby union, Sport]
Mon Aug 31 08:00:07 MSK 2015	Television & radio	Catch-up TV guide: from Public Morals to Narcos	[Television, Television & radio, Culture]
Mon Aug 31 08:00:07 MSK 2015	Children's books	Close to the Wind by Jon Walter – review	[Children and teenagers, Books, Culture, Children's books: 8-12 years, Friendship (children and teens), War (children and teens)]
Mon Aug 31 08:00:07 MSK 2015	Guardian Sustainable Business	What can a South Sudan brewery teach us about business in conflict zones?	[Guardian sustainable business, Beer, Food & drink, South Sudan, Africa, Business, SABMiller, Conflict and development, Global development, Life and style, World news]
Mon Aug 31 07:54:14 MSK 2015	Media	Press freedom groups demand release of journalists held in Turkey	[Media, Press freedom, Human rights, Turkey, Vice Media, Journalist safety, The Guardian, The Independent, Kurds, Recep Tayyip Erdoğan, World news, Europe, Islamic State]
Mon Aug 31 07:52:47 MSK 2015	World news	Ban Ki-moon rejects Japanese criticism of him attending China's Victory Day	[Ban Ki-moon, China, Japan, Asia Pacific, World news, United Nations, Second world war]
Mon Aug 31 07:42:01 MSK 2015	Life and style	How was your weekend running?	[Life and style, Running, Fitness]
Mon Aug 31 07:39:17 MSK 2015	Football	Football transfer rumours: Manchester United in £36m move for Monaco’s Anthony Martial?	[Football, Transfer window, Sport]
Mon Aug 31 07:33:54 MSK 2015	Music	VMAs 2015: Kanye punts for president as Minaj takes on Miley	[MTV VMAs 2015, Kanye West, Taylor Swift, Nicki Minaj, Music, US news, MTV, Awards and prizes, Culture]
