Tue Sep 15 22:51:57 MSK 2015	UK news	Woman stabbed to death at home while her children slept	[UK news]
Tue Sep 15 22:48:36 MSK 2015	Football	Manuel Pellegrini points finger at Manchester City’s stumbling strikers	[Manchester City, Manuel Pellegrini, Raheem Sterling, Vincent Kompany, Juventus, Champions League, Football, Sport]
Tue Sep 15 22:37:56 MSK 2015	World news	California wildfires: share your personal stories, photos and videos	[Wildfires, California, Drought, Environment, Natural disasters and extreme weather]
Tue Sep 15 22:30:09 MSK 2015	Society	Trans fat ban could save 7,200 lives by 2020, says study	[Health, Food & drink, Food & drink industry, Society, UK news]
Tue Sep 15 22:25:21 MSK 2015	Australia news	Man in critical condition after setting himself on fire in detention centre	[Australian immigration and asylum, Western Australia, Australia news]
Tue Sep 15 22:09:35 MSK 2015	UK news	Chief of defence staff concerned over lack of UK military support	[UK news]
Tue Sep 15 22:00:09 MSK 2015	Stage	Kinky Boots review – glamorously rebooted musical never drags	[Musicals, Stage, Culture, Theatre, Cyndi Lauper]
Tue Sep 15 22:00:09 MSK 2015	Environment	Arctic mosquitoes will increase with climate change, says study	[Insects, Climate change, Arctic, Wildlife, Animals, Environment, World news, Science, Zoology]
Tue Sep 15 21:56:04 MSK 2015	US news	Twelve Cuban migrants and one dog sail ashore on Miami Beach	[Florida, US news, Cuba, Americas, World news]
Tue Sep 15 21:47:47 MSK 2015	Film	London Fields review: Martin Amis gets the Guy Ritchie treatment	[Toronto film festival 2015, Toronto film festival, Culture, Film, Johnny Depp, Billy Bob Thornton, Festivals]
Tue Sep 15 21:32:00 MSK 2015	Film	Into the Forest review: Ellen Page lost in thorny apocalypse drama	[Toronto film festival 2015, Toronto film festival, Ellen Page, Festivals, Film, Culture]
Tue Sep 15 21:30:08 MSK 2015	Football	Chelsea’s José Mourinho seeks ‘different dynamic’ for visit of Maccabi	[Chelsea, Champions League, Maccabi Tel Aviv, José Mourinho, Sport, Football]
Tue Sep 15 21:30:08 MSK 2015	Football	West Ham to suffer £17m loss after summer of heavy spending	[West Ham United, David Sullivan, Football, Sport]
Tue Sep 15 21:21:43 MSK 2015	Television & radio	Shaun Micallef's new comedy dilemma: how to make Malcolm Turnbull funny?	[Comedy, Comedy, Culture, Television, Television & radio, Australian politics, Australia news, Coalition, Malcolm Turnbull]
Tue Sep 15 21:17:03 MSK 2015	World news	Canadian activists and artists back Leap Manifesto's call to end fossil fuel use	[Canada, Fossil fuels, Climate change, Energy, World news, Naomi Klein, Ellen Page, Rachel McAdams, Neil Young, Alanis Morissette, William Gibson, Michael Ondaatje, Leonard Cohen, Donald Sutherland]
Tue Sep 15 21:02:04 MSK 2015	Football	Juventus’s Paul Pogba eclipses City’s Yaya Touré in battle of midfield | Barney Ronay	[Manchester City, Juventus, Champions League, Football, Sport]
Tue Sep 15 21:01:28 MSK 2015	World news	Australia resists nuclear disarmament push because it relies on US deterrent	[Nuclear weapons, Australia news, Julie Bishop, Australian politics, Coalition, Freedom of information, US news, Austria, India, Pakistan, North Korea, Israel]
Tue Sep 15 21:00:08 MSK 2015	Sport	Rugby World Cup organisers say they are ready for Twickenham crowds	[Rugby World Cup 2015, Rugby World Cup, Rugby union, Sport]
Tue Sep 15 21:00:07 MSK 2015	Sport	England’s Jonathan Joseph and Joe Marler unburdened by World Cup hopes	[England rugby union team, Rugby World Cup 2015, Rugby World Cup, Rugby union, Sport]
Tue Sep 15 20:52:49 MSK 2015	Football	Álvaro Morata seals Juventus comeback to stun Manchester City	[Champions League, Manchester City, Juventus, Football, Sport]
Tue Sep 15 20:51:02 MSK 2015	Football	PSV 2-1 Manchester United: Champions League – as it happened	[Champions League, European club football, PSV Eindhoven, Manchester United, Football, Sport]
Tue Sep 15 20:47:38 MSK 2015	Football	Manchester United suffer Luke Shaw blow in defeat at PSV	[Champions League, PSV Eindhoven, Manchester United, Football, Sport]
Tue Sep 15 20:44:20 MSK 2015	Football	Manchester City v Juventus: Champions League – as it happened	[Champions League, European club football, Manchester City, Juventus, Football, Sport]
Tue Sep 15 20:40:25 MSK 2015	Film	The Family Fang review: Jason Bateman and Nicole Kidman are siblings with issues – likewise the film	[Toronto film festival 2015, Toronto film festival, Film, Culture, Festivals, Nicole Kidman, Christopher Walken]
Tue Sep 15 20:33:19 MSK 2015	Film	Mary Poppins: not sugary, but sharp and subversive – on the page and the screen	[Film, Culture, Musicals]
Tue Sep 15 20:30:08 MSK 2015	Sport	Australians Abroad: Luke Dorn, NRL discard to Super League sensation | John Davidson	[Rugby league, Australia sport, Super League, Super League XX, NRL, Sport]
Tue Sep 15 20:30:07 MSK 2015	Sport	A history of the Wallabies at the Rugby World Cup: part II | Aaron Timms	[Australia rugby union team, Rugby World Cup 2015, Rugby World Cup, Rugby union, Australia sport, Sport]
Tue Sep 15 20:12:32 MSK 2015	US news	General Grant tree, world's second-largest, is safe from California wildfires	[California, Wildfires, US news, US national and state parks holidays, United States]
Tue Sep 15 20:11:19 MSK 2015	Politics	Pressure on Labour over EU as union vote sounds alarm	[TUC, Labour, EU referendum, Trade unions, Jeremy Corbyn, European Union, Europe, Foreign policy, Politics, UK news, World news]
Tue Sep 15 20:10:13 MSK 2015	Film	At Toronto film festival, London directors call for more movies about the middle-class	[Toronto film festival 2015, Culture, Film, Toronto film festival, Festivals, Gentrification, Cities, London]
Tue Sep 15 20:00:06 MSK 2015	News	Corrections and clarifications	[]
Tue Sep 15 19:57:04 MSK 2015	Technology	Facebook working on 'dislike button', Zuckerberg says	[Facebook, Mark Zuckerberg, US news, World news, Social networking, Social media, Technology]
Tue Sep 15 19:51:04 MSK 2015	Technology	YouTube 'dancing baby' case prompts fair use ruling on copyrighted videos	[YouTube, Intellectual property, US news, Law, Technology]
Tue Sep 15 19:46:54 MSK 2015	US news	Bernie Sanders rejects 'vicious' attack over his support for UK Labour leader	[Democrats, Hillary Clinton, Bernie Sanders, US elections 2016, US politics, US news, Jeremy Corbyn, Politics, UK news, Labour, World news]
Tue Sep 15 19:41:00 MSK 2015	Sport	Rugby World Cup preview No15: Namibia	[Rugby World Cup 2015 previews, Rugby World Cup 2015, Rugby World Cup, Namibia rugby union team, Namibia, Africa, Sport, Rugby union]
Tue Sep 15 19:28:38 MSK 2015	World news	Refugees scramble for ways into Europe as Hungary seals borders	[Refugees, Migration, Hungary, Serbia, Syria, Europe, Middle East and North Africa, European Union, World news]
Tue Sep 15 19:25:46 MSK 2015	Politics	Jeremy Hunt breezes through MPs' health check	[Jeremy Hunt, Health policy, NHS, UK news, Health, Politics, Society, Public services policy]
Tue Sep 15 19:18:39 MSK 2015	World news	NGOs have nothing to fear in Ecuador | Letters	[Ecuador, Americas, World news]
Tue Sep 15 19:17:23 MSK 2015	World news	Houston reached out to refugees, so Europe can too | Letters	[Refugees, World news, Hurricane Katrina, US news, Migration, Europe]
Tue Sep 15 19:16:31 MSK 2015	Global	Lord Haw-Haw was good for a laugh | Letters	[Second world war, World news, Jeremy Corbyn, Labour, Politics, Conservatives, Manchester, Sheffield, UK news, David Bowie, Music]
Tue Sep 15 19:16:23 MSK 2015	Society	Burned-out NHS doctors in need of intensive care | Letters	[Doctors, Health, Society, NHS, Hospitals]
Tue Sep 15 19:16:13 MSK 2015	Life and style	Let’s put pushy parents in the sin-bin | Letters	[Parents and parenting, Family, Life and style, Rugby union]
Tue Sep 15 19:16:03 MSK 2015	Money	Baby boomers aren’t to blame for today’s workers’ woes | Letters	[Pensions, Money, Pay, Work & careers, Economic policy, Politics, Family finances, British Airways, Business]
Tue Sep 15 19:13:53 MSK 2015	Politics	Yvette Cooper to focus attention on response to refugee crisis	[Yvette Cooper, Labour, Politics, UK news, Refugees, Migration, Immigration and asylum, Europe, European Union, Jeremy Corbyn]
Tue Sep 15 19:13:52 MSK 2015	Football	Jack Wilshere setback casts cloud over Arsenal’s visit to Dinamo Zagreb	[Arsenal, Dinamo Zagreb, Jack Wilshere, Arsène Wenger, Champions League, Football, Sport]
Tue Sep 15 19:04:44 MSK 2015	UK news	City trader seeks £3.5m from US bank, alleging sexist behaviour drove her out	[UK news]
Tue Sep 15 19:02:10 MSK 2015	World news	North Korea's renewed nuclear threat keeps experts guessing	[North Korea, Nuclear weapons, Asia Pacific, World news]
Tue Sep 15 19:00:05 MSK 2015	US news	Women bear emotional and financial burden of incarceration, study finds	[US justice system, US prisons, US news, Race issues]
Tue Sep 15 18:57:35 MSK 2015	Business	Fuel price plunge pulls UK inflation back to 0%	[Inflation, Interest rates, Business, Economics, Deflation, Bank of England, Mark Carney, Office for National Statistics, Petrol prices, Economic growth (GDP), Economic recovery, TUC, Money, Motoring, Politics, UK news, Trade unions, Retail industry, Consumer spending]
Tue Sep 15 18:56:54 MSK 2015	Comment is free	The Guardian view on trade unions: part of the answer, not all of the problem | Editorial	[Trade unions, Politics, David Cameron, Conservatives, Jeremy Corbyn, Labour, George Osborne, Industrial action, UK news]
Tue Sep 15 18:56:07 MSK 2015	US news	California wildfires: stunning pictures and video from social media	[California, Wildfires, Natural disasters and extreme weather, US news, World news, Social media]
Tue Sep 15 18:52:37 MSK 2015	Business	Inflation collapse – should central banks raise interest rates or not?	[Inflation, Business, Economics, Federal Reserve, US economy, UK news]
Tue Sep 15 18:51:00 MSK 2015	Sport	England name Zafar Ansari in squad to play Pakistan – then injury strikes	[England cricket team, Surrey, Pakistan cricket team, County Championship Division Two, Cricket, Sport]
Tue Sep 15 18:50:06 MSK 2015	Politics	Dominic Grieve named chairman of intelligence and security committee	[Dominic Grieve, Politics, UK news, Conservatives, Law, Malcolm Rifkind]
Tue Sep 15 18:49:58 MSK 2015	Politics	Corbyn's TUC address shows Labour politics is a new game now	[Jeremy Corbyn, Politics, UK news, Labour, Labour party leadership, Trade unions, TUC]
Tue Sep 15 18:39:01 MSK 2015	Business	Glencore's reputation is still vulnerable despite fundraising	[Business, Office for Budget Responsibility, Goldman Sachs, IPOs, Commodities, Mining, Economics]
Tue Sep 15 18:36:32 MSK 2015	Environment	Help the Global Apollo Programme make clean energy cheaper than coal | Letter from David Attenborough, Brian Cox, Nicholas Stern and others	[Renewable energy, Green economy, Environment, Energy industry, Business, Energy, Energy research, Physics, Science, Energy, Technology]
Tue Sep 15 18:36:04 MSK 2015	Comment is free	The Guardian view on Malcolm Turnbull’s coup: back with a vengeance | Editorial	[Australia news, World news, Tony Abbott, Malcolm Turnbull]
Tue Sep 15 18:32:56 MSK 2015	Politics	Syria drone strikes: UK attorney general refuses to disclose advice	[Defence policy, Jeremy Wright, Foreign policy, Syria, Royal Air Force, Middle East and North Africa, Military, Politics, UK news, Counter-terrorism policy, UK security and counter-terrorism]
Tue Sep 15 18:22:19 MSK 2015	Business	Glencore launches $2.5bn fundraiser in drive to shore up finances	[Business, Mining, Commodities, Shares, UK news, World news]
Tue Sep 15 18:19:07 MSK 2015	Football	Anthony Martial almost misses Manchester United bus before debut	[Manchester United, Football, Sport]
Tue Sep 15 18:18:11 MSK 2015	Books	Charles Darwin letter repudiating the Bible heads to auction	[Books, Charles Darwin, Science, Culture]
Tue Sep 15 18:14:01 MSK 2015	Comment is free	This Faragism of the left will leave behind a loathing of all politics | Rafael Behr	[Labour, UK news, Jeremy Corbyn, Politics, Labour party leadership]
Tue Sep 15 18:10:27 MSK 2015	UK news	Historical child abuse investigators warned to be wary of 'fantasists'	[Police, UK news]
Tue Sep 15 18:00:22 MSK 2015	Media	BBC should give up EastEnders, says former Channel 4 chief	[BBC, Media, Television industry, Television & radio]
Tue Sep 15 17:49:53 MSK 2015	Film	Toronto 2015: Room adaptation doesn't directly reference Fritzl case, say film-makers	[Toronto film festival 2015, Toronto film festival, Film, Room, Festivals, Books, Culture, Film adaptations, Frank, Josef Fritzl, World news, Canada, Americas, Ireland, Europe]
Tue Sep 15 17:49:35 MSK 2015	Comment is free	The model for a leftwing resurgence? Evangelical Christianity | George Monbiot	[Politics, Evangelical Christianity, Jeremy Corbyn, Religion, Christianity, Brazil, Americas, Labour, Society, UK news, World news]
Tue Sep 15 17:45:11 MSK 2015	World news	Feminazi: the go-to term for trolls out to silence women	[Feminism, Equality, Society, Women, Life and style, UK news, Tim Hunt]
Tue Sep 15 17:43:09 MSK 2015	Film	The Dressmaker - Kate Winslet is stitched up in oddball revenge drama	[Toronto film festival 2015, Toronto film festival, Festivals, Culture, Film, Kate Winslet, Australia news]
Tue Sep 15 17:39:47 MSK 2015	Sport	Michael Yardy ‘a bit emotional’ after century for Sussex against Somerset	[County Championship Division One, Sussex, Somerset, Cricket, Sport]
Tue Sep 15 17:28:33 MSK 2015	Politics	Government sees off rebellion to win vote on working tax credit cuts	[Welfare, Tax credits, Labour, Conservatives, Politics, UK news, Jeremy Corbyn, Benefits, Society, State benefits, Money]
