Thu Aug 27 10:16:33 MSK 2015	Technology	Amazon Underground aims to make Android apps and games 'actually free'	[Amazon.com, Apps, Games, Internet, Smartphones, Technology, Mobile phones, E-commerce]
Thu Aug 27 10:15:00 MSK 2015	Sport	Pacific islanders quick to arrive for World Cup and hopefully not the first to leave | Paul Rees	[Fiji rugby union team, Tonga rugby union team, Samoa rugby union team, Rugby union, Sport]
Thu Aug 27 10:00:01 MSK 2015	Children's books	Helen Maslin's top 10 literary castles and country houses	[Children and teenagers, Books, Culture, Children's books: 8-12 years, Teen books]
Thu Aug 27 09:52:05 MSK 2015	UK news	London night tube plan suspended	[Rail transport, London Underground, London, UK news, Transport, Trade unions, Politics]
Thu Aug 27 09:51:43 MSK 2015	Info	How I went from a tester to a developer role	[Work & careers]
Thu Aug 27 09:44:23 MSK 2015	Science	For drivers, the A27 is far more dangerous than any air show	[Science, Shoreham airshow crash, Transport policy, Road safety]
Thu Aug 27 09:42:40 MSK 2015	UK news	Chilcot inquiry: bereaved father backs legal action to speed publication	[Iraq war inquiry, Iraq, Middle East and North Africa, UK news, World news]
Thu Aug 27 09:38:05 MSK 2015	Guardian Masterclasses	How to research and write historical fiction | William Ryan	[Guardian Masterclasses, New Masterclasses, writing and publishing courses]
Thu Aug 27 09:37:52 MSK 2015	Media	Nicola Sturgeon's BBC Scotland plans 'should not come at expense of rivals'	[BBC, STV Group, Television industry, Media, Nicola Sturgeon, Politics, Scotland, UK news, Guardian Edinburgh International Television Festival, Edinburgh TV Festival 2015]
Thu Aug 27 09:29:34 MSK 2015	Football	Per Mertesacker and Laurent Koscielny doubtful for Arsenal’s Newcastle trip	[Arsenal, Football, Sport]
Thu Aug 27 09:29:28 MSK 2015	UK news	Shoreham airshow spectator named as victim of crash	[Shoreham airshow crash, UK news]
Thu Aug 27 09:21:31 MSK 2015	Technology	Adult colouring books? Inevitably, there's an app for that	[Apps, Smartphones, Tablet computers, iPhone, iPad, Apple, Technology]
Thu Aug 27 09:20:02 MSK 2015	Comment is free	Burial, cremation, or full fathom five? I can see the allure of a watery grave | Philip Hoare	[Death and dying, Sailing, Sport, Life and style, Oceans, Environment, Ageing, Science, US news, World news]
Thu Aug 27 09:18:11 MSK 2015	UK news	Readers' assignment: share your photos of buses around the world	[Transport, Photography]
Thu Aug 27 09:12:58 MSK 2015	World news	Oscar Pistorius to stay in prison until at least mid-September	[Oscar Pistorius, South Africa, Africa, World news, Reeva Steenkamp shooting]
Thu Aug 27 09:12:53 MSK 2015	Money	Annual house price growth at slowest point for two years, says Nationwide	[House prices, Money, Property, UK news, Nationwide, Interest rates, Business]
Thu Aug 27 09:04:20 MSK 2015	Technology	Microsoft Windows 10 free upgrade revisited: seven more of your questions answered	[Technology, Windows 10, Windows, Microsoft, Computing]
Thu Aug 27 09:03:21 MSK 2015	Media	Were the media wrong to publish Virginia shootings video and images?	[Media, Virginia, US news, UK news, Virginia TV news shooting, National newspapers, Newspapers, Daily Telegraph, The Times, The Guardian, Daily Mail, Daily Mirror, Daily Express, The Sun, i, Twitter]
Thu Aug 27 09:00:02 MSK 2015	Sport	US Open memories, rugby league dust-ups and Kevin Keegan's Soccer Circus | Classic YouTube	[Football, Sport, US sports]
Thu Aug 27 08:59:23 MSK 2015	Education	Student leader with a swagger: 'They think Jeremy Corbyn is radical!'	[Students, Higher education, Education, Student politics, Further education, Colleges]
Thu Aug 27 08:59:10 MSK 2015	UK news	Migration figures: what do the numbers really mean?	[Immigration and asylum, UK news]
Thu Aug 27 08:58:02 MSK 2015	World news	China arrests Christians who opposed removals of crosses	[China, Asia Pacific, World news, Religion, Christianity]
Thu Aug 27 08:57:32 MSK 2015	UK news	Net migration to UK hits record high of 330,000	[Immigration and asylum, UK news, Politics]
Thu Aug 27 08:51:26 MSK 2015	Music	Morrissey: Obama is doing nothing for US black community	[Morrissey, Music, Pop and rock, Barack Obama, Race issues, US elections 2016, Culture, US news, World news]
Thu Aug 27 08:41:37 MSK 2015	Technology	Facebook M virtual assistant will compete with Siri and Google Now	[Facebook, Smartphones, Social networking, Social media, Artificial intelligence (AI), Digital media, Technology, Media, Mobile phones, Apple, Google, Microsoft]
Thu Aug 27 08:37:57 MSK 2015	Media	BBC missed chance to get Top Gear's Chris Evans on exclusive deal	[BBC, Channel 4, Chris Evans, Television industry, Media, Top Gear, Television, Television & radio, Culture, UK news, Guardian Edinburgh International Television Festival, Edinburgh TV Festival 2015]
Thu Aug 27 08:35:00 MSK 2015	Global Development Professionals Network	Conflict abroad or virus outbreak at home? A Liberian aid worker’s dilemma	[Global development professionals network, people in development - global development professionals network, Ebola, World news, Liberia, South Sudan, Aid, Africa]
Thu Aug 27 08:30:02 MSK 2015	Comment is free	I never know how a man is going to react to my past – and my genitalia | Zoe Dolan	[Transgender, Relationships, Life and style, Society, LGBT rights]
Thu Aug 27 08:29:05 MSK 2015	Comment is free	How will Labour top losing the election? By losing its own leadership contest | Frankie Boyle	[Labour, Politics, Labour party leadership, Jeremy Corbyn, Liz Kendall, Andy Burnham, Yvette Cooper, Scotland, UK news]
Thu Aug 27 08:17:53 MSK 2015	Music	Ricky Martin attacks 'racist, absurd and incoherent' Donald Trump	[Ricky Martin, Music, Pop and rock, Donald Trump, US elections 2016, Culture, US news, World news]
Thu Aug 27 08:10:22 MSK 2015	Music	Cold Chisel: how I learned to love Oz rock’s last great survivors	[Pop and rock, Music, Culture, Australia news]
Thu Aug 27 08:03:15 MSK 2015	Football	Football transfer rumours: Mikel John Obi  to Besiktas?	[Transfer window, Football, Sport]
Thu Aug 27 08:00:01 MSK 2015	Sport	Chip Kelly doesn't care what you think	[Philadelphia Eagles, NFL, Sport, US sports]
Thu Aug 27 08:00:01 MSK 2015	Children's books	The Mysterious Benedict Society series by Trenton Lee Stewart – review	[Children and teenagers, Books, Culture, Spies (children and teens), Adventure (children and teens), Children's books: 8-12 years]
Thu Aug 27 08:00:01 MSK 2015	Enel Partner Zone	How to build a power plant – the sustainable way	[Enel Partner Zone]
Thu Aug 27 07:53:40 MSK 2015	Film	Radical Moscow film festival cancelled in favour of Putin-backed replacement	[Film, Festivals, Culture, Russia, Europe, World news]
Thu Aug 27 07:50:44 MSK 2015	Media	Today's media stories from the papers	[Media]
Thu Aug 27 07:50:33 MSK 2015	Technology	Chatterbox: Thursday	[Games, Technology]
Thu Aug 27 07:40:07 MSK 2015	World news	Australian 'Great Escape' survivor Paul Royle dies in Perth aged 101	[Second world war, Perth, Nazism, Poland, Australia news, World news, Europe]
Thu Aug 27 07:36:04 MSK 2015	US news	Virginia TV shooting: what we know so far	[Virginia TV news shooting, US news, World news, Media]
Thu Aug 27 07:30:00 MSK 2015	Children's books	Curtis Jobling: 'My author superpower is the Underpants of Bestsellingness!'	[]
Thu Aug 27 07:29:51 MSK 2015	US news	Virginia shooting: WDBJ7 journalists memorialized by community on 'unimaginable day'	[Virginia TV news shooting, Virginia, US crime, US news, Gun crime]
Thu Aug 27 07:16:45 MSK 2015	Business	British Gas accused of short-changing customers despite 5% price cut	[Centrica, Business, Utilities, Energy bills, Consumer affairs, Household bills, Money]
Thu Aug 27 07:16:00 MSK 2015	Science	Partners of convenience: the Met Office and the BBC | Alexander Hall	[History of science, Science, BBC, Media, Met Office]
Thu Aug 27 07:10:00 MSK 2015	Life and style	How to make the perfect porchetta	[Pork, Food & drink, Life and style, Meat, Italian food and drink]
Thu Aug 27 07:02:57 MSK 2015	Music	Tyler, the Creator: I've been banned from entering the UK	[Music, Rap, Hip-hop, Odd Future Wolf Gang Kill Them All, Culture, Urban music]
Thu Aug 27 07:00:00 MSK 2015	Art and design	Thomas Hoepker's best photograph: the mighty fist of Muhammad Ali	[Photography, Art and design, Culture, Muhammad Ali, Sport, Boxing]
Thu Aug 27 07:00:00 MSK 2015	Cities	Welcome to the naked city: sun, swingers and very little shoplifting	[Cities, France, Naturism, Europe, Life and style, World news, Modernism, Architecture, Art and design, Culture, Le Corbusier, France holidays, Europe, Travel]
Thu Aug 27 07:00:00 MSK 2015	Public Leaders Network	What will happen to oil and gas workers as the world turns carbon neutral?	[Public Leaders Network, Careers, Collaboration, Energy, Environment, Fossil fuels, Fossil fuel divestment, Oil, Gas, Wind power, Renewable energy, Solar power, Oil, Gas, Coal, Energy industry, Energy, Technology, Business]
Thu Aug 27 06:54:56 MSK 2015	Australia news	Dyson Heydon again delays ruling on union commission amid tip-off claims	[Royal commission into trade union governance and corruption, Australian trade unions, Australian politics, Liberal party, Labor party]
Thu Aug 27 06:54:49 MSK 2015	World news	Fake Goldman Sachs is latest Chinese counterfeit bank to hang out its shingle	[China, Intellectual property, Goldman Sachs, Asia Pacific, Banking, Business, Law, World news]
Thu Aug 27 06:48:03 MSK 2015	Football	Manchester United cruise past Club Brugge with Rooney hat-trick	[Champions League, Club Brugge, Manchester United, Football, Sport]
Thu Aug 27 06:30:19 MSK 2015	Books	Terry Pratchett 'was working on new Discworld stories when he died'	[Terry Pratchett, Children and teenagers, Books, Fiction]
Thu Aug 27 06:23:19 MSK 2015	Women in Leadership	Flying in Mary Poppins won’t fix work for parents	[Women in Leadership, Maternity and childcare, Work/life, Parents and parenting, Women, Work & careers, Women in the boardroom, Family, Life and style, Work-life balance, US work & careers, Money, Business]
Thu Aug 27 06:15:19 MSK 2015	Guardian Small Business Network	Twitter tips and tricks: a beginner's guide for small business	[Accessing expertise, Guardian Small Business Network, Business, Small business, Marketing & PR, Social media, Entrepreneurs, Digital media, Media, Twitter, Technology]
Thu Aug 27 06:15:02 MSK 2015	Australia news	Pyne takes swipe at leaking of talk with Abbott about marriage equality	[Coalition, Christopher Pyne, Australian politics, Australia news, Tony Abbott, Marriage equality (Australia), Liberal party, National party, Adelaide]
Thu Aug 27 06:10:19 MSK 2015	Television & radio	Posh Pawn review – high-end oddballs with terrible business sense	[Television, Television & radio, Culture, Documentary, Channel 4]
Thu Aug 27 06:10:19 MSK 2015	Fashion	Where are all the plus-size male models?	[Fashion, Body image, Models, Life and style, Men's coats and jackets, Men's suits, Men's tops, Men's trousers, Society, Health & wellbeing]
Thu Aug 27 06:01:18 MSK 2015	Books	British Library will lend world's oldest bible to British Museum	[British Library, Books, Libraries, Culture, UK news, Heritage, Religion, World news]
Thu Aug 27 06:00:22 MSK 2015	Sport	Twenty years on and New Zealand’s Jonah Lomu still talks a good game	[New Zealand rugby union team, Rugby union, Sport, Rugby World Cup, Rugby World Cup 2015, South Africa rugby team]
Thu Aug 27 06:00:20 MSK 2015	Television & radio	Terry Wogan: 'If I squeeze another sausage I'll go mad'	[Entertainment, Terry Wogan, British food and drink, Factual TV, Food & drink, Educational TV, Life and style, Media, BBC2, Television, Culture, Television & radio, BBC]
Thu Aug 27 06:00:20 MSK 2015	World news	Forbidden food and contraband clothes: the Russian sanctions quiz	[Russia, Vladimir Putin, Europe, World news, Food & drink, Fashion, Cheese, Film, Internet, Wikipedia, European Union]
Thu Aug 27 06:00:20 MSK 2015	Media	X Factor maker buys company behind Jude Law drama The Young Pope	[FremantleMedia, Media, Television industry, Independent production companies, Media business, Guardian Edinburgh International Television Festival, Edinburgh TV Festival 2015]
Thu Aug 27 06:00:20 MSK 2015	Global development	Rape, ignorance, repression: why early pregnancy is endemic in Guatemala | Linda Forsell and Kjetil Lyche	[Global development, Maternal health, Guatemala, Americas, World news, Pregnancy, Sex education, Rape, Catholicism, Women]
Thu Aug 27 06:00:20 MSK 2015	Teacher Network	Beat the back to school blues: 12 ways teachers deal with a new term	[Teacher Network, Education, Primary schools, Secondary schools, Schools, Private schools, Teaching, US education, Australian education]
Thu Aug 27 06:00:19 MSK 2015	Technology	Samsung Galaxy S6 Edge+ review: the curvy 'iPhone 6 Plus killer'	[Smartphones, Phablets, Samsung, Android, Mobile phones, Technology]
Thu Aug 27 06:00:18 MSK 2015	Teacher Network	New term, new you: how to start the year with a positive mindset	[Teacher Network, Education, Australian education, US education, Schools, Primary schools, Secondary schools, Teachers' workload]
Thu Aug 27 06:00:18 MSK 2015	Money	Student Loans Company is hounding me for debt I paid off in 2009	[Student finance, Money, Students]
Thu Aug 27 05:57:58 MSK 2015	Australia news	Migrants should not have constitutional recognition alongside first Australians	[Indigenous Australians, Indigenous peoples, Australian immigration and asylum, Australia news, Australian politics, Migration]
Thu Aug 27 05:43:19 MSK 2015	Australia news	Citizenship stripping report put off again after laws described as 'unfit'	[Australian security and counter-terrorism, Australia news, Australian politics, Tony Abbott, Coalition, Labor party, Australian law]
Thu Aug 27 05:30:17 MSK 2015	Travel	Forget selfies! The latest holiday accessory is a professional photographer	[Travel photography, Travel websites, Travel, Instagram, Technology, Social media, Digital media, Media]
Thu Aug 27 05:27:50 MSK 2015	Australia news	Kelly Thompson inquest: police officer defends not sending van when asked	[Crime - Australia, Melbourne, Victoria, Australia news, Domestic violence]
Thu Aug 27 05:17:48 MSK 2015	Media	Fairfax job cuts: Newcastle Herald staff vote for immediate strike action	[Fairfax Media, Australian media, Australia news, New South Wales, Media]
Thu Aug 27 05:00:17 MSK 2015	Television & radio	Thursday’s best TV	[Television, Television & radio, Culture]
Thu Aug 27 05:00:17 MSK 2015	Environment	Why I ate a roadkill squirrel	[Wildlife, Environment, The meat industry, Food, Food & drink]
Thu Aug 27 05:00:17 MSK 2015	News	The battle to protect Alaska’s great wildlife sanctuary | Rebecca Solnit	[Arctic, World news, Environment, Pollution, Oil and gas companies, Energy industry, Oil, Energy, Fossil fuels, Oil spills, Oil, Alaska, Canada]
Thu Aug 27 04:52:53 MSK 2015	Film	StalkHer review – a long, pointless spat that manages to degrade both genders	[Australian film, Film, Culture]
Thu Aug 27 04:45:18 MSK 2015	Comment is free	The vaguely Soviet overtones of the reform summit give us a right to be cynical | Liam Hogan	[Australian politics, Australia news, Australian economy, Business]
Thu Aug 27 04:36:09 MSK 2015	Australia news	Exclusive: woman allegedly raped in Manus detention centre accuses Transfield of cover-up	[Manus Island, Australian immigration and asylum, World news, Australia news, Papua New Guinea, Rape]
Thu Aug 27 04:30:17 MSK 2015	Environment	Thistle and brimstones: explosion in the fluff factory	[Butterflies, Wildlife, Environment, Rural affairs, UK news, Insects]
Thu Aug 27 04:17:51 MSK 2015	Australia news	Crocodile on a plane: Queensland man fined for smuggling reptile from NT	[Queensland, Northern Territory, Australia news, Wildlife, Animals, Darwin, Brisbane]
Thu Aug 27 03:50:33 MSK 2015	US news	Jorge Ramos tells Megyn Kelly: Trump a would-be dictator with dangerous ideas	[Donald Trump, US news, US politics, Republicans, US elections 2016]
Thu Aug 27 03:43:13 MSK 2015	Business	China free trade agreement: Andrew Robb open to constructive talks with Labor	[Australian economy, Australian politics, China, Coalition, Labor party, Asia Pacific, Business]
Thu Aug 27 03:32:36 MSK 2015	Business	China’s slumping economy a bigger threat to Australia than its plunging stock market	[Chinese economy, Australia news, Business, China, Asia Pacific, Australian economy, Economics, Stock markets, Australian politics, Joe Hockey, Coalition]
Thu Aug 27 02:29:26 MSK 2015	World news	China's workers abandon the city as Beijing faces an economic storm	[China, Chinese economy, Asia Pacific, Business, World news, Stock markets, Global economy]
Thu Aug 27 02:01:57 MSK 2015	World news	Daniel Andrews attacks NSW government over Gayby Baby 'rubbish'	[LGBT rights, Film, Documentary, Daniel Andrews, Australian education, New South Wales politics, New South Wales, Victoria, Victorian politics, Australian media, Mike Baird, Sydney]
Thu Aug 27 01:58:40 MSK 2015	Australia news	Masa Vukotic's killer Sean Price admits to raping another woman two days later	[Crime - Australia, Victoria, Melbourne, Australia news]
Thu Aug 27 01:49:11 MSK 2015	Comment is free	The blasé acceptance that you might get shot is a fact of American life | Megan Carpentier	[Virginia TV news shooting, US gun control, Gun crime, US politics, US news, World news]
Thu Aug 27 01:34:56 MSK 2015	Australia news	'Institutionalised racism' reason for fewer Indigenous kidney transplants	[Indigenous Australians, Australia news, Health]
Thu Aug 27 01:29:52 MSK 2015	Life and style	Not all cuisines are created equal, so which country has the worst food?	[Food & drink, Life and style, Japanese food and drink, Chinese food and drink]
Thu Aug 27 01:05:36 MSK 2015	Australia news	Victoria's economy 'strong enough to handle debt to fund infrastructure'	[Victorian politics, Victoria, Melbourne, Australia news]
Thu Aug 27 00:45:58 MSK 2015	Comment is free	Abortion clinic or health clinic, there is no real argument against safe access for women | Van Badham	[Abortion, Health, Women, Melbourne, Victorian politics, Tim Wilson, Australia news]
Thu Aug 27 00:35:06 MSK 2015	World news	Tennessee will keep lethal injections for death row executions, court rules	[Capital punishment, Tennessee, US news, World news, Mississippi]
Thu Aug 27 00:20:25 MSK 2015	Australia news	Abbott says republic a long way off as he defends Australia's political 'maturity'	[Republicanism, Tony Abbott, Joe Hockey, Monarchy, Australia news, Australian politics]
Wed Aug 26 23:37:25 MSK 2015	Sport	NRL: what to look out for in round 25 | Nick Tedeschi	[NRL, South Sydney Rabbitohs, Rugby league, Australia sport, Sport]
Wed Aug 26 23:02:10 MSK 2015	Media	Nicola Sturgeon calls on BBC to put forward bold proposal for Scotland	[BBC, Nicola Sturgeon, Scotland, Television & radio, Culture, Media, Politics, Television, UK news, Scottish National party (SNP), Scottish politics]
Wed Aug 26 23:01:11 MSK 2015	Society	Council use of bailiffs to chase debts jumps 16% in two years, charity reports	[Local government, Council tax, Family finances, Borrowing & debt, Society, Money, Tax, Politics, UK news]
Wed Aug 26 23:01:11 MSK 2015	Business	Sainsbury's shopfloor staff to receive 4% pay rise	[J Sainsbury, Business, Retail industry, Supermarkets, Living wage, Society, Money, Employee benefits, Work & careers, UK news]
Wed Aug 26 23:01:11 MSK 2015	Politics	Government's peers list publication date prompts allegation of burying bad news	[House of Lords, Conservatives, Labour, Liberal Democrats, Politics, UK news]
Wed Aug 26 23:01:10 MSK 2015	Sport	Nathan White’s fairytale comeback for Ireland is likely to continue	[Ireland rugby union team, Wales rugby union team, Rugby World Cup 2015, Rugby World Cup, Rugby union, Sport]
Wed Aug 26 23:01:10 MSK 2015	Books	The Shepherd’s Crown by Terry Pratchett review – the much-loved author’s last Discworld novel	[Terry Pratchett, Fantasy, Fiction, Books, Culture]
Wed Aug 26 23:00:10 MSK 2015	UK news	Chilcot defends long-delayed Iraq inquiry – but sets no date for publication	[Iraq war inquiry, Iraq, Middle East and North Africa, UK news, Philip Hammond, Politics, World news, Clare Short]
Wed Aug 26 23:00:00 MSK 2015	Crosswords	Cryptic crossword No 26,661	[Crosswords]
Wed Aug 26 23:00:00 MSK 2015	Crosswords	Quick crossword No 14,134	[Crosswords]
Wed Aug 26 22:57:44 MSK 2015	Books	Naomi Klein on climate change: 'I thought it best to write about my own raw terror'	[Naomi Klein, Climate change, Tony Abbott, Australia news, Climate change scepticism, Australian politics, Environment, Science and nature, Books, Festival of Dangerous Ideas 2015, Culture]
Wed Aug 26 22:48:41 MSK 2015	Football	Everton to reject transfer request from Chelsea target John Stones	[Everton, Football, Sport, Transfer window, Chelsea]
Wed Aug 26 22:34:42 MSK 2015	US news	Two dead including police officer after Lousiana stabbing and shooting	[Louisiana, Gun crime, US crime, US news, World news]
Wed Aug 26 22:25:52 MSK 2015	Comment is free	Gun control is political. So is refusing to address the politics of gun violence | Scott Lemieux	[Virginia TV news shooting, US gun control, Gun crime, US politics]
Wed Aug 26 22:20:09 MSK 2015	Television & radio	Witnesses recap: episode six – less than meets the eye, but immensely stylish	[Crime drama, Drama, Television & radio, Television, Culture, Channel 4]
Wed Aug 26 22:14:14 MSK 2015	Football	Wayne Rooney says after hat-trick he ‘wasn’t worried’ by barren spell	[Wayne Rooney, Football, Manchester United, Sport, Club Brugge, Champions League]
Wed Aug 26 22:11:16 MSK 2015	Sport	Will Carling warns Stuart Lancaster not to select Sam Burgess for World Cup	[Sam Burgess, Rugby World Cup 2015, England rugby union team, Danny Cipriani, Rugby union, Rugby World Cup, Sport]
Wed Aug 26 22:01:08 MSK 2015	Stage	Mrs Henderson Presents review – a shot in the arm for the British musical	[Theatre, Stage, Culture]
Wed Aug 26 22:00:09 MSK 2015	Football	Celtic ‘want it too much’ in Champions League, says Ronny Deila after exit	[Celtic, Champions League qualifying, Champions League, Football, Sport]
Wed Aug 26 21:53:50 MSK 2015	Sport	Women’s Ashes 2015: England defeat Australia and keep hopes alive	[Women's Ashes, England women's cricket team, Southern Stars, Women's cricket, Cricket, Sport, Australia sport]
Wed Aug 26 21:45:37 MSK 2015	Television & radio	The Carmichaels: dated concept makes this comedy feel light as a dust bunny	[US television, Television, NBC, Culture, NBC Universal, Television & radio]
Wed Aug 26 21:42:46 MSK 2015	Business	Walmart to stop selling AR-15 rifles due to 'decreased demand'	[Walmart, US gun control, US news, Business]
Wed Aug 26 21:32:29 MSK 2015	Television & radio	Season finale of Mr Robot delayed over similar scenes to Virginia shooting	[US television, Virginia TV news shooting, Television, Culture, Television & radio]
Wed Aug 26 21:30:45 MSK 2015	Football	Romelu Lukaku leads the fightback as Everton push past Barnsley 5-3	[Capital One Cup, Barnsley, Everton, Football, Sport]
Wed Aug 26 21:30:08 MSK 2015	Football	Gareth Bale will be stronger for his Real experiences, says Wales manager	[Wales, Gareth Bale, Real Madrid, Chris Coleman, Football, Sport]
Wed Aug 26 21:15:45 MSK 2015	Ben & Jerry's partner zone	How should the US fight climate change? By looking west to the Golden State	[Ben & Jerry's partner zone]
Wed Aug 26 21:07:10 MSK 2015	US news	Virginia TV journalists shot dead on air in attack staged by former colleague	[Virginia TV news shooting, Virginia, US crime, Gun crime, US news]
Wed Aug 26 21:04:32 MSK 2015	Football	Manchester United’s Ander Herrera makes most of first start to shine against Club Brugge | Paul Doyle	[Manchester United, Louis van Gaal, Wayne Rooney, Champions League, Club Brugge, Football, Sport]
Wed Aug 26 21:04:30 MSK 2015	Sport	Former NFL player Jonathan Martin: I considered suicide multiple times	[Miami Dolphins, NFL, US sports, Sport]
Wed Aug 26 21:01:07 MSK 2015	Sport	England’s Rugby World Cup squad: Stuart Lancaster’s dilemmas	[England rugby union team, Rugby union, Rugby World Cup 2015, Rugby World Cup, Sport]
Wed Aug 26 21:00:08 MSK 2015	Sport	Greg Rutherford basks in world title glory but determined to keep speaking out	[Greg Rutherford, World Athletics Championships, Athletics, Sport]
Wed Aug 26 21:00:07 MSK 2015	Sport	England’s Stuart Lancaster to put onus on collective strength on World Cup squad D-day	[England rugby union team, Rugby World Cup 2015, Stuart Lancaster, Rugby World Cup, Rugby union, Sport]
Wed Aug 26 20:50:08 MSK 2015	Environment	Activists threaten lawsuit against EPA over fracking-induced earthquakes	[Fracking, US news, US Environmental Protection Agency (EPA), Environment, Oil and gas companies, Energy industry, Fossil fuels]
Wed Aug 26 20:37:58 MSK 2015	Football	Club Brugge v Manchester United: Champions League play-off – as it happened	[Champions League, Champions League qualifying, Club Brugge, Manchester United, Football, Sport]
Wed Aug 26 20:37:17 MSK 2015	Sport	Julius Yego wins javelin but Kenyan pair’s positive tests cast shadow	[World Athletics Championships, Athletics, Drugs in sport, Kenya, Sport]
Wed Aug 26 20:30:07 MSK 2015	Science	Plantwatch: Pretty weeds and alien space invaders	[Plants, Invasive species, Wild flowers, Wildlife, Science, Environment, Conservation]
Wed Aug 26 20:30:07 MSK 2015	Sport	The Joy of Six: AFL footballer business ventures	[AFL, Australian rules football, Australia sport, Sport]
Wed Aug 26 20:28:08 MSK 2015	Media	The Weekly Beast: revealed – how Max Markson swears by Mark Latham	[Australian media, Australian Broadcasting Corporation, News Corporation, Media, Andrew Bolt, Mark Latham]
