Thu Aug 06 06:47:30 MSK 2015	World news	MH370: relatives in China sceptical about debris linked to missing plane	[Malaysia Airlines flight MH370, China, World news, Plane crashes, Asia Pacific, Réunion, Malaysia]
Thu Aug 06 06:45:00 MSK 2015	Healthcare Professionals Network	I felt like a floundering fish as a junior doctor – until one patient encounter	[Healthcare Network, Workforce, Doctors, NHS, Health, Society, Work practices, Cancer]
Thu Aug 06 06:30:16 MSK 2015	World news	'Rain of ruin': how the Guardian reported the dropping of the atomic bomb on Hiroshima	[Nuclear weapons, Second world war, Japan, Asia Pacific]
Thu Aug 06 06:30:16 MSK 2015	Guardian Small Business Network	Survival of the fittest: how to create a brand that endures	[Guardian Small Business Network, Business, Small business, Marketing & PR, E-commerce, Food & drink industry]
Thu Aug 06 06:28:46 MSK 2015	Australia news	Tony Abbott can brush off 'crises' like Cameron did, says Lynton Crosby	[Tony Abbott, David Cameron, Lynton Crosby, Australian politics, Politics, Coalition, Liberal-Conservative coalition, General election 2015, Bronwyn Bishop]
Thu Aug 06 06:22:34 MSK 2015	World news	Search area for MH370 will be unchanged by confirmation of debris	[Malaysia Airlines flight MH370, World news, Plane crashes, Australia news, Asia Pacific, Malaysia]
Thu Aug 06 06:16:30 MSK 2015	Technology	Apple Music has 11m listeners five weeks after launching	[Apple Music, Apple, Digital music and audio, Spotify, Technology, Media, Internet, Music industry, Music]
Thu Aug 06 06:16:15 MSK 2015	Women in Leadership	Female solicitors in Scotland earn 42% less than their male colleagues	[Women in Leadership, Office politics, Equal pay, Law, Equality, Pay, Work & careers]
Thu Aug 06 06:10:15 MSK 2015	Television & radio	The Great British Bake Off review – 1970s cakes and a light dusting of innuendo	[The Great British Bake Off, Television, Television & radio, Culture, Food TV]
Thu Aug 06 06:00:17 MSK 2015	UK news	Rainy day summer holiday activities in the north of England	[Children, Summer holidays, Family, UK news, Culture, Manchester, Leeds, Liverpool, Life and style]
Thu Aug 06 06:00:16 MSK 2015	Comment is free	Don’t worry, Donald Trump won’t win. But I’ll sure miss him when he’s gone | Hadley Freeman	[Republicans, Donald Trump, US news, World news]
Thu Aug 06 06:00:16 MSK 2015	Guardian Small Business Network	Enterprising graduates should head for startups, not grad schemes	[Accessing expertise, Guardian Small Business Network, Entrepreneurs, Small business, Business, Graduate careers, Work & careers]
Thu Aug 06 06:00:16 MSK 2015	News	Netflix's year of parental leave – its impact mapped	[World news, Netflix, Parents and parenting, Life and style, Maternity & paternity rights]
Thu Aug 06 06:00:16 MSK 2015	Global development	South Sudan: the bishop who brings home lessons of unity and peace	[Conflict and development, Global development, South Sudan, Rwanda, World news, Africa]
Thu Aug 06 06:00:15 MSK 2015	Technology	Angry Birds 2 review – new twists on a familiar friend	[Angry Birds, Apps, Games, Technology, Culture, iPhone, iPad, Android, Smartphones, Tablet computers, Children's tech]
Thu Aug 06 06:00:15 MSK 2015	Stage	Twitter meets theatre in tales from the Middle East	[Edinburgh festival 2015, Stage, Culture, Egypt, Middle East and North Africa, World news, Israel, Palestinian territories, Scotland, Twitter, Internet, Media, Technology, UK news, Edinburgh festival]
Thu Aug 06 06:00:15 MSK 2015	Money	How do my ex and I divide our house fairly?	[Property, Mortgages, Money]
Thu Aug 06 05:54:33 MSK 2015	Australia news	Junaid Thorne has sentence for flying under false name cut by a month	[Crime - Australia, Australia news, New South Wales, Australian security and counter-terrorism, Air transport, Perth, Sydney, Western Australia]
Thu Aug 06 05:42:34 MSK 2015	Australia news	Beef, big bucks and buy-ups: are Chinese investors changing the face of Australia?	[Australia news, Real estate, Farming, China, Chinese economy, Northern Territory, Queensland, Business, Alan Jones, Barnaby Joyce, World news, Asia Pacific, Environment, Australian economy]
Thu Aug 06 05:30:14 MSK 2015	Books	The Nearest Thing to Life by James Wood review – ‘the foremost literary enthusiast of our time’	[Autobiography and memoir, Biography, Literary criticism, Fiction, Books, Culture]
Thu Aug 06 05:30:14 MSK 2015	Travel	Walking holidays in Japan: the best mountain hikes to tackle	[Walking holidays, Japan, Adventure travel, Asia, Travel]
Thu Aug 06 05:16:13 MSK 2015	World news	Hiroshima atomic bomb: a simple toll of a bell signals the moment 80,000 died	[Japan, Nuclear weapons, Second world war, Asia Pacific, World news, Shinzo Abe, Arms trade, Ban Ki-moon]
Thu Aug 06 05:08:37 MSK 2015	Australia news	Tony Abbott says MPs' party fundraiser expenses claims fair, but urges prudence	[Australian politicians' expenses, Tony Abbott, Australian politics, Tony Burke, Coalition, Labor party, Bill Shorten, Australia news]
Thu Aug 06 05:01:14 MSK 2015	Television & radio	Thursday’s best TV	[Television, Television & radio, Culture]
Thu Aug 06 05:01:14 MSK 2015	Environment	Listen and vote for your favourite sound of British summer by the sea	[Coastlines, Environment, UK news, Beach holidays, Travel, British Library, The National Trust]
Thu Aug 06 05:00:14 MSK 2015	Law	Jonathan Sumption: the brain of Britain | Wendell Steavenson	[Jonathan Sumption, Law, Barristers, Judiciary, History, UK news]
Thu Aug 06 04:41:52 MSK 2015	Media	Press council urges better reporting of violence, sex abuse, race and religion	[Australian media, Newspapers & magazines, Media, Australia news, Melbourne, Joe Hockey]
Thu Aug 06 04:29:13 MSK 2015	Environment	Martins on madcap chase in the meadow	[Birds, Rivers, Insects, Wildlife, Conservation, Environment, Rural affairs]
Thu Aug 06 04:17:53 MSK 2015	Science	Dark side of the moon captured by Nasa satellite a million miles from Earth	[The moon, Nasa, Space, World news, Science]
Thu Aug 06 04:12:46 MSK 2015	Society	Health experts doubtful citizens’ jury on obesity will address problem in Victoria	[Obesity, Victorian politics, Victoria, Australia news, Health]
Thu Aug 06 04:08:08 MSK 2015	Australia news	Bendigo mosque planning permit upheld in face of anti-Islamic campaign	[Victoria, Australia news, Race issues]
Thu Aug 06 03:39:05 MSK 2015	Business	Jobless rate jumps to 6.3% despite number of employed rising by 38,500	[Australia unemployment and employment statistics, Coalition, Tony Abbott, Labor party, Australia news, Australian politics]
Thu Aug 06 03:34:33 MSK 2015	Travel	Skiing in Australia: I was a novice when I got to Thredbo, but I left a confident man	[Skiing, Australia, Australasia, Travel, Australia travel blog, New South Wales, Snow]
Thu Aug 06 03:01:48 MSK 2015	US news	Nashville theater assailant shot dead by police had history of mental illness	[Tennessee, US policing, US news]
Thu Aug 06 02:48:52 MSK 2015	Australia news	Australia turned back 20 asylum seeker boats with 633 people in past 18 months	[Australian immigration and asylum, Australia news, Coalition, Peter Dutton, Australian politics, Vietnam, Indonesia, Refugees, Labor party]
Thu Aug 06 02:46:54 MSK 2015	Business	Penalty rates: Tony Abbott backs hospitality employers' push for cuts	[Australian economy, Australia news, Tony Abbott, Australian politics, Retail industry, Restaurant Group, Coalition, Food & drink industry]
Thu Aug 06 02:35:12 MSK 2015	Sport	Joy of Six: Australian football kits | Joe Gorman	[Football, A-League, Australia sport]
Thu Aug 06 02:19:33 MSK 2015	Comment is free	Australia against Isis: how much do we actually know? | Antony Loewenstein	[Australian defence force, Australia news, Iraq, Islamic State, Tony Abbott]
Thu Aug 06 02:12:55 MSK 2015	Fashion	Oz stylewatch: still haunted by Picnic at Hanging Rock, 40 years on	[Fashion, Australian film, Marc Jacobs, Life and style, Film, Culture]
Thu Aug 06 01:25:34 MSK 2015	World news	Hiroshima remembers atomic bomb: 'abolish the evil of nuclear weapons'	[Japan, Asia Pacific, World news, Nuclear weapons, Second world war, US news]
Thu Aug 06 00:15:20 MSK 2015	Environment	Australia was ready to act on climate 25 years ago, so what happened next?	[Climate change, Environment, Climate change scepticism, Climate change, Fossil fuels, Energy, Science, Australia news, Australian politics, Bob Hawke, John Howard, Paul Keating, News Corporation, Australian Broadcasting Corporation]
Wed Aug 05 23:57:26 MSK 2015	Money	Average house price rises to 8.8 times local salary in England and Wales	[House prices, Office for National Statistics, London, Money, Property, UK news, Renting property]
Wed Aug 05 23:53:04 MSK 2015	Australia news	Julie Bishop hails 'candid' talks with Indonesian counterpart Retno Marsudi	[Julie Bishop, Australian politics, Australia news, Indonesia, Asia Pacific, Bali Nine]
Wed Aug 05 23:52:44 MSK 2015	Society	Harrogate home to happiest people in Britain, according to study	[Communities, UK news, Society, Housing, Property, Money]
Wed Aug 05 23:05:07 MSK 2015	Comment is free	The Guardian view on the Hiroshima legacy: still in the shadow of the bomb | Editorial	[Nuclear weapons, Japan, Asia Pacific, World news, US national security, US news, Russia, Europe, China, Iran, Middle East and North Africa, Second world war]
Wed Aug 05 23:01:08 MSK 2015	Media	TV industry revenue breaks £13bn barrier boosted by advertising growth	[Television industry, Media, Ofcom, BBC]
Wed Aug 05 23:01:07 MSK 2015	Media	BBC Radio 1 claws back listeners as Nick Grimshaw recovers from breakfast low	[Radio 1, Nick Grimshaw, Radio industry, BBC, Media, Rajars, UK news]
Wed Aug 05 23:01:07 MSK 2015	Education	Pay rises more quickly for privately educated graduates, study finds	[Private schools, Pay, Education, Money, Schools, Work & careers, UK news, Social mobility, Society]
Wed Aug 05 23:01:06 MSK 2015	Media	Children spending less time in front of the TV as they turn to online media	[Ofcom, Digital media, Media, Television & radio, UK news, Children, Society]
Wed Aug 05 23:00:34 MSK 2015	Politics	Public sector workers to lose right to have union fees deducted from wages	[Trade unions, Public sector pay, Matthew Hancock, Politics, Public services policy, Society, UK news]
Wed Aug 05 23:00:06 MSK 2015	Technology	Smartphone now most popular way to browse internet – Ofcom report	[Internet, Smartphones, Technology, Mobile phones, Telecoms, Ofcom, Media, Television industry, BBC, Netflix, 4G]
Wed Aug 05 23:00:06 MSK 2015	Film	Max review – a barking mash-up of Lassie and Coming Home	[Family, Film, Culture, Dogs, Animals]
Wed Aug 05 23:00:00 MSK 2015	Crosswords	Cryptic crossword No 26,643	[Crosswords]
Wed Aug 05 23:00:00 MSK 2015	Crosswords	Quick crossword No 14,116	[Crosswords]
Wed Aug 05 22:53:28 MSK 2015	Film	Pawno review – ambitious Footscray drama suffers scattered structure	[Melbourne film festival 2015, Film, Australian film, Culture, Melbourne, Sydney]
Wed Aug 05 22:46:54 MSK 2015	US news	Jeb Bush campaign seeks to clarify 'anti-woman' comment with pro-life record	[Jeb Bush, Planned Parenthood, US news, Health, Abortion]
Wed Aug 05 22:46:16 MSK 2015	Football	Arsenal’s Jack Wilshere facing lengthy layoff with leg injury	[Arsenal, Jack Wilshere, England, Football, Sport]
Wed Aug 05 22:24:07 MSK 2015	Football	Champions League qualifiers: Shakhtar Donetsk beat Van Persie’s Fenerbahce	[Champions League, Football, Shakhtar Donetsk, Fenerbahçe, Malmo, Red Bull Salzburg, Sport]
Wed Aug 05 22:18:52 MSK 2015	Society	Kids Company closure: 'You drop the bomb and expect people to move on?'	[Child protection, Charities, Children, Society, Voluntary sector, Camila Batmanghelidjh, UK news, Kids Company]
Wed Aug 05 22:18:29 MSK 2015	Media	Ruben Espinosa murder case: suspect arrested in relation to killings in Mexico	[Journalist safety, Mexico, Americas, Media, World news, Press freedom, Newspapers & magazines]
Wed Aug 05 22:13:30 MSK 2015	Music	Nicholas Carter: conducting is not what every seven-year-old wants to do	[Classical music, Culture, Music]
Wed Aug 05 22:10:06 MSK 2015	Television & radio	Witnesses recap: episode three – blackmail and a cemetery shootout	[Television, Culture, Television & radio, Channel 4, Drama, Crime drama]
Wed Aug 05 22:08:47 MSK 2015	Football	Manchester United could face Monaco or Lazio in Champions League play-offs	[Manchester United, Champions League, Football, Monaco, Lazio, CSKA Moscow, Club Brugge, Rapid Vienna, Celtic, Sport]
Wed Aug 05 21:34:00 MSK 2015	Football	Nigeria want Liverpool’s Jordon Ibe to switch allegiance from England	[Liverpool, Nigeria, England, Football, Sport]
Wed Aug 05 21:31:27 MSK 2015	US news	Less popular than peas: Jeb Bush's $75 'Guaca Bowle' widely mocked	[Jeb Bush, US news, US elections 2016, US politics]
Wed Aug 05 21:30:05 MSK 2015	Football	José Mourinho: Chelsea’s young players must show me they are good enough	[Chelsea, José Mourinho, Football, Sport]
Wed Aug 05 21:30:05 MSK 2015	Football	Mourinho and Wenger handshake snub is fine, says Premier League chief	[Richard Scudamore, Premier League, Arsène Wenger, José Mourinho, Football, Sport]
Wed Aug 05 21:19:52 MSK 2015	Football	Chelsea 0-1 Fiorentina | International Champions Cup match report	[Friendlies, Chelsea, Fiorentina, Football, Radamel Falcao, Sport]
Wed Aug 05 21:09:38 MSK 2015	Environment	Future of Carmichael mine hinges not on skinks or snakes, but its business case	[Carmichael coalmine, Queensland, Australia news, Business, Environment, India, World news, Mining, Mining, Australian politics]
