Thu Aug 06 13:12:35 MSK 2015	Culture	Pornhub launches 'Netflix for porn' subscription service	[Pornography, Internet, Technology, Culture]
Thu Aug 06 13:11:08 MSK 2015	Film	Gaspar Noé's 3D sex film Love hit by raised age rating in French cinemas	[Love, Gaspar Noé, 3D, Film, Culture, Technology, Censorship, France, Pornography, Europe, World news, Cannes film festival, Festivals]
Thu Aug 06 13:00:08 MSK 2015	US news	Pinball is back: welcome to Pinburgh, the largest-ever tournament in the world	[Pennsylvania, Technology, US news]
Thu Aug 06 13:00:07 MSK 2015	Guardian Sustainable Business	Mosquitos are hungry this time of year – here are six ways to avoid their bites	[SC Johnson partner zone]
Thu Aug 06 13:00:07 MSK 2015	Technology	Monument Valley developer moves into mental health with Moodnotes app	[Apps, Technology, Technology startups, Health, Health & wellbeing, Mental health, Depression, Life and style, Smartphones, Apple Watch, iPhone, Mobile phones, Apple]
Thu Aug 06 00:56:51 MSK 2015	World news	'It's getting worse': China's liberal academics fear growing censorship	[China, Xi Jinping, Asia Pacific, World news, University teaching, Higher education, Lecturers, Education]
Thu Aug 06 00:56:24 MSK 2015	Football	West Ham’s Olympic Stadium running costs ‘to be funded by taxpayer’	[West Ham United, Olympic Stadium, Finances, Football, Sport, BBC]
Thu Aug 06 00:52:13 MSK 2015	Comment is free	What’s your sound of the summer? | Open thread	[Summer holidays, Summer, British Library]
Thu Aug 06 00:49:52 MSK 2015	Politics	Ted Heath: brothel keeper's case dropped over lack of evidence – barrister	[Edward Heath, UK news, Child protection, Police, Children, Politics, Social care, Society]
Thu Aug 06 00:49:20 MSK 2015	Television & radio	George Cole obituary	[Television, Culture, Television & radio, Comedy, Stage, Theatre, Film]
Thu Aug 06 00:38:10 MSK 2015	Books	'Don't be a prima donna, Doris' … and other advice. UEA opens writers' letters	[Creative writing, University of East Anglia, Publishing, Literary criticism, Doris Lessing, Books, Culture, Education, Higher education, JD Salinger, WG Sebald, Naomi Alderman]
Thu Aug 06 00:37:48 MSK 2015	Stage	Grand Hotel review – roaring 20s musical, staged with glittering panache	[Theatre, Stage, Musicals, Culture, Dance]
Thu Aug 06 00:33:58 MSK 2015	Fashion	Vanity Fair's best-dressed list 2015: how Tory dressing took over the world	[Fashion, Life and style]
Thu Aug 06 00:30:09 MSK 2015	Teacher Network	How to brush up on your subject knowledge (and beyond) this summer	[Teacher Network, Professional development, Education, Schools, Primary schools, Secondary schools, Teacher training, Teaching]
Thu Aug 06 00:28:55 MSK 2015	World news	North Yorkshire police discover sheep riding to McDonald's in car boot	[Animals, Farming, Yorkshire, Transport, UK news]
Thu Aug 06 00:25:23 MSK 2015	Music	Paul Barker: why my opera without words speaks volumes	[Opera, Classical music, Culture, Music, Science]
Thu Aug 06 00:23:37 MSK 2015	Art and design	Freak scenes: the most obscure lo-fi zines of the 60s and 70s	[Design, Art and design, Culture, Magazines, Newspapers & magazines]
Thu Aug 06 00:22:29 MSK 2015	US news	The Republican debate: meet the 2016 candidates	[US elections 2016, Republicans, US news, Donald Trump, Jeb Bush, Scott Walker, Ben Carson, Mike Huckabee, Ted Cruz, Marco Rubio, Rand Paul, Chris Christie]
Thu Aug 06 00:17:09 MSK 2015	World news	Fake pisstake? Scientists re-examine Belgium's celebrated Manneken Pis	[Belgium, Europe, Sculpture, World news, Art and design, Art, Culture]
Thu Aug 06 00:16:36 MSK 2015	Politics	Tories accused of 'mean-spirited' attack on trade union funding	[Trade unions, Labour, Politics, Conservatives, UK news, Public sector careers, Society]
Thu Aug 06 00:15:05 MSK 2015	Society	Failings in Cumbria's mental health service puts children at risk, says NAS	[Mental health, Children, Health, Society, NHS, UK news]
Thu Aug 06 00:07:36 MSK 2015	Television & radio	Apprentice contestant Stuart Baggs died as result of asthma, police say	[Stuart Baggs, UK news, Television, Culture, Television & radio]
Thu Aug 06 00:06:10 MSK 2015	Global development	Women caught up in conflict failed by underfunding of sexual healthcare	[Global development, Humanitarian response, Reproductive rights, Contraception and family planning, Society, Health, World news, Women, Life and style]
Thu Aug 06 00:04:44 MSK 2015	Comment is free	Instead of building walls, the UK and France must do more to help the Calais asylum seekers | Guy Verhofstadt	[Migration, World news, European Union, Europe, UK news, France, Refugees]
Thu Aug 06 00:00:07 MSK 2015	Culture	Song Exploder: the podcast that lifts up the hood on musical motors	[Culture, Podcasting, Media, Digital media]
Thu Aug 06 00:00:06 MSK 2015	Football	Premier League 2015-16 preview No18: Watford	[Premier League 2015-16 previews, Watford, Football, Sport]
Thu Aug 06 00:00:06 MSK 2015	Children's books	Mary Sebag-Montefiore's top 10 classics to read before you're 10	[Children and teenagers, Books, Culture, Children's books: 8-12 years]
Thu Aug 06 00:00:06 MSK 2015	World news	Red ink: Colombian cultural institute sets out to correct tattoo typos	[Colombia, Tattoos, Americas, World news, Fashion]
Thu Aug 06 11:59:51 MSK 2015	Science	Vote Jericho the lion: 5 alternative candidates for the Labour leadership | Dean Burnett	[Science, Politics, Labour party leadership, Labour]
Thu Aug 06 11:58:30 MSK 2015	Media	Two-thirds of UK's Netflix and Amazon users don't watch their original shows	[Online TV, Netflix, Amazon Prime Instant Video, Digital media, Television industry, Media, Internet, Technology, UK news]
Thu Aug 06 11:58:24 MSK 2015	Stage	Queensland Ballet: La Sylphide review – impressive mastery of a tragic fairytale	[Ballet, Dance, Stage, Culture]
Thu Aug 06 11:44:13 MSK 2015	Enel Partner Zone	Positive charge: how new technology could finally deliver mass ownership of electric cars	[Enel Partner Zone]
Thu Aug 06 11:40:36 MSK 2015	Film	Universal breaks all-time global box office record for Hollywood studio	[Universal Pictures, Film, Culture, Jurassic World, 20th Century Fox, US news, Film industry, Business, World news, Fast & Furious 7, Minions, Pitch Perfect 2, Fifty Shades of Grey, Film adaptations, Books]
Thu Aug 06 11:30:48 MSK 2015	Life and style	Cookery books are all the inspiration you need | Cook residency	[Life and style, Food & drink, Chefs]
Thu Aug 06 11:30:06 MSK 2015	Books	Gerald Brenan’s Personal Record 1920-1972 - battles with nature and invisibility	[Travel writing, Books, Culture, Travel, Andalucia, Europe, Spain holidays]
Thu Aug 06 11:29:09 MSK 2015	Media	Katie Hopkins' TV show: 'I’m not playing the part of a pantomime villain’	[Katie Hopkins, Television industry, Media, Talk shows, Television, Television & radio, Culture, UK news]
Thu Aug 06 11:28:57 MSK 2015	Stage	Down and Out in Paris and London review – Orwell meets Toynbee	[Edinburgh festival 2015, Theatre, George Orwell, Stage, Culture, Poverty, Social exclusion, Edinburgh festival, Books, Festivals, Society]
Thu Aug 06 11:28:46 MSK 2015	Stage	The Heresy of Love review – a glimmering, timely revival	[Theatre, Stage, Culture, Shakespeare's Globe, William Shakespeare]
Thu Aug 06 11:27:34 MSK 2015	UK news	Belfast police hunt for robber on the run in cow print onesie	[Belfast, Crime, Northern Ireland, UK news]
Thu Aug 06 11:27:15 MSK 2015	Comment is free	Five ways that nuclear weapons could still be used | Alex Wellerstein	[Nuclear weapons, Nuclear power, Energy, Environment, World news, UK news, Japan]
Thu Aug 06 11:19:06 MSK 2015	World news	Corbyn to set out plans for UK nuclear disarmament 70 years after Hiroshima	[Nuclear weapons, Trident, UK news, Jeremy Corbyn, Defence policy, Military, Politics, World news, Labour party leadership, Labour]
Thu Aug 06 11:16:43 MSK 2015	NatWest partner zone	Where's best for your business – urban or rural?	[NatWest partner zone]
Thu Aug 06 11:15:05 MSK 2015	Comment is free	Why laptops are mightier than guns | D Watkins	[US gun control, Baltimore, Technology, US income inequality]
Thu Aug 06 11:14:57 MSK 2015	Art and design	Thumbs down! Why it's a disaster to restore the Colosseum	[Art and design, Culture, Rome holidays, Europe, Italy holidays, Architecture, Archaeology]
Thu Aug 06 11:04:41 MSK 2015	UK news	Man posing as Asda employee steals £40,000 from currency kiosk	[Greater Manchester, Crime, UK news, Asda]
Thu Aug 06 11:04:28 MSK 2015	Sport	Impact from within: MLB players emerging at the right time	[MLB, Baseball, Sport, US sports, Pittsburgh Pirates, New York Mets, Boston Red Sox, Texas Rangers, Houston Astros, New York Yankees, Philadelphia Phillies]
Thu Aug 06 11:01:54 MSK 2015	Environment	Is it too late to stop Turkey's coal rush?	[Coal, Fossil fuels, Environment, Energy, Turkey, Climate change, Greenhouse gas emissions]
Thu Aug 06 11:01:11 MSK 2015	Media	Capital regains London radio crown	[Rajars, Radio industry, Global Radio, Commercial radio, Media, Radio, Television & radio, Culture, London, UK news]
Thu Aug 06 11:00:31 MSK 2015	Comment is free	Stopped having sex? Setting a schedule won’t get you going again | Rhiannon Lucy Cosslett	[Relationships, Sex, Marriage, Family, Life and style, UK news]
Thu Aug 06 11:00:19 MSK 2015	Music	Readers recommend: songs about farming – results	[Music, Culture, Soul, Pop and rock, Jazz, Ella Fitzgerald, Bruce Springsteen, Farming, Folk music, Country]
Thu Aug 06 11:00:18 MSK 2015	Technology	Serial podcast spearheading new era of online radio, says Mixcloud	[Digital music and audio, Podcasting, Digital media, Internet, Technology, Media, Radio, Radio industry, Culture]
Thu Aug 06 11:00:18 MSK 2015	US news	What would Donald Trump actually do as president? An analysis of his policies	[Donald Trump, Republicans, US elections 2016, US news, US politics]
Thu Aug 06 11:00:17 MSK 2015	Money	#BlackLivesMatter and so should the high unemployment rate	[Unemployment, US unemployment and employment statistics, US unemployment and employment data, US elections 2016, Hillary Clinton, Race issues, US economy, Money, Unemployment and employment statistics]
Thu Aug 06 11:00:17 MSK 2015	Children's books	The Curious Incident of the Dog in the Night–Time by Mark Haddon - review	[Children and teenagers, Books, Culture, Teen books, Mark Haddon]
Thu Aug 06 10:59:28 MSK 2015	Public Leaders Network	10 steps to building a smart city	[Public Leaders Network, Technology, Cities, Technology, Engagement, Smart cities, Cities, Internet of things, Leadership and management, Transport policy, Politics, Urbanisation, World news]
Thu Aug 06 10:59:17 MSK 2015	Books	Circling the Square by Wendell Steavenson review – the Egyptian revolution, up close and personal	[History, Books, Culture, Egypt, Middle East and North Africa, Africa, World news]
Thu Aug 06 10:57:26 MSK 2015	UK news	Tube strike FAQ: myths busted and questions answered	[London Underground, RMT, Trade unions, London, Rail transport, Transport, UK news, Boris Johnson, TfL, Politics, Industrial action]
Thu Aug 06 10:56:01 MSK 2015	World news	Hiroshima reflections: 'The ranks of Hibakusha grow thinner as the years go on'	[Japan, Asia Pacific, World news, Second world war, Nuclear weapons]
Thu Aug 06 10:48:45 MSK 2015	World news	Rescue hopes fade for migrants after boat capsizes in Mediterranean	[Italy, Migration, Libya, Africa, Europe, Middle East and North Africa, World news]
Thu Aug 06 10:45:53 MSK 2015	Global Development Professionals Network	Is the Caribbean a paradise for renewable energy?	[Global development professionals network, Jamaica, Barbados, Renewable energy, Solar power, Wind power, Geothermal energy, St Lucia, Dominica, Americas, Energy, Environment, World news]
Thu Aug 06 10:45:17 MSK 2015	Comment is free	Poor communities fear America's clean power plan could increase local pollution | Kimberly Wasserman	[Climate change, Coal, Fossil fuels, Energy, Environment, Illinois]
Thu Aug 06 10:44:42 MSK 2015	Environment	Welsh council rejects plans for new opencast coal mine	[Coal, Environment, Mining, Mining, Business, Energy, Fossil fuels, Wales, UK news, Friends of the Earth]
Thu Aug 06 10:43:00 MSK 2015	Football	Championship 2015-16 season preview | Jacob Steinberg	[Championship, Football League, Football, Sport]
Thu Aug 06 10:39:44 MSK 2015	Technology	Tesla’s Model X electric SUV will be available to buy in September	[Motoring, Electric, hybrid and low-emission cars, Technology, Environment, Automotive industry, Business, Elon Musk]
Thu Aug 06 10:38:42 MSK 2015	Guardian Masterclasses	How to write an academic paper and get it published | Olivia Timbs	[Guardian Masterclasses, New Masterclasses, writing and publishing courses, Business masterclasses]
Thu Aug 06 10:37:32 MSK 2015	Science	Scientists or beancounters: who decides what’s best for UK science?	[Science, Science funding crisis, Austerity]
Thu Aug 06 10:30:24 MSK 2015	Football	Premier League summer signings XI for £49m  … or one Raheem Sterling	[Premier League, Transfer window, Football, Sport]
Thu Aug 06 10:22:23 MSK 2015	Business	Tesco shares jump 2% on hopes recovery is on track	[Business, Tesco]
Thu Aug 06 10:21:38 MSK 2015	Film	Colin Farrell to star as wizard in JK Rowling's New York-set Fantastic Beasts	[Fantastic Beasts and Where to Find Them, Film, Culture, Colin Farrell, Eddie Redmayne, JK Rowling, Books]
Thu Aug 06 10:19:32 MSK 2015	Technology	Reddit finally bans its white-supremacist subreddits	[Reddit, Technology, Internet, Social media, Media, Digital media]
Thu Aug 06 10:19:03 MSK 2015	Television & radio	Gordon's alive! Phillip Schofield's puppet sidekick is back	[Children's TV, BBC, Television, Culture, Media, Television & radio, Comedy, Comedy]
Thu Aug 06 10:17:27 MSK 2015	Comment is free	Jeremy Corbyn for prime minister? Why not? | Brian Eno	[Labour party leadership, Jeremy Corbyn, Politics, Labour, UK news]
Thu Aug 06 10:00:05 MSK 2015	Environment	Charles Koch gets some climate science right, but economics wrong | Dana Nuccitelli	[Climate change scepticism, Climate change, Environment, Science, Climate change, Economic policy, US economic growth and recession, Politics]
Thu Aug 06 10:00:04 MSK 2015	US news	Republican hopefuls jostle for limelight in TV debate as Trump's shadow looms	[US elections 2016, US politics, Republicans, Donald Trump, Jeb Bush, Hillary Clinton, Scott Walker, Mike Huckabee, Ben Carson, Ted Cruz, Marco Rubio, Rand Paul, Chris Christie, Carly Fiorina, Rick Perry, Rick Santorum, US news]
Thu Aug 06 09:54:43 MSK 2015	Sport	The Premier League returns and enjoy a gallop with American Pharoah	[Football, Sport, Boxing, Horse racing, American Pharoah, Diving, Fenerbahçe, Olympics]
Thu Aug 06 09:48:22 MSK 2015	Sport	Talking Horses: Thursday’s best bets plus the latest racing news	[Tony McCoy, Horse racing tips, Horse racing, Sport]
Thu Aug 06 09:43:45 MSK 2015	World news	Gaza explosion: four dead and 40 injured in Rafah	[Gaza, Palestinian territories, Israel, Middle East and North Africa, World news]
Thu Aug 06 09:40:38 MSK 2015	Guardian Masterclasses	How to write better copy | Eddy Lawrence	[Guardian Masterclasses, Business masterclasses, writing and publishing courses]
Thu Aug 06 09:27:07 MSK 2015	Technology	How can I get into my PC without an admin password?	[Technology, Windows, Windows 8, Microsoft, Software, Windows 10]
Thu Aug 06 09:20:17 MSK 2015	Australia news	Queensland bureaucrat steps down after IT glitch blocked school abuse reports	[Queensland, Queensland politics, Australia news, Child protection, Australian education]
Thu Aug 06 09:17:34 MSK 2015	Football	Sunderland sign Yann M’Vila on season-long loan from Rubin Kazan	[Sunderland, Transfer window, Football, Sport]
Thu Aug 06 09:17:19 MSK 2015	Business	US investment bank Citi under fire over Spanish share sale	[Citigroup, Banking, Business]
Thu Aug 06 09:16:49 MSK 2015	Media	The Great British Bake Off rises again with 9.3 million viewers	[TV ratings, BBC, Television industry, Media, The Great British Bake Off]
Thu Aug 06 09:14:15 MSK 2015	Global Development Professionals Network	South Sudan: More will die from cholera unless we secure clean water	[Global development professionals network, people in development - global development professionals network, humanitarians, Water, Cholera, Access to water, Sanitation, Infectious diseases, South Sudan, Conflict and development]
Thu Aug 06 09:11:16 MSK 2015	Comment is free	Disappointed by Go Set a Watchman? Sorry, that’s the risk inherent in fiction | John Mullan	[Harper Lee, Fiction, Books, Culture, UK news]
Thu Aug 06 09:07:34 MSK 2015	Technology	Chatterbox: Thursday	[Games, Technology]
Thu Aug 06 09:04:42 MSK 2015	UK news	Manchester 'Oyster card' in turmoil as contractor admits it cannot deliver	[Manchester, George Osborne, Greater Manchester, Politics, UK news, Transport policy, Transport, Cities]
Thu Aug 06 09:04:27 MSK 2015	Money	Halifax records 0.6% fall in July house prices	[House prices, Property, Mortgages, Money, UK news]
Thu Aug 06 09:02:46 MSK 2015	Film	Coen brothers sign up for Ross Macdonald adaptation Black Money	[Film, Coen brothers, Crime, Film adaptations, Books, Culture, Crime fiction, Fiction, US news, World news]
Thu Aug 06 09:00:03 MSK 2015	Sport	The locals bringing soccer back to Detroit: 'We want this to last for generations'	[US sports, Detroit, Football, Sport, US news, World news]
Thu Aug 06 09:00:02 MSK 2015	Football	A brief guide to … the opening day of the Premier League season	[Premier League, Football, Sport, Manchester United, Arsenal, Norwich City, Aston Villa, Everton, Swansea City, Manchester City, Chelsea, Tottenham Hotspur, US sports]
Thu Aug 06 08:58:00 MSK 2015	Education	Six hopeful students count the hours till A-level results day	[Students, Education, Higher education, Advice for students, A-levels, Sixth form, Exams, Schools]
Thu Aug 06 08:50:12 MSK 2015	Politics	Andy Burnham launches manifesto rejecting free schools and academies	[Andy Burnham, Labour party leadership, Labour, Politics, UK news, Jeremy Corbyn]
Thu Aug 06 08:49:01 MSK 2015	Media Network	The sound of silence: new video tech looks beyond the internet of things	[Media & Tech Network, Technology, Internet of things, Surveillance, Privacy]
Thu Aug 06 08:49:00 MSK 2015	Football	Which clubs will be relegated from the Premier League this season? – poll	[Premier League, Football, Sport]
Thu Aug 06 08:49:00 MSK 2015	Football	Who will be the top goalscorer in the Premier League this season? – poll	[Premier League, Football, Sport]
Thu Aug 06 08:49:00 MSK 2015	Football	Which club will win the Premier League this season? – poll	[Premier League, Football, Sport]
Thu Aug 06 08:49:00 MSK 2015	Football	Who will be the best Premier League signing of the summer? – poll	[Premier League, Football, Sport]
Thu Aug 06 08:45:47 MSK 2015	Business	It's nonsense to believe more flexibility leads to greater productivity | Greg Jericho	[Australian economy, Australia news, Productivity Commission, Business]
Thu Aug 06 08:42:38 MSK 2015	Music	Katy Perry's Met Ball dress the subject of copyright infringement lawsuit	[Katy Perry, Music, Culture, Moschino, Fashion, Street art]
Thu Aug 06 08:39:56 MSK 2015	Business	FTSE slips ahead of Super Thursday but Old Mutual and Inmarsat rise	[Business, Old Mutual, Inmarsat, Aviva, RSA Insurance, BP, Anglo American, SABMiller, Tullow Oil]
Thu Aug 06 08:39:30 MSK 2015	Technology	Uber losing millions of dollars, documents reveal	[Uber, Technology sector, Business, Technology startups, Technology, Internet, Apps]
Thu Aug 06 08:37:22 MSK 2015	Film	Off to be a wizard: Eddie Redmayne to play Wizard of Oz author L Frank Baum	[Biopics, Film, Culture, The Wizard Of Oz, Eddie Redmayne]
Thu Aug 06 08:33:45 MSK 2015	US news	Former US president George W Bush turns up for jury service	[George Bush, US news, Texas, World news, Dallas]
Thu Aug 06 08:15:07 MSK 2015	Australia news	Joe Hockey rules out GST rise to fund states' expenditure	[GST (Goods and Services Tax), Joe Hockey, Tax (Australia), Australia news, Australian politics, New South Wales, Mike Baird, Coag (Council of Australian governments)]
Thu Aug 06 08:00:02 MSK 2015	Football	Premier League 2015-16 preview No17: Tottenham Hotspur	[Premier League 2015-16 previews, Tottenham Hotspur, Mauricio Pochettino, Harry Kane, Football, Sport]
Thu Aug 06 08:00:02 MSK 2015	Sport	'Stay in your lane': Why Ronda Rousey wouldn't last long in women's boxing	[Ronda Rousey, Boxing, UFC, Sport, US sports, Floyd Mayweather, MMA]
Thu Aug 06 08:00:01 MSK 2015	Comment is free	Take down your taxidermy – it's a disgrace | Philip Hoare	[Wildlife, Animals, Cecil the lion, Environment, World news]
Thu Aug 06 08:00:01 MSK 2015	Children's books	Romans on the Rampage by Jeremy Strong - review	[Children and teenagers, Books, Culture, Children's books: 7 and under, Children's books: 8-12 years, Funny books (children and teens), Historical fiction (children and teens)]
Thu Aug 06 07:59:01 MSK 2015	Books	The Blue Between Sky and Water by Susan Abulhawa review – a displaced Palestinian family’s bid for survival	[Fiction, Books, Culture, Palestinian territories, Middle East and North Africa, Refugees, World news]
Thu Aug 06 07:57:55 MSK 2015	Global development	Trans-Pacific Partnership could pose risk to public healthcare, leaked draft shows	[Trade and development, Health, Society, Pharmaceuticals industry, Healthcare industry, Australian economy, Australia news, Australian law, Business]
Thu Aug 06 07:56:53 MSK 2015	Music	Alice Cooper's Hollywood Vampires album due for September release	[Alice Cooper, Music, Culture, Pop and rock, Metal, Paul McCartney, Johnny Depp]
Thu Aug 06 07:54:43 MSK 2015	Football	Football transfer rumours: Adnan Januzaj to Sunderland?	[Football, Sport]
Thu Aug 06 07:47:38 MSK 2015	Guardian Masterclasses	Food styling and photography with Rosie Reynolds and Jill Mead	[Guardian Masterclasses, New Masterclasses, Photography courses, Food and drink courses]
Thu Aug 06 07:47:31 MSK 2015	Media	Seven loses legal fight to halt broadcast of The Hotplate	[Australian media, Australian television, Reality TV, Television, Television & radio]
Thu Aug 06 07:44:56 MSK 2015	Australia news	ABC moves Q&A to news division, but not until the end of the year	[Q&A, Australian Broadcasting Corporation, Australian media, Australian politics, Media]
Thu Aug 06 07:37:50 MSK 2015	Media	Today's media stories from the papers	[Media]
Thu Aug 06 07:36:59 MSK 2015	Social Care Network	Care dispute highlights lack of clarity over personalisation	[social care network: adult social care hub, Social Care Network, Personalisation, Work practices, England, Policy, Social care, Carers, Society, Disability]
Thu Aug 06 07:33:34 MSK 2015	Voluntary Sector Network	Gangrene and razor wire: charity in Calais is no different to a disaster zone	[Voluntary Sector Network, Charities, Voluntary sector network blog, Society, Voluntary sector, Governance and management, Public Leaders Network, Healthcare Network, Immigration and asylum, Channel Tunnel, France, Migration and development, Migration, Europe]
Thu Aug 06 07:23:22 MSK 2015	Business	Super Thursday: the Bank of England's triple data day explained	[Bank of England, Business, Interest rates, Economics, UK news, Inflation]
Thu Aug 06 07:20:31 MSK 2015	Guardian Sustainable Business	Greenpeace: why we're asking Shell staff to face the music over Arctic drilling	[Guardian sustainable business, Oil, Arctic, Royal Dutch Shell, Oil, Oil and gas companies, Environment, Energy, World news, Protest, Fossil fuels, Energy industry, Business]
Thu Aug 06 07:20:01 MSK 2015	Life and style	How to make the perfect tzatziki	[Greek food and drink, Food & drink, Vegetarian food and drink, Life and style, Meditation]
Thu Aug 06 07:11:00 MSK 2015	Environment	Coalition may change environment laws after Carmichael mine setback	[Carmichael coalmine, Australian politics, Australia news, Environment, Queensland, Greg Hunt, Coalition, Mining, Mining, Australian law, Endangered species, Labor party, India, Conservation, Animals, Wildlife, Climate change, Greenhouse gas emissions]
Thu Aug 06 07:09:52 MSK 2015	Music	Mariah Carey headed for Empire, says series creator Lee Daniels	[Mariah Carey, Music, Pop and rock, Culture, US television, Television, Television & radio]
Thu Aug 06 07:02:36 MSK 2015	Culture	Garma: art and politics come together for a moving Arnhem Land festival	[Festivals, Indigenous Australians, Art, Music, Dance, Art and design, Culture, Northern Territory, Australia news]
Thu Aug 06 07:00:03 MSK 2015	Television & radio	The best Jon Stewart Daily Show moments: readers' choices	[US television, Jon Stewart, Media, Television, Culture, Television & radio]
Thu Aug 06 07:00:02 MSK 2015	Comment is free	The Picture of Dorian Gray made me forever suspicious of the self-righteous | Deborah Orr	[Books, Oscar Wilde, LGBT rights, Culture]
Thu Aug 06 07:00:01 MSK 2015	Books	Sexism in publishing: 'My novel wasn’t the problem, it was me, Catherine'	[Books, Publishing, Fiction, Gender, Women, Culture, Creative writing]
Thu Aug 06 07:00:01 MSK 2015	Art and design	Toshio Shibata's best photograph: a red bridge at sunset near Ōkawa village	[Photography, Art and design, Culture, Japan]
Thu Aug 06 07:00:00 MSK 2015	Cities	The Guardian Cities: Skylines challenge – can I build a truly anti-capitalist city?	[Cities, Game culture, Games, Technology, Culture, Urbanisation, Economics, Money, Greece, Business, World news]
Thu Aug 06 07:00:00 MSK 2015	Cities	The Guardian Cities: Skylines challenge – can I build the world's greenest city?	[Cities, Games, Culture, Technology, Environment, Green space, Energy, Coal, Fossil fuels, Solar power, Renewable energy, Landfill, Waste, Wind power]
