Sun Aug 09 06:00:15 MSK 2015	Money	Banks offer students interest-free overdrafts of up to £3,000	[Student finance, Higher education, Students, Money, Banks and building societies, Current accounts, UK news]
Sun Aug 09 06:00:15 MSK 2015	Travel	The foodie traveller … tries paella as it was meant to taste	[Spain holidays, Valencia, Food and drink, Spanish food and drink, Restaurants, Travel]
Sun Aug 09 06:00:14 MSK 2015	Culture	Publish and be banned: what happens when embargoes are broken	[Culture, Media, Stage, Books, Harper Lee, JK Rowling, Oasis, Music, Spider-Man: Turn Off the Dark, Theatre]
Sun Aug 09 06:00:14 MSK 2015	Television & radio	The week in TV: The Great British Bake Off, New Tricks, Are Our Kids Tough Enough? Chinese School, Sex in Class	[Television, Television & radio, Culture, The Great British Bake Off, Food TV, Mary Berry, Schools, Sex education, Crime drama]
Sun Aug 09 06:00:14 MSK 2015	Film	Timbuktu, Democrats, Glassland, The Water Diviner, She’s Funny That Way and more – DVD reviews	[DVD and video reviews, Film, Culture, Peter Bogdanovich, Owen Wilson, Russell Crowe]
Sun Aug 09 06:00:14 MSK 2015	Travel	The best bars and restaurants in Havana and Trinidad, Cuba – according to local B&B owners	[Cuba, Havana, Hotels, Bed and breakfasts, Airbnb, Restaurants, Bars and clubs, Food and drink, Travel, Caribbean, North and Central America]
Sun Aug 09 06:00:13 MSK 2015	Television & radio	The week in radio: Women of Terror; The Misogyny Book Club	[Radio, Television & radio, Culture, Radio 4, Fiction, Feminism, Factual radio, Women]
Sun Aug 09 06:00:13 MSK 2015	Music	Julio Bashmore: Knockin’ Boots review – a feelgood blast of house music	[Dance music, Music]
Sun Aug 09 06:00:12 MSK 2015	Guardian Sustainable Business	Indigenous Peoples' Day: mining tradition	[anglo american partner zone]
Sun Aug 09 06:00:12 MSK 2015	Music	Health: Death Magic review – dated and attention-seeking	[Indie, Music, Culture]
Sun Aug 09 06:00:12 MSK 2015	Environment	OMG… Greenland’s ice sheets are melting fast	[Climate change, Polar regions, Environment, Greenland, Arctic, Oceans, Sea level, Nasa]
Sun Aug 09 06:00:12 MSK 2015	Money	Receiving countless letters from Virgin	[Consumer rights, Consumer affairs, Virgin Media, Money, Media]
Sun Aug 09 06:00:11 MSK 2015	Music	Mac DeMarco: Another One review – wry pop songs about the vicissitudes of love	[Pop and rock, Music, Culture]
Sun Aug 09 05:59:12 MSK 2015	Technology	Spotlight on… escape games	[Games, Technology, Culture]
Sun Aug 09 05:59:11 MSK 2015	Music	Georgia: Georgia review – a constantly shifting soundtrack to modern London	[Hip-hop, Urban music, Music, Culture]
Sun Aug 09 05:49:26 MSK 2015	Sport	'The final low', pronounce Australia's media after tourists' Ashes fate is sealed	[The Ashes, Ashes 2015, Australia cricket team, England cricket team, Cricket, Australia sport, Sport]
Sun Aug 09 05:30:11 MSK 2015	Books	The Raj at War: A People’s History of India’s Second World War review – how the conflict brought an end to British rule	[History, Books, Culture, Second world war, India]
Sun Aug 09 05:30:11 MSK 2015	Life and style	Love in the time of technology: an app for every moment | Eva Wiseman	[Relationships, Apps, Technology]
Sun Aug 09 05:00:13 MSK 2015	Technology	Seat X-PERIENCE: car review | Martin Love	[Motoring, Technology]
Sun Aug 09 05:00:12 MSK 2015	Life and style	Levanter Fine Foods: restaurant review | Jay Rayner	[Food & drink, Restaurants, Restaurants, Life and style, Travel]
Sun Aug 09 05:00:12 MSK 2015	Travel	Travel tips: Macedonia’s Lake Ohrid | Joanne O’Connor	[Travel, Macedonia, London holidays, United Kingdom holidays, Europe, England holidays, Paris holidays, France holidays, Hotels, Hostels]
Sun Aug 09 05:00:11 MSK 2015	Life and style	The best new temporary hair colours | Eva Wiseman	[Beauty, Life and style]
Sun Aug 09 05:00:11 MSK 2015	Life and style	Three of Portugal’s best white wines | David Williams	[Wine, Food & drink, Life and style]
Sun Aug 09 05:00:10 MSK 2015	Environment	Has the Amazon rainforest been saved, or should I still worry?	[Amazon rainforest, Deforestation, Trees and forests, Ethical and green living, Environment, Life and style]
Sun Aug 09 05:00:10 MSK 2015	Fashion	Smarten up: go for monochrome | Alice Fisher	[Fashion, Life and style]
Sun Aug 09 05:00:10 MSK 2015	Life and style	Performers Bryony Kimmings and Tim Grayburn on their unusual romance	[Relationships, Life and style, Performance art, Depression]
Sun Aug 09 04:59:10 MSK 2015	Life and style	Gardens: the inbetweeners | Dan Pearson	[Gardening advice, Gardens, Life and style]
Sun Aug 09 03:17:06 MSK 2015	World news	Virgin Australia and Jetstar cancel more Bali flights because of volcanic ash	[Air transport, Virgin Australia, Bali, Indonesia, Australia news]
Sun Aug 09 03:11:32 MSK 2015	Sport	Michael Clarke: tributes after Australian captain announces Test retirement	[Michael Clarke, Ashes 2015, The Ashes, Australia sport, Cricket, Australia cricket team, Sport]
Sun Aug 09 02:54:37 MSK 2015	Australia news	Tony Abbott on travel expenses: go by what would be acceptable in business	[Australian politicians' expenses, Tony Abbott, Australian politics, Coalition, Bronwyn Bishop, Joe Hockey, Christopher Pyne, Australia news, Tony Burke, Labor party]
Sun Aug 09 02:42:48 MSK 2015	Australia news	Australia's census to go online in 2016	[Australia news, Population]
Sun Aug 09 02:06:22 MSK 2015	US news	Republican candidates struggle to duck Donald at RedState Gathering	[Republicans, US elections 2016, US news, US politics, Donald Trump]
Sun Aug 09 01:28:12 MSK 2015	Film	Dark Age rewatched: John Jarratt in a creature feature 'so crazy it worked'	[Australian film, Film, Culture, Indigenous Australians, Drama]
Sat Aug 08 23:41:00 MSK 2015	Sport	England’s Stuart Lancaster seeks versatile players for World Cup squad	[England rugby union team, Stuart Lancaster, Rugby World Cup 2015, Rugby World Cup, Rugby union, Sport]
Sat Aug 08 23:37:35 MSK 2015	Sport	Adam Goodes returns: Swans lose to Cats but AFL scores a goal against racism	[Adam Goodes, AFL, Australia sport, Victoria, Australian rules football, Indigenous Australians, Sydney Swans]
Sat Aug 08 23:19:04 MSK 2015	Comment is free	Is there still hope for Labour in Scotland? | Kevin McKenna	[Scottish politics, Scotland, Labour party leadership, UK news, Politics, Labour]
Sat Aug 08 23:09:03 MSK 2015	Comment is free	Growing student debt is entrenching unfairness for a whole generation | Will Hutton	[Higher education, Tuition fees, Students, Education, Social mobility, Society, UK news, Student finance, Money, Education policy, Politics]
Sat Aug 08 23:06:03 MSK 2015	Comment is free	The Observer view on Donald Trump | editorial	[US elections 2016, Donald Trump, US politics, Republicans, US news, UK news]
Sat Aug 08 23:05:06 MSK 2015	Comment is free	The Observer view on licensing grouse estates | Observer editorial	[Environment, RSPB, Birds, Wildlife, Hunting, Animals, UK news, Conservation, Scotland]
Sat Aug 08 23:05:06 MSK 2015	Comment is free	Is it cold in here or is it just me? Or is it just a man’s world? | Catherine Bennett	[Women, Society, Life and style, Gender, World news, UK news]
Sat Aug 08 23:05:06 MSK 2015	Comment is free	I’m not saying that I hate gloating Poms… | Kathy Lette	[Ashes 2015, Australia cricket team, The Ashes, Cricket, Sport, England cricket team, UK news]
Sat Aug 08 23:05:06 MSK 2015	Comment is free	Is the fabric of the union about to be weakened by another tug? | Andrew Rawnsley	[Scottish National party (SNP), Politics, Scotland]
Sat Aug 08 23:05:04 MSK 2015	News	From the Observer archive, August 1972: Dick Taverne and Labour	[Politics past, Politics, Labour, UK news]
Sat Aug 08 23:05:04 MSK 2015	Comment is free	Take a tip from waiters: workers’ rights are being destroyed | Nick Cohen	[Trade unions, London, Rail transport, UK news, Unite, Politics, RMT, Jeremy Corbyn]
Sat Aug 08 23:05:04 MSK 2015	Comment is free	Listen to the sex workers – but which ones? | Helen Lewis	[Sex trade, Society, Robots, Technology, UK news, Theatre, Stage]
Sat Aug 08 23:05:04 MSK 2015	News	For the record	[UK news]
Sat Aug 08 23:05:04 MSK 2015	Sport	England captain Alastair Cook caps day of Ashes glory	[Ashes 2015, Cricket, The Ashes, England cricket team, Australia cricket team, Sport, Alastair Cook, World news]
Sat Aug 08 23:05:03 MSK 2015	From the Observer	Neil Kinnock and the Labour party’s vision – or lack of it | the big issue	[Labour party leadership, Neil Kinnock, Jeremy Corbyn, Labour, Politics, UK news]
Sat Aug 08 23:05:03 MSK 2015	Global	We’re a rich country, we should do more for asylum seekers | letters	[UK news]
Sat Aug 08 23:05:00 MSK 2015	Stage	From Hollywood action to a turn on the fringe: John Hannah returns to Scottish stage	[Edinburgh festival 2015, Edinburgh, Scotland, UK news, Stage]
Sat Aug 08 23:04:05 MSK 2015	Comment is free	If our small farms are allowed to wither, the whole nation will suffer  | Patrick Holden	[UK news, Farming, Environment, Food]
Sat Aug 08 23:04:04 MSK 2015	Comment is free	Hamlet at the Barbican: don’t judge a play until press night | John Tiffany	[Theatre, Benedict Cumberbatch, Barbican, William Shakespeare, Culture, Stage, The Times, Daily Mail, UK news, Media]
Sat Aug 08 23:04:04 MSK 2015	US news	Donald Trump’s ‘sexist’ attack on TV debate presenter sparks outrage	[Donald Trump, Republicans, US news, Fox News, World news, Media, US politics]
Sat Aug 08 23:04:04 MSK 2015	Business	Pizza chain’s angry staff launch protests over slice taken off their hard-earned tips	[Food & drink industry, Business, Restaurants, Unite, Politics, Life and style, Food & drink, Trade unions, UK news, Pay, Work & careers, Family finances]
Sat Aug 08 23:04:04 MSK 2015	Comment is free	If Jeremy Corbyn becomes leader, will he make the hard calls? | Frank Field	[Labour party leadership, Politics, UK news, Immigration and asylum, Labour, Jeremy Corbyn, NHS, Health, Society]
Sat Aug 08 23:04:04 MSK 2015	Media	Now that Jon Stewart has stepped down, does anyone have his edge?	[Jon Stewart, Media, US news, World news, US politics]
Sat Aug 08 23:04:04 MSK 2015	Stage	Genius, coward… or madman? Why Hamlet gives actors the ultimate test	[Theatre, Stage, William Shakespeare, Benedict Cumberbatch, Culture, Barbican, Film, Jonathan Pryce, UK news]
Sat Aug 08 23:04:03 MSK 2015	Life and style	Brewing up a storm: British-grown luxury tea brands go from strength to strength	[Tea, Food & drink, Life and style, Scotland, UK news]
Sat Aug 08 23:03:03 MSK 2015	Environment	How bird lovers took aim at grouse shooters on Britain’s moors	[Birds, Conservation, Hunting, Wildlife, Animals, Environment, UK news]
Sat Aug 08 23:01:03 MSK 2015	Life and style	Observer sudoku	[Life and style]
Sat Aug 08 23:01:03 MSK 2015	Life and style	Observer killer sudoku	[Life and style]
Sat Aug 08 21:36:25 MSK 2015	Politics	With Labour fixated by Corbyn, the Tories have taken advantage of a feeble opposition. Here’s how they did it...	[Conservatives, David Cameron, George Osborne, UK news, Social care, NHS, Tuition fees, Trade unions, Energy efficiency, Politics, Budget 2015 (July), General election 2015, Society, Economic policy, Health policy, Green politics, Transport policy, Education policy, Tax and spending, Poverty, Welfare]
Sat Aug 08 21:35:41 MSK 2015	Sport	Rory McIlroy’s comeback takes centre stage for US PGA Championship	[Rory McIlroy, US PGA Championship 2015, Golf, Sport, US sports]
Sat Aug 08 21:35:01 MSK 2015	Art and design	Your pictures: share your photos on the theme of 'calm'	[Photography]
Sat Aug 08 21:30:01 MSK 2015	Football	Arsène Wenger wants collective action in Arsenal’s bid for more goals	[Arsenal, Arsène Wenger, Football, Sport]
Sat Aug 08 21:18:08 MSK 2015	Sport	Middlesex’s recall of spinner Ravi Patel pays off against Sussex	[County Championship Division One, Middlesex, Sussex, Cricket, Sport]
Sat Aug 08 21:00:00 MSK 2015	Sport	Andy Murray’s impressive form not fuelled by off-court happiness | Kevin Mitchell	[Andy Murray, Roger Federer, Rafael Nadal, Tennis, Sport]
Sat Aug 08 20:59:00 MSK 2015	Football	Newcastle’s Steve McClaren hopes Aleksandar Mitrovic can lead charge	[Steve McClaren, Newcastle United, Football, Sport]
Sat Aug 08 20:59:00 MSK 2015	Football	Liverpool await check-in of new Shankly spirit to revive good old days | Daniel Taylor	[Bill Shankly, Liverpool, Everton, Rushden & Diamonds, Chelsea, Football, Sport]
Sat Aug 08 20:51:12 MSK 2015	World news	Bosnia’s survivors gather and grieve as the soil endlessly gives up its dead	[Bosnia-Herzegovina, Srebrenica massacre, Europe, War crimes, World news]
Sat Aug 08 20:47:42 MSK 2015	Football	José Mourinho unhappy with Chelsea medical staff over Eden Hazard episode	[José Mourinho, Chelsea, Eden Hazard, Swansea City, Football, Sport]
Sat Aug 08 20:45:02 MSK 2015	Sport	Adil Rashid puts Yorkshire in commanding position against Durham	[County Championship Division One, Yorkshire, Durham, Cricket, Sport]
Sat Aug 08 20:02:07 MSK 2015	US news	Michael Brown Sr urges protesters to step up efforts on shooting anniversary	[Michael Brown shooting, Missouri, Ferguson, US news]
Sat Aug 08 20:00:15 MSK 2015	Sport	England’s Andrew Strauss and team turn shambles into Ashes summer of bliss	[Ashes 2015, England cricket team, Trevor Bayliss, Alastair Cook, Australia cricket team, Michael Clarke, The Ashes, Cricket, Australia sport, Sport]
Sat Aug 08 19:49:00 MSK 2015	Sport	Horse racing tips: Sunday 9 August	[Horse racing tips, Horse racing, Sport]
Sat Aug 08 19:43:16 MSK 2015	Sport	Washington and Houston end NFL practice session with major brawl	[Washington (NFL team), Houston Texans, US sports, Sport, NFL]
Sat Aug 08 19:30:15 MSK 2015	Sport	Australia’s top order faces cull as young hopefuls prepare to step up | Russell Jackson	[Ashes 2015, Australia cricket team, England cricket team, Cricket, The Ashes, Australia sport, Sport]
Sat Aug 08 19:30:15 MSK 2015	World news	Irina Ionesco: the grande dame, her ‘Lolita’ pictures, and a true Paris scandal	[World news, Paris, France, Photography, Art and design, Fiction, Books, Society]
Sat Aug 08 19:08:53 MSK 2015	Football	Football League: your thoughts | Les Roopanarine	[Football League, Football, Sport, Championship, League One, League Two]
Sat Aug 08 19:08:00 MSK 2015	Education	Universities scramble to fill courses before cap is lifted on expansion	[Higher education, Education, Students, University funding, UK news, University administration]
Sat Aug 08 19:04:26 MSK 2015	Society	Social care chief savages failing system for elderly	[Social care, Society, Care Quality Commission (CQC), Health, Regulators, Care workers, Yvette Cooper, Politics, UK news]
Sat Aug 08 19:00:14 MSK 2015	Society	Cash-starved, demoralised and sometimes cruel: how England’s social care system fails the most vulnerable	[Social care, UK news, Care workers, Society, Care Quality Commission (CQC), Health, Regulators, Conservatives, Politics]
Sat Aug 08 18:59:14 MSK 2015	World news	All property is theft but this one’s a steal: Leon Trotsky’s Turkish hideaway for sale	[Turkey, Communism, Real estate, World news, Business]
Sat Aug 08 18:58:01 MSK 2015	Film	Bangistan review – always something to chuckle at in sly suicide-bomber comedy	[Film, Bollywood, India, Culture, South and Central Asia, World news]
Sat Aug 08 18:40:12 MSK 2015	Society	Kids Company closure triggers warnings of tough line on ‘value for money’	[Charities, Voluntary sector, Young people, Kids Company, Society, UK news]
Sat Aug 08 18:38:54 MSK 2015	Sport	Stuart Broad says eight for 15 against Australia was a once in a lifetime spell	[Ashes 2015, Stuart Broad, England cricket team, Joe Root, Australia cricket team, Cricket, The Ashes, Australia sport, Sport]
Sat Aug 08 18:36:19 MSK 2015	Football	Chelsea v Swansea City: Premier League – as it happened	[Premier League, Chelsea, Swansea City, Football, Sport]
Sat Aug 08 18:33:43 MSK 2015	US news	Donald Trump banned from RedState over menstruation jibe at Megyn Kelly	[Donald Trump, US news, Republicans]
Sat Aug 08 18:24:53 MSK 2015	Football	Chelsea have €25m bid for Baba Rahman rejected by Augsburg	[Chelsea, Augsburg, Transfer window, Football, Sport]
Sat Aug 08 18:17:11 MSK 2015	US news	Aurora shooting: shock and mixed emotions in wake of verdict	[Aurora shooting, US crime, Gun crime, US news, Colorado, World news, Capital punishment]
Sat Aug 08 18:05:23 MSK 2015	Football	Louis Laing’s late error gifts Dundee United win at Motherwell	[Scottish Premiership, Inverness Caledonian Thistle, St Johnstone, Motherwell, Dundee United, Hamilton, Ross County, Football, Sport]
Sat Aug 08 17:55:16 MSK 2015	Sport	England’s Trevor Bayliss excited by Ben Stokes’ future after Ashes glory	[Ashes 2015, Trevor Bayliss, Ben Stokes, England cricket team, Australia cricket team, Cricket, The Ashes, Australia sport, Sport]
Sat Aug 08 17:38:58 MSK 2015	Football	Doncaster allow Bury to walk in injury-time equaliser in League One match	[League One, Doncaster Rovers, Bury, Football, Sport]
Sat Aug 08 17:34:48 MSK 2015	Sport	Leigh 26-36 Hull KR | Middle 8 match report	[Super League XX, Hull KR, Rugby league, Super League, Sport]
Sat Aug 08 17:32:34 MSK 2015	Sport	Sammy Jo Bell wins two Shergar Cup races and lifts Ascot’s Silver Saddle	[Ascot, Horse racing, Sport]
Sat Aug 08 17:04:34 MSK 2015	Sport	County cricket – as it happened	[County Championship Division One, Middlesex, Yorkshire, Sport, Sussex, County Championship Division Two, Durham, Cricket]
Sat Aug 08 17:03:12 MSK 2015	Media	From fly-tipping to polar bears: life on the world’s most northerly newspaper	[Newspapers, Newspapers & magazines, Media, Arctic, World news, Norway, Europe, UK news]
Sat Aug 08 16:56:13 MSK 2015	Sport	Michael Clarke might not have known it was over but those watching did | Andy Bull	[Michael Clarke, Ashes 2015, England cricket team, Australia cricket team, Cricket, The Ashes, Australia sport, Sport]
Sat Aug 08 16:48:09 MSK 2015	Sport	Wales’ sluggish Ireland display gives Warren Gatland cause for concern	[Wales rugby union team, Ireland rugby union team, Rugby union, Sport]
Sat Aug 08 16:46:14 MSK 2015	US news	Straight Outta Compton film puts California city back under scrutiny	[Los Angeles, California, Straight Outta Compton, US news, US crime, World news, Gangs, Dr Dre, Suge Knight, Film, Culture, Music, Rap, Hip-hop]
Sat Aug 08 16:28:04 MSK 2015	World news	British tourist reported missing in sea at Bulgarian resort	[Bulgaria, Europe, World news, Thomas Cook, UK news]
Sat Aug 08 16:19:50 MSK 2015	Football	Bournemouth 0-1 Aston Villa | Premier League match report	[Premier League, Bournemouth, Aston Villa, Football, Sport]
Sat Aug 08 16:18:20 MSK 2015	Football	Charlton Athletic 2-0 Queens Park Rangers | Championship match report	[Championship, Charlton Athletic, QPR, Football, Sport]
Sat Aug 08 16:16:23 MSK 2015	Football	Leicester City 4-2 Sunderland | Premier League match report	[Premier League, Leicester City, Sunderland, Football, Sport]
Sat Aug 08 16:16:07 MSK 2015	Football	Norwich City 1-3 Crystal Palace | Premier League match report	[Premier League, Norwich City, Crystal Palace, Football, Sport]
Sat Aug 08 16:11:03 MSK 2015	Football	Everton 2-2 Watford | Premier League match report	[Premier League, Everton, Watford, Football, Sport]
Sat Aug 08 16:10:39 MSK 2015	Sport	'Something is really wrong': the 49ers' journey from Super Bowl to utter chaos	[San Francisco 49ers, NFL, US sports, Sport]
Sat Aug 08 16:10:32 MSK 2015	Football	Premier League and Football League return: Saturday clockwatch – as it happened | Niall McVeigh	[Premier League, Championship, League One, League Two, Scottish Premiership, Bournemouth, Aston Villa, Leicester City, Sunderland, Norwich City, Crystal Palace, Everton, Watford, Football, Sport]
Sat Aug 08 16:10:01 MSK 2015	US news	RedState hypocrisy: does Donald Trump critic Erick Erickson have a woman problem too?	[Donald Trump, US news, Republicans, US elections 2016, Fox News]
Sat Aug 08 16:05:24 MSK 2015	Sport	Philipp Kohlschreiber beats Paul-Henri Mathieu to win Generali Open	[Tennis, Sport]
Sat Aug 08 16:01:55 MSK 2015	Technology	Gifs are the new emojis as they take smartphone chat by storm	[Smartphones, Mobile phones, Filesharing, Internet, UK news, Technology, Facebook, Apple]
Sat Aug 08 15:58:11 MSK 2015	Sport	Wales 21-35 Ireland | Rugby union international match report	[Wales rugby union team, Ireland rugby union team, Rugby union, Sport]
Sat Aug 08 15:57:59 MSK 2015	Football	Bournemouth 0-1 Aston Villa: Premier League – as it happened	[Premier League, Bournemouth, Aston Villa, Football, Sport]
Sat Aug 08 15:45:03 MSK 2015	Stage	The Paradise Project at Edinburgh festival review – how do you build a perfect world?	[Edinburgh festival 2015, Theatre, Stage, Culture, Edinburgh festival, Festivals]
Sat Aug 08 15:32:05 MSK 2015	Sport	Alastair Cook: England’s Ashes series victory is beyond belief	[Ashes 2015, Alastair Cook, England cricket team, Australia cricket team, Cricket, The Ashes, Australia sport, Sport]
Sat Aug 08 15:17:36 MSK 2015	Technology	Forget Silicon Valley, Bournemouth has found its mojo	[Digital Britain, Regeneration, Communities, Society, UK news, Bournemouth, Technology]
Sat Aug 08 15:16:38 MSK 2015	Sport	Swift Ashes victory heralds exciting times for England’s young players | Mike Selvey	[Ashes 2015, England cricket team, Australia cricket team, Cricket, The Ashes, Australia sport, Sport]
Sat Aug 08 15:00:10 MSK 2015	Business	Privatisation betrays a short-term view of debt	[Economics, Royal Mail, Business, Privatisation, Economic policy, Royal Bank of Scotland]
Sat Aug 08 15:00:09 MSK 2015	Books	Oxford’s online Bodleian archive: illumination for all	[Libraries, Art and design, Books, Art and design, Culture, Manuscripts, Illustration, Design]
Sat Aug 08 14:59:13 MSK 2015	World news	Rwandan peacekeeper shoots dead four others in Central African Republic	[Central African Republic, Rwanda, Africa, World news, Religion]
Sat Aug 08 14:59:09 MSK 2015	Business	It’s the £64bn question: what does George Osborne have left to sell off?	[Royal Bank of Scotland, Privatisation, Business, Economic policy, Politics, George Osborne, Lloyds Banking Group, Royal Mail]
Sat Aug 08 14:40:46 MSK 2015	Sport	England win the Ashes after resounding innings triumph over Australia	[Ashes 2015, The Ashes, England cricket team, Australia cricket team, Cricket, Australia sport, Sport]
Sat Aug 08 14:30:08 MSK 2015	Sport	The Agenda: Team Wiggins head to Derby and the Capital One Cup kicks off	[Cycling, Sir Bradley Wiggins, Capital One Cup, Football, Sport]
Sat Aug 08 14:01:50 MSK 2015	Stage	A Gambler’s Guide to Dying: Edinburgh festival review – warmly comic tale of a bet against death	[Edinburgh festival 2015, Stage, Culture, Theatre, Edinburgh festival, Festivals]
Sat Aug 08 14:00:08 MSK 2015	Children's books	Perfectly Ella by Candy Harper - review	[Children and teenagers, Books, Culture, Children's books: 8-12 years, Children's books: 7 and under, Friendship (children and teens)]
Sat Aug 08 13:39:30 MSK 2015	Football	Manchester United 1-0 Tottenham: Premier League – as it happened	[Premier League, Manchester United, Tottenham Hotspur, Football, Sport]
Sat Aug 08 13:12:27 MSK 2015	Stage	Adrienne Truscott at Edinburgh festival review – a sparky yet shaky performance	[Edinburgh festival 2015, Adrienne Truscott, Stage, Culture, Comedy, Comedy]
Sat Aug 08 13:10:31 MSK 2015	Sport	Nic White the hero as Wallabies finally overcome All Blacks	[Rugby Championship, Rugby union, Sport, Australia rugby union team, New Zealand rugby union team, Australia sport, Bledisloe Cup]
Sat Aug 08 13:00:08 MSK 2015	Travel	Conquering your fears in Alaska: go big, or go home	[Alaska, Travel, Fishing, Glaciers, Polar regions, United States, North and Central America, Environment]
Sat Aug 08 13:00:07 MSK 2015	Books	Anne Fine: ‘Saying “It’s perfectly simple”, is idiotic’	[Anne Fine, Books]
Sat Aug 08 00:27:53 MSK 2015	US news	Forget Donald Trump – Megyn Kelly won the Republican debate	[US elections 2016, US politics, Republicans, Donald Trump, Fox News, US news, US television industry, Media, World news]
Sat Aug 08 00:21:30 MSK 2015	Football	Frank Lampard: tangled up in blue	[Frank Lampard, MLS, New York City FC, Football, Sport, US sports]
Sat Aug 08 00:16:28 MSK 2015	Stage	Liam Williams at Edinburgh festival review – a gripping slice of black comedy	[Edinburgh festival 2015, Comedy, Liam Williams, Stage, Culture, Comedy]
Sat Aug 08 00:15:03 MSK 2015	Sport	England’s weird and wonderful Ashes triumph has reset our expectations | Emma John	[Ashes 2015, England cricket team, The Ashes, Australia cricket team, Australia sport, Cricket, Sport]
Sat Aug 08 00:09:16 MSK 2015	Sport	Adam Goodes returns to AFL: Geelong Cats v Sydney Swans – as it happened	[Adam Goodes, AFL, Australian rules football, Australia sport, Sport]
Sat Aug 08 00:08:15 MSK 2015	Sport	Australia 27-19 New Zealand: Rugby Championship decider – as it happened	[Rugby Championship, Australia rugby union team, New Zealand rugby union team, Rugby union, Australia sport, Sport]
Sat Aug 08 00:07:24 MSK 2015	Science	Scientists to get ringside view as comet 67P reaches closest point to Sun	[Rosetta space probe, Comets, European Space Agency, Space, Astronomy, UK news, Science, World news]
Sat Aug 08 00:02:35 MSK 2015	Sport	Ashes 2015: England beat Australia in fourth Test – as it happened	[Ashes 2015, The Ashes, England cricket team, Australia cricket team, Australia sport, Sport, Over by over reports, Cricket]
Sat Aug 08 00:00:06 MSK 2015	Life and style	How to throw a Tiki party with Hawaii-inspired food, cocktails and decor	[Food & drink, Cocktails, Life and style]
