Sat Aug 08 11:44:07 MSK 2015	Stage	Man to Man five-star review at Edinburgh festival – a world of shadows and shape-shifting	[Edinburgh festival 2015, Theatre, Stage, Culture, Edinburgh festival, Festivals]
Sat Aug 08 11:27:37 MSK 2015	Books	WB Yeats, the art teacher and a night at the sexologist’s	[WB Yeats, London Review of Books, Books, Culture, UK news]
Sat Aug 08 11:15:00 MSK 2015	Sport	England’s women face crucial Ashes Test to come back against Australia	[England women's cricket team, Women's Ashes, Australia sport, Southern Stars, Cricket, Sport]
Sat Aug 08 11:06:00 MSK 2015	Sport	England return to action at last and prepare for the peculiar against France	[Rugby World Cup 2015, England rugby union team, Rugby World Cup, France rugby union team, Rugby union, Sport]
Sat Aug 08 11:00:05 MSK 2015	Technology	'Be picky and have high standards': new dating apps cater to the elite and the rich	[Apps, Dating, Online dating, Life and style, Business, Technology]
Sat Aug 08 11:00:05 MSK 2015	Comment is free	A light-skinned Latina like me will never be able to live in the land of whiteness | Melissa Lozada-Oliva	[Race issues, Society, Beauty, Life and style]
Sat Aug 08 11:00:05 MSK 2015	Children's books	A Series of Unfortunate Events: The Bad Beginning by Lemony Snicket - review	[Children and teenagers, Books, Culture, Children's books: 8-12 years, Teen books, Lemony Snicket, Adventure (children and teens), Funny books (children and teens)]
Sat Aug 08 11:00:05 MSK 2015	Life and style	Turn a batch of ricotta into four different dishes | Get ahead	[Food & drink, Chefs, Cheese]
Sat Aug 08 10:45:27 MSK 2015	Stage	Crash at Edinburgh festival review – a city trader's chilling self-portrait	[Edinburgh festival 2015, Theatre, Stage, Culture, Edinburgh festival, Festivals]
Sat Aug 08 10:45:04 MSK 2015	Comment is free	We're a year into the unofficial war against Isis with nothing to show for it | Trevor Timm	[Islamic State, Syria, Iraq, Middle East and North Africa, Al-Qaida]
Sat Aug 08 10:14:22 MSK 2015	Stage	Fake It 'Til You Make It at Edinburgh festival review – divides audience into smilers and sobbers	[Edinburgh festival 2015, Stage, Culture, Edinburgh festival, Festivals, Depression, Society, Men's health, Health & wellbeing, Life and style]
Sat Aug 08 10:03:54 MSK 2015	Art and design	Glenda Nicholls wins 2015 Deadly art award for A Woman’s Rite of Passage	[Art, Victoria, Art and design, Culture, Indigenous Australians]
Sat Aug 08 10:00:03 MSK 2015	Education	Young people like me need more help deciding what to do after results day	[Students, Sixth form, Advice for students, Education, Higher education, A-levels, Schools, Exams, Applying to university]
Sat Aug 08 09:57:57 MSK 2015	World news	Kabul: death toll rises in deadliest 24 hours Afghan capital has seen in years	[Afghanistan, South and Central Asia, World news, Taliban]
Sat Aug 08 09:30:03 MSK 2015	Music	Jerry Lee Lewis: ‘I worry about whether I'm going to heaven or hell’	[Jerry Lee Lewis, Music, Elvis Presley, Pop and rock, Country]
Sat Aug 08 09:22:17 MSK 2015	Sport	Michael Clarke announces Test retirement after Ashes series defeat	[Australia cricket team, Michael Clarke, Ashes 2015, The Ashes, England cricket team, Cricket, Australia sport, Sport]
Sat Aug 08 09:02:40 MSK 2015	World news	Father of Palestinian toddler killed in West Bank arson attack dies	[Israel, Middle East and North Africa, World news, Binyamin Netanyahu, Palestinian territories]
Sat Aug 08 09:00:03 MSK 2015	Books	The Tears of the Rajas by Ferdinand Mount review – a vivid account of British imperialism in India	[History, Books, Culture, India, South and Central Asia, World news]
Sat Aug 08 09:00:03 MSK 2015	Stage	Dialect action: the Edinburgh show giving Scotland a voice	[Edinburgh festival 2015, Edinburgh festival, Culture, Fringe theatre, Stage, Festivals, Theatre, Scotland, UK news]
Sat Aug 08 09:00:03 MSK 2015	Comment is free	Labour centrists like me aren’t cynics: we’re the truly ethical wing of the left | Jonathan Jones	[Communism, Jeremy Corbyn, Politics, UK news, Russia, World news]
Sat Aug 08 09:00:03 MSK 2015	Technology	Rock Band 4: prepare to dust off your old plastic instruments	[Games, Technology, Culture, Music, PlayStation 4, PlayStation, Sony, Xbox One, Xbox, Microsoft]
Sat Aug 08 09:00:02 MSK 2015	Film	Why Vittorio de Sica is one of Europe’s greatest tragic film-makers	[Film, Books, Culture, World cinema]
Sat Aug 08 08:59:05 MSK 2015	Art and design	Van Gogh + Munch at the Munch Museet, Oslo: shared methods and attitudes	[Exhibitions, Painting, Art, Van Gogh, Edvard Munch, Culture]
Sat Aug 08 08:45:02 MSK 2015	Sport	The gifs that keep on giving: tricks, rage, speed, skill, swings, insults and injury	[Sport, Football, US sports]
Sat Aug 08 08:16:33 MSK 2015	World news	Five women killed in India by villagers suspecting witchcraft	[India, South and Central Asia, World news]
Sat Aug 08 08:00:04 MSK 2015	Stage	Edinburgh fringe 2015: comedy preview special	[Edinburgh festival 2015, Comedy, Stage, Culture, Edinburgh festival]
Sat Aug 08 08:00:04 MSK 2015	Technology	Will VR ever overcome the dork factor?	[Virtual reality, Games, Technology, Culture]
Sat Aug 08 08:00:03 MSK 2015	Television & radio	The latest BGO advert: a new low in betting advertising	[Advertising, Television, Television industry, Television & radio, Media, Culture]
Sat Aug 08 08:00:03 MSK 2015	Stage	Alex Edelman: how I learned to love the British sense of humour	[Edinburgh festival 2015, Comedy, Chris Morris, QI]
Sat Aug 08 08:00:02 MSK 2015	Culture	Populist: Items of interest this week	[Culture]
Sat Aug 08 08:00:02 MSK 2015	Television & radio	Why the best footballing chat can be found on podcasts	[Radio, Television & radio, Culture]
Sat Aug 08 08:00:01 MSK 2015	Children's books	Harry Potter and the Goblet of Fire by J.K. Rowling - review	[Children and teenagers, Books, Culture, Children's books: 8-12 years, Teen books, Harry Potter, Witches, wizards and magic, School, Children's fantasy books (children's and teens), JK Rowling]
Sat Aug 08 07:59:01 MSK 2015	Stage	Michael Che: ‘Comedy can be very boring’	[Edinburgh festival 2015, Comedy, Edinburgh festival, Culture, Stage]
Sat Aug 08 07:59:01 MSK 2015	Television & radio	Liz McDonald is a Corrie badass	[Soap opera, Television, Television & radio, Culture]
Sat Aug 08 07:30:01 MSK 2015	Culture professionals network	Artists: there's life beyond London!	[Culture professionals network, Art, Art and design, Culture, Design, London, Cities, Renting property, Property, Money, Finance]
Sat Aug 08 07:30:00 MSK 2015	Books	Hen Harrier Poems by Colin Simms review – a remarkable tribute to an endangered bird	[Poetry, Science and nature, Books, Culture, Conservation, Wildlife, Birds, Environment]
Sat Aug 08 07:30:00 MSK 2015	Life and style	Doing porridge: prison, school and hospital meals put to the test	[Food & drink, Life and style, Prisons and probation, Society, School meals, Schools, Education, Hospitals, Diets and dieting, Fish, Seafood, Jamie Oliver, Vegetables, Soup, Pasta, Sandwiches, Salad, Cheese, Rice, Meat, Indian food and drink, Avocados, Chicken]
Sat Aug 08 07:00:10 MSK 2015	World news	‘We are taking the island back’: Norway’s long road back to Utøya	[Norway, World news, Politics, Anders Behring Breivik, Europe, UK news]
Sat Aug 08 07:00:09 MSK 2015	Stage	Edinburgh festival for kids: the best family shows	[Edinburgh festival 2015, Children's theatre, Puppetry, Circus, Theatre, Stage, Culture, Edinburgh festival, Festivals, Fringe theatre]
Sat Aug 08 07:00:08 MSK 2015	Comment is free	We laid stones on the border to signify Scotland’s union with the UK. Now they lie forgotten by the M6	[Scottish independence, Scottish politics, Politics, Scotland, UK news, General election 2015, Labour, Liberal Democrats]
Sat Aug 08 07:00:08 MSK 2015	Life and style	The weekend cook: Thomasina Miers’ recipes for Sicilian-style sea trout, and pickled beetroot salad	[Life and style, Food & drink, Main course, Fish, Seafood, Vegetables, Vegetarian food and drink, Salad, Italian food and drink]
Sat Aug 08 07:00:08 MSK 2015	Guardian Small Business Network	In the spotlight ... Headspace Group	[Guardian Small Business Network, Business, Small business, Commercial property, Work & careers, BuzzFeed, Real estate, Renting property]
Sat Aug 08 06:45:07 MSK 2015	Life and style	I ratted out my bank robber brothers	[Family, Life and style, Crime, Crime fiction, Fiction, Books, Film]
Sat Aug 08 06:00:12 MSK 2015	Money	The bankers – they’ve won again	[Banks and building societies, Money, Royal Bank of Scotland, Banking, Business, Banking reform, Financial sector]
Sat Aug 08 06:00:11 MSK 2015	Travel	What’s new in your favourite UK holiday spots	[United Kingdom holidays, Scotland holidays, Devon holidays, Cornwall holidays, Lake District holidays, Yorkshire holidays, Family holidays, Day trips, Travel]
Sat Aug 08 06:00:11 MSK 2015	UK news	Kids Company closure could cause lasting damage to children – therapists	[Kids Company, Camila Batmanghelidjh, Children, Society, UK news]
Sat Aug 08 06:00:10 MSK 2015	Music	Sinatra: All or Nothing at All - no hagiography of the kid from Hoboken	[Frank Sinatra, Music, Documentary, Television, Television & radio, Factual TV]
Sat Aug 08 06:00:10 MSK 2015	Teacher Network	Secret Teacher: I know my students won't get the results they deserve	[Teacher Network, Education, Teaching, Exams, GCSEs, A-levels, Schools, Primary schools, Secondary schools, Sixth form]
Sat Aug 08 06:00:10 MSK 2015	Money	Should we buy a gas barbecue?	[Consumer affairs, Money, Barbecue, Food & drink, Life and style]
Sat Aug 08 06:00:09 MSK 2015	Travel	Running Horses, Mickleham, Surrey: hotel review	[England holidays, Hotels, Food and drink, Travel, Pubs, Food & drink, Life and style]
Sat Aug 08 06:00:09 MSK 2015	Money	Tenants who face eviction every year	[Renting property, Money, Property, Housing market, Real estate, Bristol, UK news, Business]
Sat Aug 08 06:00:09 MSK 2015	Money	ENO hit a low note when it refused to allow one of my party back after an interval	[Money, English National Opera (ENO), Music, Consumer affairs, Consumer rights]
Sat Aug 08 06:00:09 MSK 2015	Money	Rogue landlords and letting agents to get stiffer fines in rental market shakeup	[Renting property, Money, Property, Housing market, Real estate, UK news, Business]
Sat Aug 08 06:00:09 MSK 2015	Money	Where to open the door to the cheapest personal loans	[Borrowing & debt, Money, Credit cards, Banks and building societies, Credit card fees]
Sat Aug 08 06:00:08 MSK 2015	Money	Dear Jeremy – your work issues solved	[Work & careers, Money]
Sat Aug 08 06:00:08 MSK 2015	Travel	The great Eastern European road trip, part one: island hopping in Croatia	[Travel, Road trips, Croatia, Europe, Camping, Cottages]
Sat Aug 08 06:00:08 MSK 2015	Money	‘Smart thermostat left me with no hot water and put my home at risk of fire’	[Energy bills, Energy, Energy efficiency, Environment, Consumer affairs, Money, Energy industry, Household bills, Business]
Sat Aug 08 06:00:07 MSK 2015	Travel	How Toronto’s waterfront makeover hopes to rebuild its cultural reputation	[Toronto, Canada, North and Central America, Travel, Urbanisation, Cities]
Sat Aug 08 06:00:07 MSK 2015	Money	City council takes the battle to payday lenders – by offering loans of its own	[Payday loans, Credit unions, Borrowing & debt, Money, Sheffield, Poverty, Society, UK news]
Sat Aug 08 05:46:06 MSK 2015	Life and style	I love my son but, wow, babies are boring. How does my wife do it?	[Parents and parenting, Family, Children, Society, Life and style]
Sat Aug 08 05:30:07 MSK 2015	Life and style	A letter to … my mother, who is ‘locked in’ after a second stroke	[Family, Life and style, Grandparents and grandparenting, Death and dying, Health & wellbeing, Bereavement, Parents and parenting]
