Sun Aug 02 19:07:38 MSK 2015	Football	Christian Benteke shows why Liverpool paid £32.5m for him with wonder volley	[Friendlies, Liverpool, Brendan Rodgers, Swindon, Christian Benteke, Football, Sport]
Sun Aug 02 19:00:03 MSK 2015	Comment is free	Never mind driverless cars – we need intelligent transport systems | Paul Mason	[Automotive industry, Business, Transport policy, Google, Technology]
Sun Aug 02 18:57:02 MSK 2015	US news	Donald Trump staffer fired over past racially charged Facebook posts	[US elections 2016, Donald Trump, Republicans, US politics, Race issues, US news, World news]
Sun Aug 02 18:32:14 MSK 2015	Comment is free	The Guardian view on Amnesty International’s call to decriminalise sex work: divisive and distracting | Editorial	[Prostitution, Sex trade, Society, Amnesty International, World news]
Sun Aug 02 18:32:00 MSK 2015	Comment is free	The Guardian view on population control: empowering women may not save the environment | Editorial	[Population, World news, United Nations, Women, Life and style, China, Asia Pacific, India, South and Central Asia]
Sun Aug 02 18:31:48 MSK 2015	Politics	The Labour party and the shifting centre ground of politics in the UK | Letters	[Labour party leadership, Labour, Politics, UK news, Jeremy Corbyn, Liz Kendall, Yvette Cooper, Andy Burnham]
Sun Aug 02 18:31:37 MSK 2015	World news	After Iran nuclear deal, it’s everyone else’s turn | Letters from Roan Ruddock and Denis Macshane	[Iran's nuclear programme, Iran, Middle East and North Africa, World news, Nuclear weapons, Israel]
Sun Aug 02 18:31:22 MSK 2015	Life and style	The value of checklists in end-of-life care | Letters	[Death and dying, Life and style, NHS, Health, Society]
Sun Aug 02 18:26:36 MSK 2015	Global	Dracula imagery adds to myths about bats | Letters	[Lords reform, House of Lords, Politics, Tesco, Supermarkets, Retail industry, Business, UK news, Poundland]
Sun Aug 02 18:00:16 MSK 2015	Sport	Nerveless Inbee Park claims Women’s British Open to seal career grand slam	[Golf, Sport]
Sun Aug 02 18:00:02 MSK 2015	Life and style	Maajid Nawaz: how a former Islamist became David Cameron’s anti-extremism adviser	[Politics, David Cameron, Islam, Religion, UK news, Liberal Democrats, Society, Life and style]
Sun Aug 02 17:59:02 MSK 2015	Sport	Britain at the Bookies: a rose-tinted view of the nation’s gambling habit	[Sport betting, Gambling, Sport, BBC]
Sun Aug 02 17:56:43 MSK 2015	Media	BT Sport red-faced after problems hit Community Shield online and app	[BT Sport, Sport, Community Shield, Media, Football]
Sun Aug 02 17:51:12 MSK 2015	Sport	Horse racing tips: Monday 3 August	[Horse racing, Sport, Horse racing tips]
Sun Aug 02 17:39:49 MSK 2015	Sport	Ben Swift third in 2015 RideLondon-Surrey Classic – as it happened	[Cycling, Sport, Sir Bradley Wiggins, Mark Cavendish]
Sun Aug 02 17:36:25 MSK 2015	Sport	Lord Coe expects 'robust response' from IAAF to claims of mass doping	[Drugs in sport, Athletics, Lord Coe, Sport, UK news, World news]
Sun Aug 02 17:29:42 MSK 2015	Sport	Amazing Maria ends Ervedya’s unbeaten record in Prix Rothschild	[Horse racing, Sport]
Sun Aug 02 17:18:28 MSK 2015	Comment is free	With miscarriage, there are many routes to shame | Zoe Williams	[Pregnancy, Health & wellbeing, Family, Parents and parenting, Life and style, Mark Zuckerberg, Facebook, Media, Social networking, Technology, World news]
Sun Aug 02 17:16:52 MSK 2015	UK news	Women and children arriving at Calais's migrant camps 'need greater protection'	[Immigration and asylum, Migration, World news, UK news, Women, Life and style, Children, Society, Aid, Global development, Refugees]
Sun Aug 02 17:12:22 MSK 2015	Society	Stefanie Logie obituary	[Voluntary sector, Germany, Nazism, Judaism, Second world war, The Guardian]
Sun Aug 02 17:06:01 MSK 2015	Media	‘Mark Thompson told me: whatever you do, don’t mess up Top Gear’	[Jane Tranter, Media, BBC, Top Gear, Television, Factual TV, Doctor Who, Culture, Television & radio, Fantasy, Independent production companies, Television industry, UK news, BBC Worldwide]
Sun Aug 02 17:03:01 MSK 2015	Media	Media Monkey: Jeremy Clarkson, Jeremy Corbyn, and Katie Hopkins	[Jeremy Clarkson, Media, Katie Hopkins, Rupert Murdoch, Top Gear, Television, Factual TV, Amazon Prime Instant Video, BBC]
Sun Aug 02 17:02:07 MSK 2015	Sport	Ashes: 10 things to look out for in England v Australia at Trent Bridge	[Ashes 2015, England cricket team, Australia cricket team, Cricket, The Ashes, Australia sport, Sport]
Sun Aug 02 17:02:01 MSK 2015	Media	The D-notice is misunderstood but its collaborative spirit works	[Press freedom, Newspapers, Newspapers & magazines, Censorship, Media, UK news, Surveillance]
Sun Aug 02 17:02:01 MSK 2015	Media	BBC’s rivals aren’t feeling the pinch as much as green paper suggests	[BBC, Media, BBC licence fee, Sky plc, Television industry, BT TV, ITV channel, ITV plc, Media business, Amazon Prime Instant Video]
Sun Aug 02 17:00:01 MSK 2015	Life and style	Is one minute of high-intensity exercise really enough to get fit?
	[Health & wellbeing, Life and style]
Sun Aug 02 17:00:01 MSK 2015	Business	Voice over: why Tesco’s female tills have checked out for the final time	[Tesco, Supermarkets, Technology, Retail industry]
Sun Aug 02 17:00:01 MSK 2015	Film	True Blood to Tarzan: how Alexander Skarsgård swung into Hollywood	[Film, The Diary of a Teenage Girl, Alexander Skarsgård, Television, Young people, Culture, Society, Television & radio, Romance, Drama]
Sun Aug 02 16:57:24 MSK 2015	Media	Maurice Woods obituary	[Newspapers, Newspapers & magazines, Norfolk]
Sun Aug 02 16:55:24 MSK 2015	Media	Future Artefacts fair seeks to show physical media far from dead	[Media, Newspapers & magazines, Festivals, Publishing, Culture, Books, Music, Music industry, Art and design]
Sun Aug 02 16:52:21 MSK 2015	Sport	England’s Ian Bell warns of Australia backlash with the Ashes in reach	[Ashes 2015, England cricket team, Cricket, The Ashes, Trevor Bayliss, Australia cricket team, Australia sport, Sport]
Sun Aug 02 16:51:53 MSK 2015	World news	Iran uses fabricated WikiLeaks cable to smear UN rights rapporteur	[Iran, World news, Middle East and North Africa, Human rights, Law, Media, WikiLeaks]
Sun Aug 02 16:51:50 MSK 2015	Comment is free	Calais will haunt Cameron – it gives EU ‘outs’ the perfect showreel | Matthew d’Ancona	[EU referendum, Migration, David Cameron, European Union, Foreign policy, Politics, UK news, Europe, World news]
Sun Aug 02 16:41:04 MSK 2015	Music	Prom 19: Alina Ibragimova review – spellbinding Bach from start to finish	[BBC Proms 2015, Music, Classical music, Culture]
Sun Aug 02 16:16:20 MSK 2015	Football	Arsenal 1-0 Chelsea: five talking points from the Community Shield	[Community Shield, Chelsea, Arsenal, Football, Sport]
Sun Aug 02 16:14:51 MSK 2015	Stage	Happy Days: international Beckett festival review – exquisite Britten; comical, otherworldly drama	[Theatre, Samuel Beckett, Culture, Classical music, Music, Stage]
Sun Aug 02 16:07:56 MSK 2015	Sport	Russia has been singled out over doping, says former athletics coach	[Drugs in sport, Russia, Europe, Sport, World news, Athletics, Germany, Olympics, Documentary, Factual TV, Television & radio]
Sun Aug 02 16:07:53 MSK 2015	Media	Peter Jones obituary	[Media, Magazines, Biography, Pop and rock, The Beatles, The Rolling Stones, Music, London, UK news, Newspapers]
Sun Aug 02 16:06:31 MSK 2015	Football	Arsenal 1-0 Chelsea | Community Shield match report	[Community Shield, Chelsea, Arsenal, Sport, Friendlies, Football, José Mourinho, Arsène Wenger]
Sun Aug 02 16:00:00 MSK 2015	Stage	Derek and Clive are back – are they too much for the 21st century?	[Comedy, Comedy, Culture, Peter Cook, Dudley Moore, Stage]
Sun Aug 02 15:58:39 MSK 2015	Football	Arsenal 1-0 Chelsea: Community Shield – as it happened!| Alan Smith	[Community Shield, Arsenal, Chelsea, Football, Sport]
Sun Aug 02 15:56:13 MSK 2015	Environment	Another lion was illegally killed by an American in April, Zimbabwe says	[Cecil the lion, Zimbabwe, Animals, Wildlife, Africa, Environment, World news, US news]
Sun Aug 02 15:48:41 MSK 2015	Business	RBS sale speculation gathers pace	[Royal Bank of Scotland, Banking, Business, George Osborne, Politics, UK news, Lloyds Banking Group]
Sun Aug 02 15:44:00 MSK 2015	Environment	Cecil the lion’s 'brother' Jericho alive and well despite rumors, say researchers	[Cecil the lion, US news]
Sun Aug 02 15:43:37 MSK 2015	Sport	Blood doping: what is it and has anyone died as a result of it?	[Drugs in sport, Sport, Cycling]
Sun Aug 02 15:39:19 MSK 2015	Books	Sebastiano Vassalli obituary	[Books, Culture, Italy]
Sun Aug 02 15:30:52 MSK 2015	Science	Ancient Egyptian underwater treasures to be exhibited for the first time	[Egyptology, Archaeology, Egypt, Africa, Middle East and North Africa, World news]
Sun Aug 02 15:29:34 MSK 2015	World news	Israel to detain Jewish terror suspects without trial	[Israel, Middle East and North Africa, World news, Palestinian territories, Binyamin Netanyahu, Judaism]
Sun Aug 02 15:11:35 MSK 2015	Music	Man of Moon review – noirish, transportational krautrock	[Pop and rock, Music, Psychedelia, Culture]
Sun Aug 02 15:00:07 MSK 2015	Books	The Sonar System: a children’s book about sound systems, Tesfarians and the power of music	[Children and teenagers, Books, Race in education, Race issues]
Sun Aug 02 15:00:07 MSK 2015	Children's books	What should I read next?	[Children and teenagers, Children's books: 7 and under, Children's books: 8-12 years, Teen books, Books, Culture]
Sun Aug 02 15:00:07 MSK 2015	UK news	London's richest borough to move those in temporary housing to cheaper areas	[London, Housing, UK news, Communities, Society]
Sun Aug 02 14:56:30 MSK 2015	Television & radio	Tributes to Cilla Black, 'Liverpool's Cinderella', pour in	[Cilla Black, Television, Culture, Television & radio, Media]
Sun Aug 02 14:49:37 MSK 2015	World news	Flight MH370: Malaysia appeals for help to widen search	[Malaysia Airlines flight MH370, Réunion, World news, Malaysia, France, Asia Pacific, Europe]
Sun Aug 02 14:37:17 MSK 2015	Football	Yann M’Vila and Leroy Fer set to add muscle to Sunderland’s midfield	[Sunderland, Transfer window, QPR, Rubin Kazan, Football, Sport]
Sun Aug 02 14:33:59 MSK 2015	Life and style	25,000 cyclists flock to second day of Ride London	[Cycling, Sir Bradley Wiggins, Mark Cavendish, Sport, UK news]
Sun Aug 02 14:33:52 MSK 2015	Business	Dr Now: the smartphone app that puts you in touch with a GP – for a fee	[Entrepreneurs, GPs, Smartphones, Apps, Doctors, Health, Mobile phones, NHS, Society, Technology, Health insurance, Money, Business, Small business, Care Quality Commission (CQC), Private healthcare]
Sun Aug 02 14:23:42 MSK 2015	Comment is free	How I stopped worrying and learned to love summer holidays with the kids | Alice O’Keeffe	[Children, Society, Summer holidays, Family holidays, Childcare, Parents and parenting, Family, Life and style, UK news]
Sun Aug 02 14:06:19 MSK 2015	Politics	Kezia Dugdale: Corbyn win could leave Labour 'carping on sidelines'	[Scottish politics, Labour, General election 2015, Jim Murphy, Scottish National party (SNP), Scotland, Politics, Chuka Umunna, Yvette Cooper, Tristram Hunt, Jeremy Corbyn, Labour party leadership, UK news, Kezia Dugdale]
Sun Aug 02 14:05:36 MSK 2015	Television & radio	Cilla Black, singer and TV personality, dies aged 72	[Cilla Black, Culture, UK news, Television, Television & radio, Spain, World news]
Sun Aug 02 14:01:06 MSK 2015	Environment	Biggest polluters able to increase emissions under Direct Action – study	[Emissions trading, Coalition, Tony Abbott, Greg Hunt, Greenhouse gas emissions, Climate change, Environment]
Sun Aug 02 14:00:24 MSK 2015	Sport	Rafael Nadal v Fabio Fognini: Hamburg Open final 2015 – as it happened | Les Roopanarine	[Rafael Nadal, Tennis, Sport]
Sun Aug 02 14:00:06 MSK 2015	Children's books	Extraordinary Means by Robyn Schneider - review	[Children and teenagers, Books, Culture, Teen books]
Sun Aug 02 14:00:05 MSK 2015	Comment is free	What better alternative to the Lords than an elected second chamber in Glasgow? | Kezia Dugdale	[Lords reform, House of Lords, Labour, Scottish National party (SNP), Politics, Glasgow, Scotland, UK news]
Sun Aug 02 13:52:28 MSK 2015	Music	Prom 18: BBCSO/Bychkov review – a magnificent, more reflective Leningrad	[BBC Proms 2015, Music, Culture, Classical music, Dmitri Shostakovich]
Sun Aug 02 13:32:05 MSK 2015	UK news	Concerns raised over plan to strip failed asylum seeker families of benefits	[Immigration and asylum, Benefits, Welfare, UK news, Politics, Refugees, World news, Society]
Sun Aug 02 13:31:12 MSK 2015	Sport	The week the Olympics and Deflategate set off Boston's BS sensors	[Deflategate, Sport, Boston, Olympics, US sports, NFL, New England Patriots, International Olympic Committee]
Sun Aug 02 13:25:40 MSK 2015	Sport	Doping test revelations in athletics will be greeted with dismay, but no surprise	[Drugs in sport, Sport, Cycling, Athletics, Lance Armstrong, IAAF, World news]
Sun Aug 02 13:21:13 MSK 2015	Sport	Captain Michael Clarke has two Ashes Tests to justify place for Australia | Jason Gillespie	[Michael Clarke, Ashes 2015, The Ashes, Australia cricket team, Australia sport, England cricket team, Cricket, Sport]
Sun Aug 02 13:05:53 MSK 2015	Television & radio	Cilla Black obituary	[Cilla Black, Television, Pop and rock, Music, UK news, Liverpool, The Beatles, Paul McCartney, John Lennon, Television & radio, Dusty Springfield, Television industry, ITV channel]
Sun Aug 02 13:00:04 MSK 2015	Books	Blackass by A Igoni Barrett review – vivid vignettes	[Fiction, Books, Culture, Race issues]
Sun Aug 02 00:51:34 MSK 2015	UK news	Murder inquiry launched after woman stabbed to death in Chelsea	[London, UK news]
Sun Aug 02 00:41:55 MSK 2015	Music	Cambridge folk festival review – Rhiannon Giddens ‘just beautiful’	[Folk music, Music, Festivals, Culture, Frank Turner, Wilko Johnson]
Sun Aug 02 00:20:47 MSK 2015	Business	Interest rates: economists and homeowners brace for Super Thursday	[Interest rates, Bank of England, Business, Economics, Mark Carney, Economic growth (GDP), Economic recovery, Economic policy, Inflation, Politics]
Sun Aug 02 00:15:03 MSK 2015	Comment is free	Why I waited until I was 24 to buy my first bikini | Sarah Galo	[Life and style, Women, Christianity, Religion, Fashion, Summer]
Sun Aug 02 00:00:04 MSK 2015	Money	Financial infidelity: how to prevent money secrets from hurting a marriage	[Relationships, US personal finance, Money, Life and style]
Sun Aug 02 00:00:04 MSK 2015	Comment is free	When we give up a faith, we grieve for the community we leave behind | Brandon G Withrow	[Religion, Communities, Society, Family]
Sun Aug 02 00:00:03 MSK 2015	Books	Upstairs at the Party by Linda Grant review – intriguing and evocative
	[Fiction, Books, Linda Grant, Culture]
Sun Aug 02 11:50:43 MSK 2015	Business	Next banks £170m in interest charges from shoppers	[Next, Business, Borrowing & debt, Retail industry, Credit card fees, Credit cards, Money, Online shopping, Consumer affairs]
Sun Aug 02 11:42:12 MSK 2015	Australia news	Coalition MPs demand proper say on next Speaker as Bronwyn Bishop quits	[Bronwyn Bishop, Tony Abbott, Australian politics, Australian politicians' expenses, Australia news, Bill Shorten, Liberal party, Coalition]
Sun Aug 02 11:40:04 MSK 2015	World news	Egypt to open Suez canal expansion two years early	[Egypt, Water transport, Africa, Middle East and North Africa, World news]
Sun Aug 02 11:30:03 MSK 2015	Technology	Amazon Studios chief: data isn't everything as retailer looks at big picture	[Amazon.com, Technology, Netflix, Media, US news, US television, Television, Television & radio, Culture]
Sun Aug 02 11:00:04 MSK 2015	Comment is free	Famous last words? Say them now, before it’s too late | Oscar Rickett	[Death and dying, Oscar Wilde, Karl Marx, Life and style, Culture]
Sun Aug 02 11:00:03 MSK 2015	US news	Builders battle California city ordinance making them pay for public art	[California, US news, Art, Art and design, Construction industry, Business, Culture]
Sun Aug 02 11:00:03 MSK 2015	Books	The Beechwood Airship Interviews review – a wonderful, serious jigsaw	[Books, Culture, Reference and languages, Autobiography and memoir]
Sun Aug 02 11:00:03 MSK 2015	US news	Philadelphia police-related deaths plunge,  but is reform enough?	[Philadelphia, US news, US policing]
Sun Aug 02 11:00:03 MSK 2015	US news	Anti-torture reforms opposed within psychology group after damning report	[Guantánamo Bay, US news, US military, World news, CIA, Torture, Law]
Sun Aug 02 11:00:02 MSK 2015	Books	The Last Summer of the Water Strider by Tim Lott review – afloat on a hippy houseboat	[Fiction, Books, Culture]
Sun Aug 02 11:00:02 MSK 2015	Children's books	Ivan and the Dogs by Hattie Naylor - review	[Children and teenagers, Books, Culture, Teen books, Animals, Historical fiction (children and teens)]
Sun Aug 02 10:47:28 MSK 2015	Business	UK interest rate rises - waiting for lift-off	[Interest rates, Business, Bank of England, Economics, Austerity]
Sun Aug 02 10:33:15 MSK 2015	World news	Calais migrants' stories speak to a wider truth	[Migration, Immigration and asylum, UK news, World news, Europe]
Sun Aug 02 10:25:16 MSK 2015	World news	Calais migrants abandon plans for life in UK and start learning French	[Migration, Refugees, France, Europe, UK news, World news]
Sun Aug 02 10:23:39 MSK 2015	Sport	Ronda Rousey knocks out Bethe Correia in 34 seconds	[UFC, Sport, US sports, MMA]
Sun Aug 02 10:18:23 MSK 2015	Sport	England look for a new blend against embattled Australia at Trent Bridge	[Ashes 2015, Cricket, The Ashes, England cricket team, Australia cricket team, Australia sport, Sport]
Sun Aug 02 10:12:01 MSK 2015	Life and style	Proseccos with real sparkle | David Williams	[Wine, Food & drink, Life and style]
Sun Aug 02 10:00:01 MSK 2015	Books	The Penguin Book of Russian Poetry review – the importance of rhyme and reason	[Poetry, Books, Culture]
Sun Aug 02 09:54:57 MSK 2015	Australia news	Bronwyn Bishop resigns as Speaker – as it happened	[Bronwyn Bishop, Tony Abbott, Australian politics, Australian politicians' expenses, Australia news, Coalition, Liberal party]
Sun Aug 02 09:30:00 MSK 2015	Film	Meet comedian Amy Schumer, the sneaky feminist honesty bomb	[Trainwreck, Comedy, Amy Schumer, Tina Fey, Television, Television & radio, Comedy, Comedy, Comedy Central, Television industry, Comedy, Film, Culture, Stage, Media, US television industry]
Sun Aug 02 09:30:00 MSK 2015	Football	André Ayew’s Roy of the Rovers moment showed off his rich talent  | Jonathan Wilson	[Swansea City, Aston Villa, Football, Sport]
Sun Aug 02 09:28:00 MSK 2015	UK news	Bin Laden plane crash: aircraft went down in near perfect conditions	[UK news, Osama bin Laden, Transport, Air transport, Plane crashes]
Sun Aug 02 09:22:58 MSK 2015	Business	RBS, why the rush to sell it off?	[Royal Bank of Scotland, Business, Banking]
Sun Aug 02 09:15:09 MSK 2015	Music	Dornik: ‘Jessie Ware's interest really forced my hand’	[Music, Culture, R&B]
Sun Aug 02 09:00:11 MSK 2015	Culture	Six things hipsters have ruined	[Culture, Fashion, Festivals, Life and style, The Great British Bake Off, Television, Food TV, James Bond, Thriller, Film, Running]
Sun Aug 02 09:00:10 MSK 2015	Books	The 2015 Man Booker longlist – migrants, Bob Marley, but few major names	[Man Booker prize 2015, Books, Anne Tyler, Marilynne Robinson, Culture]
Sun Aug 02 09:00:10 MSK 2015	Business	Big Tech's big problem – its role in rising inequality	[Business, Economics, Technology, Equality, Technology sector, Corporate governance, Economics, Apple, Google, Facebook, Books, Computing, Culture, Media, Social networking, Society, Investing, Financial sector]
Sun Aug 02 09:00:10 MSK 2015	Life and style	Picnic recipes for work lunches	[Food & drink, Life and style]
Sun Aug 02 09:00:09 MSK 2015	Society	All bets are off: why bookmakers aren’t playing fair	[Gambling, Society, Horse racing, Sport, Greyhound racing]
Sun Aug 02 09:00:09 MSK 2015	Guardian Careers	Healthy careers: how to find a job that keeps you active – live chat	[Live Q&A, Guardian Careers, Live Q and A, Live Q&As, Work & careers, Job hunting, Health & wellbeing]
Sun Aug 02 08:45:09 MSK 2015	Books	On my radar: writer Hanif Kureishi’s cultural highlights	[Hanif Kureishi, Sigmund Freud, Young Vic, Alfred Hitchcock, Keith Jarrett, Fiction, Stage, Film, Jazz, Music, Books, Culture]
Sun Aug 02 08:25:00 MSK 2015	Australia news	Bronwyn Bishop had to be forced out – but some good may come of the scandal | Lenore Taylor	[Bronwyn Bishop, Tony Abbott, Australian politics, Australian politicians' expenses, Peter Slipper, Coalition, Liberal party]
Sun Aug 02 08:20:52 MSK 2015	Sport	Anti-doping agency 'alarmed' by claims of suspect testing by 800 athletes	[Drugs in sport, Athletics, Sport, World news]
Sun Aug 02 08:15:08 MSK 2015	Technology	How does it feel to be a ‘grey entrepreneur’?	[Technology startups, Technology sector, Business, Technology, Silicon Roundabout, Society, Internet]
Sun Aug 02 08:00:11 MSK 2015	Film	Mission: Impossible – Rogue Nation review – all guns blazing, almost constantly	[Mission: Impossible - Rogue Nation, Tom Cruise, Action and adventure, Simon Pegg, Film, Culture]
Sun Aug 02 08:00:11 MSK 2015	Politics	Jeremy Corbyn’s Gang of One reawakens the media of the 80s	[Jeremy Corbyn, Labour party leadership, Labour, Politics, Newspapers, Newspapers & magazines, Media]
Sun Aug 02 08:00:11 MSK 2015	Business	GDP surge should not blind us to the dangers of an interest rate rise	[Economic growth (GDP), Interest rates, Economics, Business, Royal Bank of Scotland, Centrica, Energy industry]
Sun Aug 02 08:00:10 MSK 2015	Media	Amazon parks Clarkson on BBC’s lawn	[Amazon Prime Instant Video, Top Gear, Television, Factual TV, Media, BBC, Television industry]
Sun Aug 02 08:00:09 MSK 2015	UK news	George Osborne should come clean over who wins or loses in his budget	[Budget 2015 (July), George Osborne, Economics, Office for Budget Responsibility, Living wage, Budget, Institute for Fiscal Studies, Business]
Sun Aug 02 08:00:09 MSK 2015	Books	Spinster by Kate Bolick review – self-indulgent and wrong-headed	[Autobiography and memoir, Books, Culture, Biography, Women, Life and style]
Sun Aug 02 08:00:09 MSK 2015	Business	The innovators: the personal rape alarm with a fast track to the police	[Entrepreneurs, Rape, Society, Higher education, Education, Students, Business, Crime, UK news]
Sun Aug 02 08:00:09 MSK 2015	Children's books	Why we need to be honest about OCD and teen mental health	[Books, Children and teenagers, Culture, Teen books, Mental health, Health, Society, Obsessive-compulsive disorder]
Sun Aug 02 08:00:08 MSK 2015	Business	Stephen Hester will want the most out of Zurich’s bid for RSA	[Stephen Hester, RSA Insurance, Insurance industry, Royal Bank of Scotland, HSBC, Business, Bank of England, Banking]
Sun Aug 02 08:00:08 MSK 2015	Media	Financial Times will now have Rising Sun ethics	[Financial Times, Media, Nikkei, Press regulation, Newspapers & magazines]
Sun Aug 02 08:00:08 MSK 2015	Children's books	It's About Love by Steven Camden – review	[Children and teenagers, Books, Culture, Teen books, Teen romance (childrens and teens), School]
Sun Aug 02 08:00:08 MSK 2015	Life and style	Celebrity lifestyles for sale	[Celebrity, Life and style, Blogging, Newspapers & magazines, Digital media, Media, Gwyneth Paltrow, Lena Dunham, Culture, Reese Witherspoon, Film]
Sun Aug 02 07:59:08 MSK 2015	Media	D-Notices: the best security show in town at a bargain price	[Press regulation, Newspapers & magazines, Media, GCHQ, Ministry of Defence, MI5, Press freedom]
Sun Aug 02 07:29:07 MSK 2015	Film	The Third Man review – a near-perfect work	[The Third Man, Graham Greene, Orson Welles, DVD and video reviews, Film, Culture]
Sun Aug 02 07:25:05 MSK 2015	Science	Mathematical déjà vu, and Coffee | Jon Butterworth | Life & Physics	[Science, Physics, Mathematics]
Sun Aug 02 07:24:13 MSK 2015	Australia news	Bronwyn Bishop resigns as Speaker, Tony Abbott announces	[Bronwyn Bishop, Australian politics, Australia news, Coalition, Australian politicians' expenses, Liberal party, Tony Abbott]
Sun Aug 02 07:22:38 MSK 2015	Australia news	Nova Peris says government language around Indigenous people is patronising	[Indigenous Australians, Nova Peris, Northern Territory, Australia news, Northern Territory politics, Australian politics, Indigenous peoples, Labor party, Coalition, Liberal National party, Liberal party, National party]
Sun Aug 02 07:10:07 MSK 2015	Stage	Jekyll and Hyde review – ravishing design, stilted acting	[Theatre, Stage, Culture, Robert Louis Stevenson]
Sun Aug 02 07:05:07 MSK 2015	Stage	Seven Brides for Seven Brothers review – the whole thing is barmy, and spot-on	[Stage, Theatre, Musicals, Culture]
Sun Aug 02 07:04:48 MSK 2015	Australia news	Bronwyn Bishop: formidable political warrior who walked a rocky road	[Bronwyn Bishop, Coalition, Australian politics, Liberal party, Sydney, New South Wales, Australia news]
Sun Aug 02 07:00:12 MSK 2015	Music	Micachu and the Shapes review – renaissance woman goes back to basics	[Pop and rock, Music, Culture]
Sun Aug 02 07:00:11 MSK 2015	Stage	Cubanía review – where next for Carlos Acosta?	[Carlos Acosta, Royal Ballet, Dance, Stage, Culture]
Sun Aug 02 07:00:11 MSK 2015	Stage	Bakkhai review – Ben Whishaw and Bertie Carvel share the honours	[Euripides, Theatre, Stage, Culture, Almeida theatre, Ben Whishaw]
Sun Aug 02 07:00:11 MSK 2015	Film	The Cobbler review – a desperate and misguided modern fairytale	[Comedy, Drama, Film, Culture, Adam Sandler, Dustin Hoffman]
Sun Aug 02 07:00:10 MSK 2015	Music	Shostakovich: Piano Concertos CD review – four hands are better than two	[Dmitri Shostakovich, Classical music, Music, Culture]
