Mon Sep 07 17:17:22 MSK 2015	World news	Binyamin Netanyahu's UK visit denounced	[Binyamin Netanyahu, Israel, Gaza, Middle East and North Africa, Palestinian territories, World news, UK news, Foreign policy, David Cameron, Politics]
Mon Sep 07 17:14:03 MSK 2015	Football	Wales scouting Euro 2016 base in France near England’s hotel	[Euro 2016, Wales, England, Football, Sport]
Mon Sep 07 17:12:54 MSK 2015	Sport	Soaring Blue Jays have got Toronto – and Canada – back in love with baseball	[Toronto Blue Jays, Sport, US sports, MLB, Baseball]
Mon Sep 07 17:11:25 MSK 2015	World news	Reyaad Khan, Junaid Hussain and Ruhul Amin: profiles of Isis Britons killed in Syria	[Islamic State, Syria, UK news, World news, Middle East and North Africa]
Mon Sep 07 17:09:38 MSK 2015	World news	Netanyahu deserves sanctions, not a welcome to the UK, say union leaders and others | Letter	[Binyamin Netanyahu, Israel, David Cameron, Foreign policy, Middle East and North Africa, World news, Politics, UK news, Gaza, Palestinian territories]
Mon Sep 07 17:08:09 MSK 2015	World news	Lesbos 'on verge of explosion' as refugees crowd Greek island	[Greece, Refugees, Migration, Europe, European Union, World news]
Mon Sep 07 16:56:11 MSK 2015	World news	Drone killing of British citizens in Syria marks major departure for UK	[Drones (military), Syria, David Cameron, Islamic State, Middle East and North Africa, Politics, UK news, World news]
Mon Sep 07 16:55:56 MSK 2015	Sport	Wales full-back Leigh Halfpenny ruled out of Rugby World Cup	[Wales rugby union team, Rugby union, Sport, Rugby World Cup 2015, Rugby World Cup]
Mon Sep 07 16:55:36 MSK 2015	Music	The latest from the maestros' merry-go-round	[Classical music, Music, Culture, Concertgebouw Orchestra, Riccardo Chailly, Bernard Haitink]
Mon Sep 07 16:55:10 MSK 2015	Football	Can David Beckham make it big in Hollywood?	[David Beckham, Football, Film, Culture]
Mon Sep 07 16:53:56 MSK 2015	UK news	Will we ever actually get to see the 5,000-year-old Superhenge?	[Stonehenge, UK news, Archaeology, Science]
Mon Sep 07 16:51:56 MSK 2015	Environment	Countryside Alliance urges BBC to sack Chris Packham in conservation row	[Conservation, Wildlife, Rural affairs, Environment, BBC, Media, Farming, UK news]
Mon Sep 07 16:51:40 MSK 2015	Sport	England’s Ben Stokes praised for mature response to obstruction ruling	[Ben Stokes, England cricket team, Australia cricket team, Trevor Bayliss, Ashes 2015, The Ashes, Cricket, Sport, Australia sport]
Mon Sep 07 16:49:14 MSK 2015	Education	John Alexander obituary	[Teaching, Politics, Second world war]
Mon Sep 07 16:49:03 MSK 2015	Sport	Petr Vakoc lands yellow jersey as Lancashire leg takes toll on the field	[Tour of Britain, Cycling, Sport, Sir Bradley Wiggins, Mark Cavendish]
Mon Sep 07 16:44:51 MSK 2015	Film	Jurassic World joins the international billionaires club	[Film, Culture, Bollywood, Jurassic World, Hitman: Agent 47, Straight Outta Compton, Mission: Impossible - Rogue Nation, Minions, Ant-Man, Terminator Genisys, Inside Out, The Man from UNCLE, India, China, Asia Pacific, South and Central Asia, World news]
Mon Sep 07 16:44:27 MSK 2015	Film	Star Wars Day of Play: how good is the new merchandise?	[Star Wars: The Force Awakens, Film, Culture, Technology, Toys, Life and style]
Mon Sep 07 16:43:51 MSK 2015	Music	Festival No 6 review – musical mavericks in surreal surroundings	[Pop and rock, Music festivals, Music, Festivals, Culture, Grace Jones]
Mon Sep 07 16:41:46 MSK 2015	Business	Glencore's former Rich boy rues multibillion-pound loss	[Mining, Business, Commodities]
Mon Sep 07 16:41:26 MSK 2015	Film	Danny Boyle confirms Trainspotting sequel at Telluride film festival	[Telluride film festival 2015, Telluride film festival, Film, Culture, Danny Boyle, Film adaptations, Trainspotting, Irvine Welsh, Books, Festivals]
Mon Sep 07 16:41:24 MSK 2015	Global development	Chad's Hissène Habré carried into court as war crimes trial resumes in Dakar	[Governance, Global development, Chad, Human rights, Africa, Senegal, War crimes]
Mon Sep 07 16:38:41 MSK 2015	Film	David Beckham tackles acting. Will he be the new Eric Cantona – or Stan Collymore?	[Film, Football, Sport, Culture]
Mon Sep 07 16:38:17 MSK 2015	Business	Glencore CEO to shell out $210m during restructuring drive	[Business, Mining, Commodities]
Mon Sep 07 16:34:18 MSK 2015	Comment is free	Canada’s First Nations must vote, to save their sovereignty | Julian Brave NoiseCat	[Canada, Americas, World news, Indigenous peoples, UK news]
Mon Sep 07 16:26:24 MSK 2015	Media	BBC's local news plans a ‘Trojan horse’ for expansion, say publishers	[BBC, Media, Newspapers, Newspapers & magazines, Johnston Press, UK news]
Mon Sep 07 16:26:10 MSK 2015	Books	Roxane Gay and Erica Jong discuss feminism and it instantly gets awkward	[Books, Feminism, Culture, Festivals]
Mon Sep 07 16:22:16 MSK 2015	Film	Scott Cooper: people don't go to the movies for facts	[Telluride film festival 2015, Telluride film festival, Festivals, Culture, Film, Black Mass]
Mon Sep 07 16:19:39 MSK 2015	Fashion	Vogue centenary exhibition styles fashion bible as cultural record	[Fashion, Life and style, Kate Moss, Mario Testino, David Bailey, Photography, Alexandra Shulman, Magazines, Naomi Campbell, National Portrait Gallery, David Hockney, Corinne Day, Media, Newspapers & magazines, Art and design, Culture]
Mon Sep 07 16:19:00 MSK 2015	Business	Tesco to reduce net debt by as much as £3.35bn after Homeplus sale	[Tesco, Business, Retail industry, Supermarkets, UK news, South Korea, Asia Pacific, World news]
Mon Sep 07 16:15:15 MSK 2015	Sport	NFL’s first female coach defends decision to join Floyd Mayweather entourage	[Floyd Mayweather, US sports, Sport, NFL, Arizona Cardinals, Domestic violence, Boxing]
Mon Sep 07 16:11:28 MSK 2015	Comment is free	My fear of the red dot in the dark at the Venice film festival | Peter Bradshaw	[Film, Venice film festival, LGBT rights, Celebrity, Television & radio, World news, US news, UK news]
Mon Sep 07 16:07:05 MSK 2015	Education	UK education secretary appeals to businesses to set up more academies	[Academies, Education, Schools, UK news, Nicky Morgan, Politics]
Mon Sep 07 16:03:17 MSK 2015	Sport	Williams’ showdown at the US Open guaranteed to have world watching	[US Open 2015, Serena Williams, Venus Williams, US Open tennis, Tennis, US sports, Sport]
Mon Sep 07 15:57:59 MSK 2015	Sport	Ferrari would consider providing engines for F1 rivals Red Bull	[Ferrari, Red Bull, Formula One 2015, Christian Horner, Mercedes GP, Formula One, Motor sport, Sport]
Mon Sep 07 15:53:22 MSK 2015	Books	Tips, links and suggestions: what are you reading this week?	[Books, Culture, Fiction, Thomas Mann, Elena Ferrante]
Mon Sep 07 15:51:30 MSK 2015	Football	Taking a large needle to the balloon of hope	[Football, Sport]
Mon Sep 07 15:47:44 MSK 2015	Environment	Robin Hood Energy: Nottingham launches not-for-profit power firm	[Energy, Energy bills, UK news, Environment, Consumer affairs, Household bills, Money, Business]
Mon Sep 07 15:45:52 MSK 2015	Film	Mohsen Makhmalbaf voices support for imprisoned fellow director Oleg Sentsov	[Film, Venice film festival 2015, Venice film festival, Ukraine, Russia, Iran, Awards and prizes, Culture, Europe, Festivals, Middle East and North Africa, World news]
Mon Sep 07 15:42:22 MSK 2015	World news	Will Egghead CJ de Mooi regret admitting he might have killed somebody?	[Netherlands, Europe, World news, Crime fiction, Fiction, Books]
Mon Sep 07 15:38:48 MSK 2015	Children's books	You control the plot in #ScorchMaze, the new interactive story from the author of The Maze Runner	[Children and teenagers, Books, Culture, Teen books, Dystopian fiction (children and teens)]
Mon Sep 07 15:30:46 MSK 2015	World news	Oleg Kashin: 'Men who nearly killed me charged but not their paymaster'	[Russia, Europe, World news, Vladimir Putin, Press freedom, Media, Newspapers & magazines, Blogging, Digital media, Anna Politkovskaya, Newspapers]
Mon Sep 07 15:30:04 MSK 2015	Teacher Network	Six creative ways to teach genetics	[Teacher Network, Education, Teaching, Primary schools, Secondary schools, Genetics, Science, Biology, Schools]
Mon Sep 07 15:25:03 MSK 2015	Stage	Philip Martin-Nielson: an autistic life transformed by dance	[Ballet, Dance, Stage, Culture, Autism]
Mon Sep 07 15:24:12 MSK 2015	Business	Government delays revealing identities of RBS share buyers	[Royal Bank of Scotland, Freedom of information, UKFI (UK Financial Investments), Banking, Business, Politics, UK news]
Mon Sep 07 15:23:47 MSK 2015	Money	Prime London house price rises slow down	[House prices, Stamp duty, Money, Property, Tax, Housing market, Business, UK news]
Mon Sep 07 15:22:28 MSK 2015	Politics	Labour: no plans to delay leadership result	[Labour party leadership, Labour, Jeremy Corbyn, Yvette Cooper, Andy Burnham, Liz Kendall, Politics, UK news]
Mon Sep 07 15:22:17 MSK 2015	Comment is free	My tattoos help me feel more comfortable in my own skin | Brian Switek	[Tattoos, Fashion, Life and style, Dinosaurs]
Mon Sep 07 15:11:50 MSK 2015	Sport	Horse racing tips: Tuesday 8 September	[Horse racing tips, Horse racing, Sport]
Mon Sep 07 15:09:29 MSK 2015	Business	British bankers top bonus list, according to EU financial watchdog	[Banking, Financial sector, Business, European banks, Europe, World news, Executive pay and bonuses]
Mon Sep 07 15:08:01 MSK 2015	Comment is free	From Cecil the lion to Shoki, test your Africa knowledge – quiz | Amaka Opara and Eliza Anyangwe	[Africa, World news]
Mon Sep 07 15:06:11 MSK 2015	Guardian Sustainable Business	Russia's war on western food is leading to a national cheese revival	[Guardian sustainable business, Cheese, Russia, Europe, Food & drink, Life and style, Milk, Farming, Environment]
Mon Sep 07 15:03:47 MSK 2015	Sport	Rugby World Cup 2015 digital wallchart	[Rugby World Cup 2015, Rugby World Cup, Rugby union, Sport]
Mon Sep 07 15:00:11 MSK 2015	World news	Refugee crisis: UK will resettle 20,000 Syrian refugees over five years - as it happened	[Migration, Refugees, World news, Europe, Humanitarian response, David Cameron, Angela Merkel, Germany, Austria, Hungary, Politics, UK news]
Mon Sep 07 14:58:26 MSK 2015	Music	Prince – HITNRUN Phase One first listen review: 'His most experimental and shapeshifting album in years'	[Prince, Music, Culture, Pop and rock]
Mon Sep 07 14:57:00 MSK 2015	Sport	Rugby World Cup preview No2: England	[Rugby World Cup 2015, England rugby union team, Rugby union, Rugby World Cup, Sport, Rugby World Cup 2015 previews]
Mon Sep 07 14:55:33 MSK 2015	Stage	Nicole Kidman admits to nerves before stage return in Photograph 51	[West End, Theatre, Nicole Kidman, Stage, Culture, UK news]
Mon Sep 07 14:54:42 MSK 2015	World news	UK forces kill British Isis fighters in targeted drone strike on Syrian city	[Syria, UK news, David Cameron, Middle East and North Africa, Politics, World news]
Mon Sep 07 14:54:19 MSK 2015	Environment	Paris climate talks could fail, warns Francois Hollande	[COP 21: UN climate change conference | Paris, Global climate talks, Climate change, Environment, François Hollande, France, World news, Europe]
Mon Sep 07 14:42:31 MSK 2015	Music	Letter: Claus Moser’s lifelong passion was music	[Music, Culture, Royal Opera House, Office for National Statistics, UK news, Civil service, Politics]
Mon Sep 07 14:39:59 MSK 2015	Society	Judge widens search for missing British boys believed to be in northern Cyprus	[Child protection, Cyprus, Children, Europe, Social care, World news, UK news]
Mon Sep 07 14:35:41 MSK 2015	Books	Things We Have in Common by Tasha Kavanagh – the scorch of being 16	[Books, Fiction, Culture]
Mon Sep 07 14:34:05 MSK 2015	World news	Libya: 183 bodies now recovered after capsize of boat in Zuwara	[Migration, Refugees, Libya, World news, UK news, Middle East and North Africa, Africa]
Mon Sep 07 14:18:03 MSK 2015	Media	MOOS, POS and other teen internet slang every parent urgently needs to know	[Social media, Linguistics, Education, Parents and parenting, Family, Life and style, Digital media, Media, Cyberbullying, Child protection]
Mon Sep 07 14:16:24 MSK 2015	UK news	Woman killed 'without warning' by falling rock on Welsh beach	[Wales, UK news]
Mon Sep 07 14:12:19 MSK 2015	Media	BBC backs replacing licence fee with universal levy	[BBC licence fee, BBC, Television industry, Media, UK news]
Mon Sep 07 14:11:52 MSK 2015	Music	Kwabs – Love + War: Exclusive album stream	[Music, Pop and rock, Soul, Culture]
Mon Sep 07 14:11:47 MSK 2015	Music	BBCCO/Lockhart/Balsom review – dexterous playing and deft writing	[BBC Proms 2015, Music, Culture, Classical music, Jazz]
Mon Sep 07 14:09:49 MSK 2015	Environment	Aerial pictures reveal rampant illegal logging in Peru's Amazon forest	[Deforestation, Trees and forests, Environment, Peru, Amazon rainforest, Americas, World news]
Mon Sep 07 14:08:17 MSK 2015	Art and design	Robyn Beeche obituary	[Photography, Australia news, Magazines, Newspapers, The Observer, Fashion, London, Sydney, Punk, India]
Mon Sep 07 14:06:56 MSK 2015	Media	BBC has no plans to close BBC4, says strategy chief	[James Purnell, BBC4, BBC, Media, Television industry, BBC licence fee, BBC World Service, Radio industry, UK news]
Mon Sep 07 14:04:42 MSK 2015	Books	Hollywood star Ethan Hawke's third novel is a 'parable for all ages'	[Books, Fiction, Ethan Hawke, Film, Culture, Publishing]
Mon Sep 07 14:02:54 MSK 2015	Global Development Professionals Network	What will it take to end the pornography of videoed torture?	[Global development professionals network, Mexico, Gangs, Americas, World news, Islamic State, Social media]
Mon Sep 07 14:02:05 MSK 2015	Comment is free	Despite the threats, I will not stop fighting for Niger | Ali Idrissa	[Niger, Africa, World news, Transparency, Global development, France, Europe, Mining, Mining, Human rights, Law]
Mon Sep 07 14:00:21 MSK 2015	Football	Win (home) tickets to Leicester City v Aston Villa in the Premier League	[Premier League, Football]
Mon Sep 07 14:00:03 MSK 2015	Crosswords	Annotated solutions for Genius 146	[Crosswords]
Mon Sep 07 14:00:02 MSK 2015	Children's books	Clockwork Prince by Cassandra Clare – review	[Children and teenagers, Books, Culture, Teen books, Paranormal romance (children and teens), Witches, wizards and magic, Children's fantasy books (children's and teens), Cassandra Clare, Historical fiction (children and teens)]
Mon Sep 07 14:00:02 MSK 2015	Culture professionals network	Young artists have the power to shape the future – let's take them seriously	[Culture professionals network, Arts education, Professional development, Development, Culture, Dance, Stage, Art and design, Higher education, Education]
Mon Sep 07 13:52:44 MSK 2015	Sport	Italian Grand Prix: five things we learned from Monza | Paul Weaver	[Formula One 2015, Red Bull, McLaren, Daniel Ricciardo, Lotus F1, Motor sport, Formula One, Sport]
Mon Sep 07 13:48:35 MSK 2015	Comment is free	A backlash against dehumanising refugees has begun – we must seize the moment | Lola Okolosie	[Immigration and asylum, UK news, Refugees, World news, Welfare, Politics, Migration]
Mon Sep 07 13:34:56 MSK 2015	World news	Japan's largest yakuza syndicate splits amid fear of gang war	[Japan, Asia Pacific, World news, Organised crime]
Mon Sep 07 13:30:09 MSK 2015	Media	Maxine Peake and Russell Tovey to star in Comic Strip's phone-hacking comedy	[UKTV, Television industry, Media, Comedy, Television, Television & radio, Culture, UK news]
Mon Sep 07 13:24:50 MSK 2015	UK news	Former Dragons' Den star and Cameron adviser charged with child sexual assault	[UK news]
Mon Sep 07 13:22:10 MSK 2015	Business	Officials admit discussing idea that cruise operator could hire foreign crew	[Australian economy, Australian politics, Warren Truss, Coalition]
Mon Sep 07 13:20:26 MSK 2015	Fashion	Super furry Gucci loafers: why these daft shoes are autumn’s defining item	[Fashion, Life and style, Gucci]
Mon Sep 07 13:13:48 MSK 2015	Politics	Speaker changes voting rules after influx of 'Mc' surnames causes delays	[House of Commons, John Bercow, Politics, UK news, Scotland, Scottish National party (SNP)]
Mon Sep 07 13:08:04 MSK 2015	GAIN partner zone	Food fortification in Tanzania, culminating a global summit	[GAIN partner zone]
Mon Sep 07 13:07:35 MSK 2015	Business	Primark's UK growth accelerates ahead of US launch	[Primark, Associated British Foods, Business, Retail industry, Food & drink industry]
Mon Sep 07 13:05:54 MSK 2015	Sport	Jack Nowell: We’ve all got a tattoo in my family – it’s what fishermen did	[England rugby union team, Rugby World Cup 2015, Exeter, Rugby World Cup, Rugby union, Sport, Cornwall]
Mon Sep 07 13:05:25 MSK 2015	Comment is free	If the Queen had any sense of occasion, she’d celebrate her longevity by karate-chopping Nicholas Witchell in the mouth | Stuart Heritage	[The Queen, The Gambia]
Mon Sep 07 13:04:15 MSK 2015	Film	A Bigger Splash review - Tilda Swinton and Ralph Fiennes make waves in entertainingly oddball psychodrama	[A Bigger Splash, Venice film festival 2015, Film, Venice film festival, Culture, Festivals, Tilda Swinton, Ralph Fiennes, World cinema]
Mon Sep 07 13:00:06 MSK 2015	Books	Poem of the week: In His Other House by Jee Leong Koh	[Poetry, Books, Culture]
Mon Sep 07 00:59:14 MSK 2015	Politics	'Silent peers' claim almost £1.3m despite not speaking in Lords debates	[House of Lords, Lords reform, Politics, UK news, Honours system, Conservatives, David Cameron]
Mon Sep 07 00:52:53 MSK 2015	Global development	Bashi's journey from Africa to Europe may signal a bigger refugee crisis to come | Mohamed Yahya	[Migration and development, Global development, Aid, Refugees, Somalia, Africa, Migration, Middle East and North Africa]
Mon Sep 07 00:50:02 MSK 2015	Global development	The best way to measure a household's resilience? Ask those who live there | Lindsey Jones	[Global development, Climate change, Natural disasters and extreme weather, Environment]
Mon Sep 07 00:44:57 MSK 2015	Cities	An insider's guide to Lima: psychedelic electronica and ceviche by the sea	[Insider's cultural guides, Cities, Lima, Peru, South America, Travel, Peru, Culture, Americas, World news]
Mon Sep 07 00:39:36 MSK 2015	Books	Calais refugee library flooded with thousands of books	[Libraries, Immigration and asylum, Refugees, Books, Culture, World news, UK news, Migration and development]
Mon Sep 07 00:37:25 MSK 2015	Media	Rebekah Brooks’ email to News UK staff on first day back – full text	[News UK, Media, National newspapers, Newspapers, Newspapers & magazines]
Mon Sep 07 00:34:10 MSK 2015	Life and style	The problem with religious people? They always think they’re right	[Life and style, Assisted dying, Law, Society, Religion, World news, UK news, Justin Welby, Pope Francis, Abortion]
Mon Sep 07 00:33:07 MSK 2015	Football	Football quiz: country of birth	[Football, Sport]
Mon Sep 07 00:33:04 MSK 2015	Media	Rebekah Brooks says it ‘is a privilege’ to be back at News UK	[News UK, Media, National newspapers, Newspapers, Newspapers & magazines, UK news, Rupert Murdoch]
Mon Sep 07 00:30:00 MSK 2015	Education	Schools tighten grip on restrictive dress codes – and students are fed up	[Students, US education, Education, Fashion]
Mon Sep 07 00:27:38 MSK 2015	Music	End of the Road festival review – the bands love it as much as the crowd	[End of the Road festival, Music festivals, Music, Festivals, Culture, Pop and rock, Indie]
Mon Sep 07 00:19:37 MSK 2015	Comment is free	Nervous freshers: don’t be scared. University has something for everyone | Lucy Webster	[Freshers, University administration, Higher education, Education, University guide, Students, UK news]
Mon Sep 07 00:15:37 MSK 2015	UK news	Spitfire pilot makes emergency landing in Kent field	[UK news, Air transport, Plane crashes]
Mon Sep 07 00:13:22 MSK 2015	Money	I've had 20 years in HR and can't get a job	[Job hunting, Work & careers, Money]
Mon Sep 07 00:08:57 MSK 2015	Music	Jerry Lee Lewis review – a rare, authentic rock'n'roll jamboree	[Jerry Lee Lewis, Pop and rock, Music, Culture]
Mon Sep 07 00:08:21 MSK 2015	Politics	David Cameron to unveil new counter-terrorism measures in Syria statement	[Counter-terrorism policy, UK security and counter-terrorism, David Cameron, House of Commons, UK news, Politics]
Mon Sep 07 00:08:13 MSK 2015	Environment	Farmers clash with police in Brussels during milk and meat prices protest	[Farming, Environment, Milk, Europe, World news, Supermarkets, Retail industry, Business, European Union, Asda, Morrisons, Aldi, Lidl, Tesco]
Mon Sep 07 00:04:26 MSK 2015	Stage	Northern Ballet: 1984 review – sleight of hand that chills and unsettles	[Ballet, Dance, Stage, Culture]
Mon Sep 07 00:01:39 MSK 2015	Sustainable Business - Grundfos partner zone	What tap water campaigns are missing	[Sustainable Business - Grundfos partner zone]
Mon Sep 07 00:00:05 MSK 2015	Science	Self-control saps memory resources	[Neuroscience, Science]
Mon Sep 07 00:00:05 MSK 2015	Education	Students' return to school is marred by renewed segregation across US	[US education, Schools, Race in education]
Mon Sep 07 11:56:29 MSK 2015	UK news	Northern Ireland power-sharing executive meetings suspended	[Northern Ireland, Democratic Unionist party (DUP), Peter Robinson, Politics, UK news, Sinn Féin, Ulster Unionist Party (UUP), IRA]
Mon Sep 07 11:49:45 MSK 2015	Media	Jeremy Clarkson ‘not worth the money’ Amazon spent, says Netflix executive	[Media, Jeremy Clarkson, Top Gear, Television, Amazon Prime Instant Video, Culture, Netflix]
Mon Sep 07 11:46:55 MSK 2015	Film	The silent-era film stars who risked life and limb doing their own film stunts	[Film, Culture, Silent film, Buster Keaton, Westerns, Comedy, Comedy]
Mon Sep 07 11:46:28 MSK 2015	World news	We asked all 22 presidential candidates to define a US refugee policy. Few had clear answers	[Refugees, Migration, US immigration, US news, US politics, Democrats, Republicans, US elections 2016, US domestic policy, US foreign policy, Martin O'Malley, Hillary Clinton, Syria, Middle East and North Africa, World news]
Mon Sep 07 11:46:00 MSK 2015	Football	Iceland reach Euro 2016 but Lars Lagerback insists: ‘Nelson Mandela is a hero, I am not’	[Iceland, Football, Sport, Euro 2016 qualifiers, Euro 2016]
Mon Sep 07 11:38:16 MSK 2015	Global Development Professionals Network	How to communicate the sustainable development goals to the public	[Global development professionals network, Sustainable development goals, Millennium development goals, United Nations, Poverty]
Mon Sep 07 11:37:51 MSK 2015	Children's books	Wanted: children's books with surprising animals	[Children and teenagers, Books, Culture, Children's books: 7 and under, Picture books, Animals, Judith Kerr, Anthony Browne, Raymond Briggs]
Mon Sep 07 11:37:06 MSK 2015	Media	The real reason for the BBC's regional newspaper 'reporting pool'...	[Media, BBC, Tony Hall, Regional & local newspapers, Newspapers, Digital media, Newspapers & magazines, Media business, Public service reporting, Public service broadcasting]
Mon Sep 07 11:36:00 MSK 2015	Football	Aaron Ramsey confident Wales can secure Euro 2016 place in style	[Wales, Aaron Ramsey, Euro 2016, Euro 2016 qualifiers, Football, Sport]
Mon Sep 07 11:31:04 MSK 2015	Politics	Labour leadership: whatever the result politics is about to get livelier	[Labour party leadership, Jeremy Corbyn, UK news, Yvette Cooper, Andy Burnham, Liz Kendall, Labour, Politics]
Mon Sep 07 11:30:55 MSK 2015	Social Care Network - Cafcass partner zone	Meeting the increasingly diverse needs of today’s children and families	[Social Care Network - Cafcass partner zone]
Mon Sep 07 11:30:04 MSK 2015	US news	'No app for that': tech-rich San Francisco's intractable homelessness	[San Francisco, Homelessness, Housing, Society, US news]
Mon Sep 07 11:29:47 MSK 2015	Books	Stephen King to receive National Medal of Arts from Barack Obama	[Stephen King, Books, Culture, Awards and prizes, Science fiction, Horror, Fiction, US news]
Mon Sep 07 11:27:31 MSK 2015	Environment	Should you install thermodynamic panels on your home?	[Ethical and green living, Energy efficiency, Environment, Energy, UK news, Consumer affairs, Energy bills, Household bills, Money]
Mon Sep 07 11:25:33 MSK 2015	Guardian Small Business Network	Sunday trading plans will put independent stores at risk	[Supporting business growth, Guardian Small Business Network, Business, Small business, Retail industry, Entrepreneurs]
Mon Sep 07 11:25:19 MSK 2015	Sport	Talking Horses: Monday’s best bets plus the latest racing news	[Tony McCoy, Horse racing tips, Horse racing, Sport]
Mon Sep 07 11:17:55 MSK 2015	World news	Germany to spend extra €6bn to fund record influx of 800,000 refugees	[Germany, Refugees, Angela Merkel, Europe, Austria, Hungary, Migration, European Union, World news]
Mon Sep 07 11:15:04 MSK 2015	Comment is free	Corrections officers can be the engine of justice reform, if they are in a union  | Chandra Bozelko	[US prisons, US unions, US work & careers]
Mon Sep 07 11:12:03 MSK 2015	Housing Network	Rent controls in Scotland are just the first step to a fairer society	[Housing Network, Private rented sector, Housing, Renting property, Scotland, Society, Communities, Property]
Mon Sep 07 11:11:20 MSK 2015	UK news	UK weather: unsettled summer gives way to hot spell ... for a week	[Weather, UK news]
Mon Sep 07 11:11:17 MSK 2015	Film	David Beckham expecting criticism after taking Hollywood cameo role	[Film, Culture, David Beckham, Football, Sport, Guy Ritchie, UK news]
Mon Sep 07 11:10:44 MSK 2015	Books	Patrick Ness's refugee appeal tops £500,000	[Children and teenagers, Fiction, Books, Culture, Refugees, World news]
Mon Sep 07 11:08:47 MSK 2015	World news	100 days of Buhari: what do Nigerians really think of their new president?	[Nigeria, Africa, World news, Governance]
