Fri Aug 14 18:19:16 MSK 2015	Music	The Marriage of Figaro at Edinburgh festival review – Fischer's innovative take on Mozart	[Music, Edinburgh festival 2015, Opera, Classical music, Culture, Wolfgang Amadeus Mozart]
Fri Aug 14 18:19:08 MSK 2015	Environment	We’re signing the Litter Manifesto to help clean up the UK | Letters	[Environment, Business, UK news, Pollution]
Fri Aug 14 18:16:56 MSK 2015	Stage	Anna Maxwell Martin to star as Lady Macbeth at London's Young Vic	[Theatre, Stage, Culture, William Shakespeare, Young Vic, Carrie Cracknell, Dance]
Fri Aug 14 18:16:08 MSK 2015	Media	Good to meet you… Barbara Earl	[The Guardian, Media]
Fri Aug 14 18:06:00 MSK 2015	US news	Stop-and-frisk deal: shame on ACLU and Chicago, say anti-violence activists	[Chicago, US news, US policing, Race issues]
Fri Aug 14 18:05:50 MSK 2015	Comment is free	Yarl’s Wood is symptomatic of Britain’s paranoia about migrants | Ellie Mae O’Hagan
	[Immigration and asylum, Human rights, Migration, UK news, World news]
Fri Aug 14 17:55:54 MSK 2015	Sport	Ellyse Perry guides Australia to Ashes Test win against slack England	[Women's Ashes, England women's cricket team, Southern Stars, Australia sport, Sport, Women's cricket, Cricket]
Fri Aug 14 17:50:00 MSK 2015	Comment is free	The strange death of Labour Britain has a worrying precedent | Martin Kettle	[Labour, Labour party leadership, Politics, UK news]
Fri Aug 14 17:49:33 MSK 2015	UK news	Student with four A* A-levels refused finance over immigration status	[UK news, A-levels, Chemical engineering, Imperial College London, Education, Exams, Higher education, Schools, Sixth form, Student finance, Students, Immigration and asylum]
Fri Aug 14 17:47:29 MSK 2015	World news	US embassy in Cuba formally reopens: 'A day for pushing aside old barriers'	[Cuba, John Kerry, US foreign policy, US news, Americas, World news]
Fri Aug 14 17:46:46 MSK 2015	Sport	Kelly Holmes joins criticism of flag-less British athletics kit	[Athletics, World Athletics Championships, Sport, UK news, Kelly Holmes, Greg Rutherford]
Fri Aug 14 17:43:57 MSK 2015	World news	Navajo Code Talkers Day celebrates crucial second world war contribution	[Second world war, Native Americans, World news, US news, US military]
Fri Aug 14 17:42:55 MSK 2015	Comment is free	Benedict Cumberbatch? No, it’s Dwane who deserves the award for Hamlet | Peter Bradshaw	[Theatre, Benedict Cumberbatch, William Shakespeare, Stage, Culture, UK news]
Fri Aug 14 17:42:18 MSK 2015	Education	Bristol University technical issues put prospective students in limbo	[Higher education, Clearing, A-levels, Education, Exams, Sixth form, Schools, Bristol, UK news]
Fri Aug 14 17:32:47 MSK 2015	Sport	France name largely reserve XV to face England in World Cup warm-up	[France rugby union team, England rugby union team, Rugby union, Sport]
Fri Aug 14 17:30:23 MSK 2015	Film	Mapping the galaxy: JJ Abrams reveals new details of Star Wars: The Force Awakens	[Star Wars, Harrison Ford, JJ Abrams, Star Wars: The Force Awakens, Film, Culture, Science fiction and fantasy, Domhnall Gleeson, Mark Hamill]
Fri Aug 14 17:27:23 MSK 2015	Comment is free	Chelsea’s doctor can look after herself. It’s poor José Mourinho I worry about  | Marina Hyde	[Chelsea, José Mourinho, Football, Sport, UK news, Women, Gender]
Fri Aug 14 17:21:39 MSK 2015	Sport	York going predicted to be perfect for Gleneagles in Golden Horn clash	[Horse racing, Golden Horn, Sport, Gleneagles]
Fri Aug 14 17:18:51 MSK 2015	Television & radio	Stephen Lewis obituary	[Television, Television & radio, Film, Stage, Theatre, Culture, ITV channel, Comedy]
Fri Aug 14 17:17:18 MSK 2015	Politics	Scottish Labour campaigners rally behind Jeremy Corbyn	[Jeremy Corbyn, Labour party leadership, Scottish politics, Labour, Politics, UK news, Scotland, Aberdeen, Dundee, Glasgow, Edinburgh]
Fri Aug 14 17:11:06 MSK 2015	Business	Oxfam faces tough new test in the era of Lidl, Aldi and Primark	[Retail industry, Oxfam, World news, Charitable giving, Charities, Consumer affairs, Money, Society, Voluntary sector, Business]
Fri Aug 14 17:11:03 MSK 2015	Football	Southampton v Everton: match preview	[Southampton, Everton, Premier League, Football, Sport]
Fri Aug 14 17:04:39 MSK 2015	Books	Stop and hear the poetry: spoken words beckon to bustling New York City	[Poetry, Books, Culture, New York, Spoken word]
Fri Aug 14 17:04:02 MSK 2015	Music	Dr Dre tops UK albums chart for the first time with Compton	[UK charts, Dr Dre, Music, Culture, Rap, Hip-hop, Music industry, Meghan Trainor, Calvin Harris]
Fri Aug 14 17:01:52 MSK 2015	Science	Ramesh Vyas obituary	[Materials science, Science, Lecturers, Higher education, Education]
Fri Aug 14 17:00:47 MSK 2015	US news	Hunter who shot Cecil the lion illegally killed black bear in Wisconsin in 2006	[Wisconsin, Wildlife, US news, Animals, Cecil the lion, Environment]
Fri Aug 14 16:58:23 MSK 2015	Education	Brian Nisbet obituary	[Careers, Education, Poetry, Books]
Fri Aug 14 16:53:57 MSK 2015	Comment is free	A letter from the palace won’t stop the paparazzi pursuing Prince George | Anne Perkins
	[Prince George, Monarchy, UK news, Prince Charles, Prince William, Newspapers & magazines, Media, Leveson inquiry]
Fri Aug 14 16:53:40 MSK 2015	Television & radio	Cilla Black's home target of funeral burglary plot, says publicist	[Cilla Black, Liverpool, Television, Culture, Television & radio, UK news, Music]
Fri Aug 14 16:52:39 MSK 2015	Football	Sunderland v Norwich City: match preview	[Sunderland, Norwich City, Premier League, Football, Sport]
Fri Aug 14 16:52:38 MSK 2015	World news	American flag raised as US embassy reopens in Cuba – live	[Cuba, John Kerry, Americas, US foreign policy, US news, US politics]
Fri Aug 14 16:51:05 MSK 2015	Film	The great poster riddle: why the Lance Armstrong movie promo looks familiar	[Biopics, Culture, Film, Stephen Frears, The Social Network]
Fri Aug 14 16:47:25 MSK 2015	US news	Top US companies deliver hope to thousands of Chicago youths at job fair	[Chicago, US news, Starbucks, US economy, US unemployment and employment data, Business, Food & drink industry]
Fri Aug 14 16:41:03 MSK 2015	World news	Occupy Democracy protester has assault charge thrown out by judge	[Occupy movement, London, Liberal Democrats, Politics, UK news, Protest]
Fri Aug 14 16:39:03 MSK 2015	Football	Watford v West Bromwich Albion: match preview	[Watford, West Bromwich Albion, Premier League, Football, Sport]
Fri Aug 14 16:27:03 MSK 2015	UK news	Kids Company was pledged £20m by government last summer, founder says	[Kids Company, Camila Batmanghelidjh, Child protection, Children, UK news, Society, Social care, Voluntary sector]
Fri Aug 14 16:27:01 MSK 2015	World news	Animal rights protesters aim to rein in Siena's Palio horse race	[Italy, Animal welfare, Europe, Animals, World news]
Fri Aug 14 16:25:25 MSK 2015	Society	Camila Batmanghelidjh: ‘I’m actually quite rigorous. I’m just not wearing a suit’	[Camila Batmanghelidjh, Kids Company, UK news, Charities, Voluntary sector, Social care, Children, Society]
Fri Aug 14 16:25:24 MSK 2015	Life and style	Do companies make sexist ads just to get talked about?	[Women, Life and style, Society, Media]
Fri Aug 14 16:25:22 MSK 2015	Football	Football brings drama, duplicity and paranoia – in just one week | Barry Glendenning	[Football, José Mourinho, Sport]
Fri Aug 14 16:24:37 MSK 2015	UK news	Police investigate explosion at MI5 headquarters in Northern Ireland	[UK security and counter-terrorism, Northern Ireland, MI5, Police, UK news]
Fri Aug 14 16:23:12 MSK 2015	Football	Swansea City v Newcastle United: match preview	[Swansea City, Newcastle United, Premier League, Football, Sport]
Fri Aug 14 16:19:57 MSK 2015	Society	Man 'was making political stand' by writing about last day in Sun newspaper	[Assisted dying, UK news, The Sun, Newspapers, Media, Switzerland, Society, Law]
Fri Aug 14 16:16:57 MSK 2015	Business	Raspberry Pi manufacturer ousts chief executive after run of bad results	[Premier Farnell, Business, Computing, Technology, Raspberry Pi, Technology sector, Programming, UK news]
Fri Aug 14 16:15:01 MSK 2015	Comment is free	Bernie Sanders must show he takes race as seriously as class struggle | Syreeta McFadden	[Bernie Sanders, Race issues, US news, US elections 2016]
Fri Aug 14 16:11:29 MSK 2015	Sport	Women's Ashes 2015: Australia beat England in Test to take 8-2 lead	[Women's Ashes, Australia sport, England women's cricket team, Southern Stars, Cricket, Sport, Women's cricket]
Fri Aug 14 16:05:02 MSK 2015	Media	Prince George paparazzi row: royals' truce with press under pressure	[National newspapers, News photography, Newspapers & magazines, Newspapers, Media, The Duchess of Cambridge, Prince William, Monarchy, UK news]
Fri Aug 14 16:02:47 MSK 2015	Guardian Small Business Network	Innovation in Funding 2015-16: BakedIn	[Small Business Showcase]
Fri Aug 14 16:00:00 MSK 2015	Life and style	The good mixer: Peas & Qs cocktail recipe	[Food & drink, Cocktails, Spirits, Vegetables, Life and style]
Fri Aug 14 16:00:00 MSK 2015	Books	The Emperor Far Away: Travels at the Edge of China by David Eimer review – entertaining and insightful	[Paperbacks, Travel writing, Books, Culture, China, Asia, Travel]
Fri Aug 14 15:59:57 MSK 2015	Business	FTSE loses all 2015's gains as oil slides again	[Business, Stock markets, BP, Royal Dutch Shell, Weir, ARM, Tui Travel, St James's Place]
Fri Aug 14 15:53:41 MSK 2015	Guardian Small Business Network	Innovation in Funding 2015-2016: JustPark	[Small Business Showcase]
Fri Aug 14 15:53:01 MSK 2015	Sport	David Warner calls being Australia’s deputy captain a ‘massive honour’	[David Warner, Australia cricket team, Cricket, Sport, Australia sport]
