Wed Sep 16 10:24:45 MSK 2015	Film	Jennifer Lawrence in line for spy thriller Red Sparrow with Hunger Games director	[Jennifer Lawrence, Film, Action and adventure, Thriller, Culture, Joy, David Fincher, US news, Film adaptations, Books, World news]
Wed Sep 16 10:24:24 MSK 2015	Music	Marriage of Figaro - have you lost the plot?	[Wolfgang Amadeus Mozart, Classical music, Opera, Culture, Music]
Wed Sep 16 10:19:55 MSK 2015	Australia news	Senate committee warns against holding plebiscite on same-sex marriage	[Marriage equality (Australia), Australian politics, Australia news, Tony Abbott, Coalition, Liberal party]
Wed Sep 16 10:19:53 MSK 2015	Guardian Small Business Network	Marketing and PR 2015-16: Clare Macnaughton	[Small Business Showcase]
Wed Sep 16 10:18:02 MSK 2015	Comment is free	The national anthem may stick in Corbyn’s craw, but it is his job to sing it | Anne Perkins	[Labour, Jeremy Corbyn, Politics, UK news, Monarchy]
Wed Sep 16 10:17:43 MSK 2015	Politics	Labour in disarray over benefits cap	[Jeremy Corbyn, Benefits, Welfare, UK news, Labour, Politics, Society]
Wed Sep 16 10:12:38 MSK 2015	Business	Anheuser-Busch InBev plans $250bn tie-up with SABMiller	[SABMiller, UK news, Beer, Business]
Wed Sep 16 10:10:00 MSK 2015	Football	Manchester United’s Luke Shaw facing six months out after leg operation	[Manchester United, PSV Eindhoven, Champions League, Football, Sport]
Wed Sep 16 10:07:29 MSK 2015	Politics	National anthem furore proves Corbyn must pick his battles more carefully	[Jeremy Corbyn, Politics, UK news, Labour, Republicanism, The Queen, Monarchy]
Wed Sep 16 10:07:18 MSK 2015	Guardian Small Business Network	Marketing and PR 2015-16: Charlotte Storrs Stoneware	[Small Business Showcase]
Wed Sep 16 10:06:50 MSK 2015	Media	ITV’s Bear Grylls show fails to hit big time as just 1.5 million tune in	[TV ratings, ITV channel, Media, Television industry, ITV plc, Channel 4, Channel 5, BBC1, BBC, UK news]
Wed Sep 16 10:03:25 MSK 2015	Environment	US and Australian taxpayers pay billions a year to fund coal – report	[Coal, Fossil fuels, Energy, Environment, Climate change, Australia news, US news, World news, Tax (Australia), US taxation]
Wed Sep 16 10:03:24 MSK 2015	World news	Nauru bans transhipments to tackle overfishing in wake of Greenpeace bust	[Asia Pacific, Nauru, Marine life, Environment, Wildlife, Fishing, Animals, Food]
Wed Sep 16 10:02:48 MSK 2015	Sport	Talking Horses: Wednesday’s best bets plus the latest racing news	[Horse racing tips, Horse racing, Sport]
Wed Sep 16 10:00:16 MSK 2015	Comment is free	This sinister trade union bill is an assault on the rights of working people | Ellie Mae O’Hagan	[Trade unions, Politics, Industrial action, Law, TUC, Conservatives, UK news, Work & careers]
Wed Sep 16 10:00:01 MSK 2015	Football	Maccabi’s Eran Zahavi ready to challenge Chelsea in Champions League	[Maccabi Tel Aviv, Chelsea, Champions League, Football, Sport]
Wed Sep 16 09:59:47 MSK 2015	Technology	Rockstar Games slams BBC Grand Theft Auto drama: 'Was Basil Brush busy?'	[Grand Theft Auto, BBC, Technology, Television, Games, Media, Culture, Television & radio]
Wed Sep 16 09:57:31 MSK 2015	Global Development Professionals Network	Aid workers, do you know what your pension is funding?	[Impact and effectiveness, Global development professionals network, Pensions, Investment funds, Ethical business, Ethical money, Investments, Business, Money]
Wed Sep 16 09:56:55 MSK 2015	Stage	The Sting review – barely competent production in an exquisite space	[Theatre, Stage, Culture]
Wed Sep 16 09:53:10 MSK 2015	Football	Chelsea a banter-free zone? Seriously, José, you’re having a laugh | Marina Hyde	[Chelsea, José Mourinho, Football, Sport]
Wed Sep 16 09:52:05 MSK 2015	Fashion	Oscar de la Renta at New York fashion week – sumptuous gowns and espadrilles	[Óscar de la Renta, Fashion, Life and style, New York fashion week Spring/Summer 2016]
Wed Sep 16 09:52:03 MSK 2015	Money	UK wages rising at quickest rate in six years	[Pay, Economics, Business, Money, Work & careers, Family finances, Interest rates, UK unemployment and employment statistics]
Wed Sep 16 09:36:51 MSK 2015	Cities	Why India should reject China's obsession with bigger, denser megacities	[Cities, Urbanisation, India, China, Asia Pacific, South and Central Asia, Beijing, Asia, China, Travel, Mumbai, World news, India]
Wed Sep 16 09:35:05 MSK 2015	Books	Poets speak out for refugees: 'No one leaves home, unless home is the mouth of a shark'	[Books, Culture, World news, Refugees, Immigration and asylum, UK news, Migration]
Wed Sep 16 09:30:00 MSK 2015	Football	How Arsenal blazed TV trail, jostling for airtime with cartoons and smut | Scott Murray	[Football, Arsenal, Sport, Media, Television, Culture, Television & radio]
Wed Sep 16 09:23:55 MSK 2015	Australia news	Tony Abbott says he will remain in parliament while he ponders future	[Tony Abbott, Australian politics, Liberal party, Malcolm Turnbull]
Wed Sep 16 09:21:13 MSK 2015	Television & radio	This is England '90 episode two trailer: 'Who likes salmonella?'	[This Is England, Drama, Period drama, Culture, Television, Television & radio]
Wed Sep 16 09:19:46 MSK 2015	Sport	R&A says Donald Trump’s comments should not bar Open return to Turnberry	[Golf, The Open, Sport, Donald Trump, US sports]
Wed Sep 16 09:18:53 MSK 2015	Media	Former Sun executive lands role as journalism school consultant	[Media, The Sun, News UK, Journalism education, National newspapers, Newspapers]
Wed Sep 16 09:18:10 MSK 2015	World news	The Kabul college turning street children into musicians - an audio-visual tour	[Afghanistan, Music, Culture, Education, World news, South and Central Asia]
Wed Sep 16 09:17:55 MSK 2015	World news	UN calls for Sri Lanka war crimes court to investigate atrocities	[Sri Lanka, South and Central Asia, World news, United Nations, War crimes, Human rights, Law]
Wed Sep 16 09:14:28 MSK 2015	Australia news	Turnbull turns polls around as he aims for 'predictable, competent government'	[Malcolm Turnbull, Coalition, Australian politics, Australia news, Labor party, Arthur Sinodinos, Scott Morrison, Peter Dutton, Christopher Pyne]
Wed Sep 16 09:14:00 MSK 2015	Sport	The Spin | It’s curtains for the bigger Tests at the Waca … it will be missed when it’s gone | Mike Selvey	[Australia sport, Australia cricket team, Cricket, Sport]
Wed Sep 16 09:12:57 MSK 2015	Business	Imagination Technologies drops 6% after warning of first half loss	[Business, Stock markets, ARM, Imagination Technologies, Technology, Apple]
Wed Sep 16 09:09:39 MSK 2015	Healthcare Professionals Network	'It's a hands-on job. Literally': 14 reasons to become a nurse	[Healthcare Network, Workforce, Nursing, Careers, Education, Health, Society, NHS, Careers]
Wed Sep 16 09:05:05 MSK 2015	Technology	Snapchat update offers in-app purchases (and terrifying new 'lenses')	[Snapchat, Technology, Smartphones, Apps, Mobile phones, Internet]
Wed Sep 16 09:01:34 MSK 2015	Comment is free	Home rule for Scotland is the only way forward for the UK | Alun Evans	[Scottish independence, Scottish politics, Scotland, Scottish National party (SNP), UK news, Politics]
Wed Sep 16 09:01:15 MSK 2015	Business	Global economy faces low growth in next year, says OECD	[Global economy, OECD, Business, Economics, Market turmoil, Stock markets]
Wed Sep 16 09:00:04 MSK 2015	Football	Can video replay work in soccer? MLS thinks so	[MLS, Football, Sport, US sports]
Wed Sep 16 09:00:03 MSK 2015	Sport	Standard issue: drug testing far from uniform in American horse racing	[Drugs in sport, American Pharoah, Horse racing, Sport, Usada (United States Anti-Doping Agency), US sports]
Wed Sep 16 08:58:42 MSK 2015	Education	Eight golden rules for living in student halls	[Freshers, Students, Education, Higher education, Advice for students, Student housing]
Wed Sep 16 08:51:53 MSK 2015	Business	FTSE moves higher again, with Burberry boosted by China hopes	[Business, Stock markets, Burberry, SABMiller, Reckitt Benckiser, Mondi, Inmarsat]
Wed Sep 16 08:50:25 MSK 2015	Australia news	Australia to cut number of special forces in Iraq on training mission	[Australia news, Syria, Iraq, Australian politics, Kevin Andrews, Australian defence force, Liberal party]
Wed Sep 16 08:47:53 MSK 2015	Technology	Forget 'Dislike' – here are 12 new buttons Facebook really needs	[Facebook, Social networking, Technology, Internet, Media]
Wed Sep 16 08:43:05 MSK 2015	Children's books	Meg Rosoff: Do not be afraid to be afraid – the Philippa Pearce memorial lecture	[Children and teenagers, Books, Culture, Children's books: 8-12 years, Teen books, Meg Rosoff]
Wed Sep 16 08:40:37 MSK 2015	Media	US online publisher Refinery29 to begin international rollout in UK	[Digital media, Media, UK news, WPP]
Wed Sep 16 08:40:00 MSK 2015	World news	Chinese farmer burned to death during eviction	[China, Asia Pacific, World news]
Wed Sep 16 08:30:03 MSK 2015	Comment is free	What if the mega-rich just want rocket ships to escape the Earth they destroy? | Jess Zimmerman	[Jeff Bezos, Amazon, Space, US income inequality, Environment]
Wed Sep 16 08:24:37 MSK 2015	Technology	Is it safe to turn your children into YouTube stars?	[YouTube, Internet, Technology, Blogging, Digital media, Children, Child protection, Child rights]
Wed Sep 16 08:09:32 MSK 2015	Football	Football transfer rumours: Philippe Coutinho off to Barcelona or Real?	[Football, Transfer window, Sport]
Wed Sep 16 08:04:54 MSK 2015	Film	Bear necessities: short but sweet first trailer for Disney's Jungle Book remake hits web	[Film, The Jungle Book, Culture, Science fiction and fantasy, Walt Disney Company, India, Scarlett Johansson, Rudyard Kipling, Film adaptations, Books, South and Central Asia, World news, US news, Marketing & PR, Media, Bill Murray, Ben Kingsley, Idris Elba, Christopher Walken, Lupita Nyong'o]
Wed Sep 16 08:00:03 MSK 2015	Music	Vinyl countdown: how do three new subscription services stack up?	[Vinyl, Music, Record Store Day, Culture, Nick Cave, Wu-Tang Clan]
Wed Sep 16 08:00:02 MSK 2015	Adam Smith International partner zone	Beyond oil: competition is the new fuel for Nigeria's economy	[Adam Smith International partner zone]
Wed Sep 16 08:00:02 MSK 2015	Comment is free	Refugees need the supplies I brought. But respect is just as critical | Heydon Prowse	[Refugees, Greece, Aid, Society, Global development, Europe, World news, UK news]
Wed Sep 16 08:00:02 MSK 2015	Children's books	Harry Potter and the Half-Blood Prince by J.K. Rowling - review	[Children and teenagers, Books, Culture, Teen books, Children's books: 8-12 years, Friendship (children and teens), Witches, wizards and magic, Children's fantasy books (children's and teens), JK Rowling, Harry Potter, School]
Wed Sep 16 08:00:02 MSK 2015	Sport	Rugby World Cup preview No16: France	[Rugby World Cup 2015 previews, France rugby union team, Rugby World Cup 2015, Rugby World Cup, Rugby union, Sport]
Wed Sep 16 07:59:02 MSK 2015	Football	What’s the longest a team has gone without conceding at the start of a season? | The Knowledge
	[Manchester City, Football, Sport]
Wed Sep 16 07:55:17 MSK 2015	Business	JD Sports celebrates record 80% profit rise	[JD Sports Fashion, Business, Retail industry, UK news]
Wed Sep 16 07:53:28 MSK 2015	Media	Jeremy Corbyn and the national anthem - a press chorus of disapproval	[Media, Jeremy Corbyn, Monarchy, The Queen, National newspapers, Newspapers, Politics, Hamas, Hezbollah, Sinn Féin, World news, UK news, Republicanism, The Guardian, The Independent, Daily Telegraph, The Times, Financial Times, Daily Mail, The Sun, Daily Express, Daily Star, Daily Mirror, Metro, i, London Evening Standard, Regional & local newspapers]
Wed Sep 16 07:49:38 MSK 2015	Media	Today’s media stories from the papers	[Media]
Wed Sep 16 07:46:32 MSK 2015	Music	Janis Joplin's psychedelic Porsche to go on sale	[Janis Joplin, Music, Culture, Pop and rock]
Wed Sep 16 07:43:07 MSK 2015	Australia news	Turnbull pressed on climate change and marriage equality – politics live	[Australian politics, Malcolm Turnbull, Tony Abbott, Australia news, World news]
Wed Sep 16 07:31:19 MSK 2015	Politics	Corbyn promises consensual politics in first 'crowd-sourced' PMQs	[Jeremy Corbyn, Politics, UK news, PMQs, House of Commons, Labour, David Cameron, Monarchy, Military]
Wed Sep 16 07:31:02 MSK 2015	Technology	Chatterbox: Wednesday	[Games, Technology]
Wed Sep 16 07:30:02 MSK 2015	Social Care Network	Autism as an adult: 'On the many days I spend alone I forget how to talk'	[social care network: adult social care hub, Social Care Network, Autism, Society, Social care, Mental health, Health]
Wed Sep 16 07:30:01 MSK 2015	Healthcare Professionals Network	Why David Cameron's immigration rules will worsen nurse shortages	[Healthcare Network, Nursing, Health, Society, Workforce, Leadership and management, NHS, International, David Cameron, Politics, Immigration and asylum]
Wed Sep 16 07:30:01 MSK 2015	Society	Disabled people have been shut out of Britain’s tourist spots for too long | Frances Ryan	[Disability, Society, England holidays, Travel]
Wed Sep 16 07:27:00 MSK 2015	Music	Chrissie Hynde clarifies comments on rape	[Chrissie Hynde, Music, Pop and rock, Culture]
Wed Sep 16 07:21:38 MSK 2015	Football	Héctor Moreno ‘really sorry’ for tackle on Manchester United’s Luke Shaw	[Manchester United, PSV Eindhoven, Champions League, Football, Sport]
Wed Sep 16 07:20:01 MSK 2015	Life and style	Kitchen gadgets review: Joie citrus squeeze and mist – ‘I don’t know a more undignified way to prepare fish’	[Fruit, Food & drink, Life and style, Gadgets, Technology]
Wed Sep 16 07:07:12 MSK 2015	Australia news	Breastfeeding MP reportedly told to express more milk before votes says issue 'resolved'	[Australian politics, Liberal party, Australia news, Breastfeeding]
Wed Sep 16 07:04:32 MSK 2015	Australia news	High-profile deaths of Queensland women prompt copycat threats	[Crime - Australia, Domestic violence, Queensland]
Wed Sep 16 07:00:03 MSK 2015	Comment is free	Why are houses so expensive? You asked Google – here’s the answer | Dawn Foster	[House prices, Housing market, Housing, Renting property, Money, Society, Real estate, Mortgages, Property, Business, Young people, London, UK news]
Wed Sep 16 07:00:02 MSK 2015	Television & radio	From Blind Date to First Dates: how TV matchmaking grew up	[Television, Dating, Take Me Out, Television & radio, Life and style, Culture, Game shows, Channel 4]
Wed Sep 16 07:00:01 MSK 2015	Children's books	Seven YA novels that show the lives of teens across the world	[Children and teenagers, Teen books, Books, Culture, Ballet, Teen romance (childrens and teens), Friendship (children and teens), Animals]
Wed Sep 16 07:00:01 MSK 2015	Film	Legend: Tom Hardy's double take dilutes the story of the Kray twins	[Legend, Film, Tom Hardy, Culture, Drama, Biopics, Crime, Crime, UK news]
Wed Sep 16 06:59:01 MSK 2015	Society	The disability activist who called in the UN	[Disability, Public sector cuts, Public services policy, Public finance, Society]
Wed Sep 16 06:54:17 MSK 2015	Music	Roger Waters: 'Donald Trump is pig ignorant'	[Roger Waters, Pink Floyd, Music, Donald Trump, Culture, US news, World news]
Wed Sep 16 06:30:02 MSK 2015	Television & radio	Britain’s Biggest Adventures with Bear Grylls review – comes with a health warning	[Television, Television & radio, Culture]
Wed Sep 16 06:30:01 MSK 2015	Society	The refugee crisis will hit the UK’s working class areas hardest | Lisa Mckenzie	[Communities, Refugees, Social exclusion, Housing, Equality, Society, World news, UK news, Poverty]
Wed Sep 16 06:30:01 MSK 2015	Books	The Evolution of Everything by Matt Ridley review – the rightwing libertarian gets it wrong	[Society, Books, Culture]
Wed Sep 16 06:30:01 MSK 2015	Women in Leadership	The three things, beyond childcare, that can help new mothers return to work	[Women in Leadership, Maternity and childcare, Women in the boardroom, Women, Childcare]
Wed Sep 16 06:30:00 MSK 2015	Cities	'This isn't at all like London': life in Walter Segal's self-build 'anarchist' estate	[Cities, Housing, Architecture, Sustainable development, Communities, Environment, Society, London, Housing market, House prices, Property, UK news]
Wed Sep 16 06:29:10 MSK 2015	Australia news	Coalition may overhaul its workplace relations laws to win Senate approval	[Industrial relations, Australian politics, Coalition, Australia news, Eric Abetz, Australian trade unions, Ricky Muir]
Wed Sep 16 06:26:41 MSK 2015	World news	More millionaires in Asia-Pacific than North America, says study	[Asia Pacific, World news, India, China, Indonesia, Thailand, Money, Global economy]
Wed Sep 16 06:01:19 MSK 2015	Art and design	Victorian Society reveals its top 10 endangered buildings	[Buildings at risk, Architecture, Art and design, Culture, Heritage]
Wed Sep 16 06:00:22 MSK 2015	Global development	Future perfect: investing in a child's wellbeing brings a big payoff	[Universal primary education, Global development, Sustainable development goals, Children, Society, Education, Early years education]
Wed Sep 16 06:00:21 MSK 2015	Guardian Small Business Network	Recipe for success: turn your kitchen table creation into a lucrative business	[Starting a new business, Guardian Small Business Network, Business, Small business, Entrepreneurs]
Wed Sep 16 06:00:21 MSK 2015	World news	How to stop worrying and embrace a nuclear North Korea	[North Korea, Nuclear weapons, Asia Pacific, World news, South Korea, US foreign policy, Non-proliferation treaty (NPT), International Atomic Energy Agency (IAEA), US news]
Wed Sep 16 06:00:21 MSK 2015	Voluntary Sector Network	"I wasn't born a leader but my passion for social justice made me one"	[Voluntary Sector Network, Governance and management, Voluntary sector network blog, Charities, Society, Voluntary sector, Mental health, Public Leaders Network, Mental health, Society Professionals]
Wed Sep 16 06:00:20 MSK 2015	Comment is free	If Jeremy Corbyn’s Labour is going to work, it has to communicate | Owen Jones	[Labour, Politics, Jeremy Corbyn, UK news, Social media, Digital media, Media, Newspapers]
Wed Sep 16 06:00:20 MSK 2015	Politics	Former Scotland Office director argues for home rule	[Scottish independence, UK news, Politics, Scotland, Scottish politics, Nicola Sturgeon, Scottish National party (SNP)]
Wed Sep 16 06:00:20 MSK 2015	UK news	To sing or not to sing: a history of national anthem controversies	[UK news, Jeremy Corbyn, US news, Politics, World news]
Wed Sep 16 06:00:20 MSK 2015	Public Leaders Network	The real reason the Tories want to scrap fire and rescue authorities	[Public Leaders Network, Emergency services, Local government, Local leadership, Local Leaders Network, Local government, Society, Politics, Firefighters, Police and crime commissioners, Police]
Wed Sep 16 06:00:19 MSK 2015	Money	I bought a washing machine but all I got was Very poor service	[Consumer rights, Consumer affairs, Money, Retail industry]
Wed Sep 16 06:00:19 MSK 2015	Teacher Network	Tales from TAs: 'I hate heights but had to climb up a wobbly tower'	[Teacher Network, Education, Schools, Primary schools, Secondary schools, Teaching, Career advice]
Wed Sep 16 06:00:19 MSK 2015	Global Development Professionals Network	Domestic workers in Hong Kong: what being a migrant means to me	[Global development professionals network, Hong Kong, Asia Pacific, World news, Indonesia, Philippines, Migration, Photography, Art and design]
Wed Sep 16 05:59:48 MSK 2015	Australia news	No halal certifiers to appear at Bernardi inquiry scheduled on Muslim holy day	[Australia news, Islam, Cory Bernardi, Religion, Food & drink industry, Australian politics]
Wed Sep 16 05:54:19 MSK 2015	Environment	Yet another deadly snake species discovered in Australia	[Snakes, Wildlife, Animals, Australia news, Western Australia, Northern Territory, Endangered habitats, Conservation, Environment]
Wed Sep 16 05:52:43 MSK 2015	Australia news	Malcolm Turnbull reaches out to Senate crossbenchers on first full day in the job	[Malcolm Turnbull, Australian politics, Barack Obama, Mike Baird, Daniel Andrews, Annastacia Palaszczuk, Tony Abbott, Labor party]
Wed Sep 16 05:47:11 MSK 2015	Environment	Liberal senator Ian Macdonald says children 'brainwashed' on climate change	[Climate change scepticism, Climate change, Environment, Liberal party, Australian politics, Australia news]
Wed Sep 16 05:30:19 MSK 2015	Travel	The return of Antrim’s Gobbins Path	[Northern Ireland holidays, Walking holidays, Heritage, Wildlife holidays, United Kingdom holidays, Day trips, Travel, Northern Ireland]
Wed Sep 16 05:02:29 MSK 2015	Society	Victoria and New South Wales sign up to national disability insurance scheme	[Disability, Australian politics, Australia news, Malcolm Turnbull, Labor party, Coalition]
Wed Sep 16 05:00:19 MSK 2015	Business	US interest rates Q&A: what will the Federal Reserve do?	[Federal Reserve, Business, Economics, US Interest rates, Interest rates, Global economy, US economy, Quantitative easing, World news, Bank of England, Oil, Commodities, Stock markets, Dollar]
Wed Sep 16 05:00:18 MSK 2015	Environment	London's Santander bikes get high-tech laser lights amid arms race to be seen	[Cycling, Technology, London]
Wed Sep 16 05:00:18 MSK 2015	Television & radio	Wednesday’s best TV	[Television, Television & radio, Culture]
Wed Sep 16 05:00:18 MSK 2015	Environment	UK drops out of top 10 renewable energy ranking for first time	[Renewable energy, Environment, World news, UK news, Energy, US news]
Wed Sep 16 04:39:19 MSK 2015	Society	Australian FGM court case: girl, 11, describes 'silver tool' used on her	[Female genital mutilation (FGM), Sydney, Australian law, New South Wales]
Wed Sep 16 04:31:40 MSK 2015	Australia news	Revealed: how Indigenous Australian storytelling accurately records sea level rises 7,000 years ago	[Indigenous Australians, Climate change, Environment, Australia news, Indigenous peoples, Sea level]
Wed Sep 16 04:30:17 MSK 2015	Environment	David Attenborough backs huge Apollo-style clean energy research plan	[Renewable energy, David Attenborough, Climate change, Energy, COP 21: UN climate change conference | Paris, Environment, Research and development, Technology, UK news, World news, Climate change, Science]
Wed Sep 16 04:30:17 MSK 2015	Environment	Summer bids farewell as autumn plants seize their moment	[Environment, Rural affairs, UK news, Cornwall]
Wed Sep 16 04:26:02 MSK 2015	Australia news	Turnbull's so-called $4bn bribe to Nationals more wishes than fulfilment	[National party, Liberal party, Coalition, Australian politics, Australia news, Malcolm Turnbull, Warren Truss, Barnaby Joyce]
Wed Sep 16 04:00:17 MSK 2015	World news	French hotel chains open in Iran as nation braces for wave of tourists	[Iran, Middle East and North Africa, World news, Hotels, Travel]
Wed Sep 16 03:58:55 MSK 2015	Music	Steve Kilbey: the Church frontman on asylum seekers, whalers and new album	[Pop and rock, Music, Culture, Indie, Australia news]
Wed Sep 16 03:00:56 MSK 2015	Culture	Why Singapore censors took issue with an all-male cast Oscar Wilde play	[Brisbane festival 2015, Comedy, Stage, Culture, Brisbane festival, Theatre, Singapore, Asia Pacific, World news, Oscar Wilde]
Wed Sep 16 02:33:56 MSK 2015	Australia news	Australia's Islamic leaders see Turnbull as light at the end of Abbott tunnel	[Malcolm Turnbull, Islam, Australia news]
Wed Sep 16 02:21:42 MSK 2015	Comment is free	After the wreckage Abbott caused he still left feeling sore and under-appreciated | Jason Wilson	[Tony Abbott, Australian politics, Australia news, Canberra]
Wed Sep 16 02:08:37 MSK 2015	World news	Australian fighter jets bomb Isis tank in east Syria airstrike, says Kevin Andrews	[Islamic State, Australia news, Kevin Andrews, Coalition, Syria, Iraq]
Wed Sep 16 01:56:35 MSK 2015	Comment is free	Progressives, don't be fooled. Turnbull will rule from and for the big end of town | Van Badham	[Malcolm Turnbull, Australian politics, Australia news]
Wed Sep 16 01:52:47 MSK 2015	Travel	48 hours in Mackay, north Queensland – where to go, what to do	[Queensland, Australia, Australasia, Australia travel blog, Travel, National parks, Environment]
Wed Sep 16 01:23:30 MSK 2015	Australia news	Daniel Andrews calls on Malcolm Turnbull to reprioritise public transport	[Victorian politics, Road transport, Malcolm Turnbull, Daniel Andrews, Victoria, Australia news]
Wed Sep 16 01:00:21 MSK 2015	US news	Democrats hold firm on US-Iran nuclear deal but Republicans vow to fight on	[US politics, US news, Iran, Barack Obama, Democrats, Republicans, World news, Israel]
Wed Sep 16 00:41:16 MSK 2015	Sport	Unique David Pocock pivotal to Wallabies' Rugby World Cup assault | John Davidson	[Australia rugby union team, Rugby World Cup 2015, Rugby World Cup, Rugby union, Australia sport, Sport]
Tue Sep 15 23:49:05 MSK 2015	Australia news	Canning's swing voters and sceptics react to Malcolm Turnbull's ascension	[Canning byelection 2015, Australian politics, Tony Abbott, Malcolm Turnbull, Labor party, Liberal party, Coalition, Anthony Albanese]
Tue Sep 15 23:29:57 MSK 2015	Society	Survey records rise in under-fives watching TV and using tablets	[Children, UK news, Society]
Tue Sep 15 23:25:29 MSK 2015	Society	Labor urges Malcolm Turnbull to keep domestic violence a top priority	[Domestic violence, Bill Shorten, Labor party, Australian politics, Australia news, Malcolm Turnbull]
Tue Sep 15 23:01:10 MSK 2015	Environment	Tuna and mackerel populations suffer catastrophic 74% decline, research shows	[Marine life, Environment, Fishing, Food, Conservation, Animals, Wildlife, World news, Oceans]
Tue Sep 15 23:01:10 MSK 2015	Environment	Shale gas fracking should go ahead in UK, says taskforce	[Fracking, UK news, Energy, Energy industry, Renewable energy, Climate change, Environment, Shale oil, Gas]
Tue Sep 15 23:00:00 MSK 2015	Crosswords	Cryptic crossword No 26,678	[Crosswords]
