Sat Aug 15 13:05:25 MSK 2015	Comment is free	Martin O'Malley proved he could steal the show in the Democratic primary | Jeb Lund	[Martin O'Malley, Hillary Clinton, Bernie Sanders, US elections 2016, Iowa, US politics, Democrats]
Sat Aug 15 00:59:02 MSK 2015	Film	Gemma Arterton: ‘If you start on me I will defend myself’	[Film, Gemma Arterton, Theatre, Stage, Musicals]
Sat Aug 15 00:52:00 MSK 2015	Stage	Manwatching at Edinburgh festival review – a frank insight into female desire	[Edinburgh festival 2015, Theatre, Stage, Culture, Edinburgh festival, Festivals, Women, Sex, Life and style]
Sat Aug 15 00:35:27 MSK 2015	World news	Kayla Mueller was raped by Isis leader before her death, say officials	[Islamic State, World news, US news]
Sat Aug 15 00:33:59 MSK 2015	Technology	Sundar Pichai: Google's rising star reaches the top (like his teacher said he would)	[Google, Technology]
Sat Aug 15 00:17:42 MSK 2015	Stage	Richard Gadd at Edinburgh festival review – uproarious high-concept comedy	[Edinburgh festival 2015, Stage, Culture, Comedy, Comedy]
Sat Aug 15 00:15:01 MSK 2015	Comment is free	Why do marketers get to decide what toys are right for our children? | Erika Nicole Kendall	[Gender, Toys, Children, Life and style, Society]
Sat Aug 15 00:00:01 MSK 2015	Guardian Sustainable Business	Businesses delivering the most coveted perk: a better commute	[Guardian sustainable business, Environment, Pollution, Technology, Technology startups, Technology, Business, Google, US news, World news]
Sat Aug 15 11:39:55 MSK 2015	Life and style	Sadie Frost turns academic to highlight lack of film production roles for women	[Sadie Frost, Film, Women, Gender, Life and style, Culture, UK news]
Sat Aug 15 11:34:10 MSK 2015	Stage	How can we keep theatre wages fair?	[Edinburgh festival 2015, Theatre, Stage, Culture, Festivals, Edinburgh festival]
Sat Aug 15 11:20:00 MSK 2015	UK news	The Farne Islands, a sanctuary for seabirds and seals, celebrate 90 years as a British jewel of conservation	[Northumberland, Birds, Animals, The National Trust, Conservation, Wildlife, Environment, UK news]
Sat Aug 15 11:17:32 MSK 2015	Education	Gap-year Britons opt to boost their CVs in English-speaking countries	[Gap years, Students, Gap year travel, Australia news, UK news]
Sat Aug 15 11:01:29 MSK 2015	UK news	VJ Day in south-east suburban London, 1945.	[UK news, London, Social history, Society]
Sat Aug 15 11:00:02 MSK 2015	Media	Fired Los Angeles Times cartoonist hits back at newspaper for siding with LAPD	[Los Angeles Times, Media, Newspapers, US press and publishing, US policing, US news, Comics and graphic novels]
Sat Aug 15 11:00:02 MSK 2015	Life and style	Turn a batch of peppers into four different meals | Get ahead	[Food & drink, Chefs]
Sat Aug 15 11:00:02 MSK 2015	Science	Queen Nefertiti dazzles the modern imagination – but why?	[Archaeology, Egypt, Books, Art and design, World news, Africa]
Sat Aug 15 11:00:02 MSK 2015	World news	Mexico's ambassador to US plucked from inner circle and raising eyebrows	[Mexico, US foreign policy, Americas, World news, US news, Obama administration]
Sat Aug 15 11:00:01 MSK 2015	Children's books	Astrosaurs: The Sun–Snatchers by Steve Cole – review	[Children and teenagers, Books, Culture, Children's books: 7 and under, Sci-fi (children and teens), Funny books (children and teens)]
Sat Aug 15 10:44:28 MSK 2015	Global development	How developing countries are paying a high price for the global mineral boom	[Global development, Mining, Environment, Mining, Business, Rio Tinto, BHP Billiton, World news]
Sat Aug 15 10:15:32 MSK 2015	Politics	Jeremy Corbyn is most popular among voters from all parties, poll suggests	[Jeremy Corbyn, Labour party leadership, Labour, Politics, UK news, Liz Kendall, Andy Burnham, Yvette Cooper, UK Independence party (Ukip), Conservatives, Opinion polls]
Sat Aug 15 10:00:02 MSK 2015	Society	Interview with a real-life vampire: why drinking blood isn't like in Hollywood	[Communities, Society, US news]
Sat Aug 15 10:00:00 MSK 2015	Books	Mia Couto: ‘I am white and African. I like to unite contradictory worlds’	[Fiction, Books, Culture, Cecil the lion, Conservation, Wildlife, Environment, Mozambique, Africa, World news]
Sat Aug 15 10:00:00 MSK 2015	Comment is free	Roots – a graphic depiction of slavery that shocked and empowered | David Lammy	[Race issues, Slavery, Fiction, Books, Culture, World news, US news]
Sat Aug 15 09:41:08 MSK 2015	Sport	New Zealand v Australia: Bledisloe Cup decider – as it happened	[Bledisloe Cup, New Zealand rugby union team, Australia rugby union team, Australia sport, Rugby union, Sport]
Sat Aug 15 09:00:21 MSK 2015	Football	NASL's split-season model, now in third year, offers unpredictable thrills	[NASL, Football, Sport, US sports, MLS]
Sat Aug 15 08:59:21 MSK 2015	Science	Was Sardinia home to the mythical civilisation of Atlantis?	[Archaeology, Science, Heritage, Philosophy, Italy]
Sat Aug 15 08:45:21 MSK 2015	Sport	The gifs that keep on giving: Conor McGregor, Barcelona and golfing genius	[Sport, Football, UFC, Extreme sports, Barcelona, MMA]
Sat Aug 15 08:30:21 MSK 2015	Football	Questions loom as USA women take victory lap with Costa Rica friendly	[USA women's football team, Football, Sport, US sports]
Sat Aug 15 08:00:23 MSK 2015	Culture	Populist: items of interest this week	[Culture, Lana Del Rey, Zac Efron, Nicolas Cage]
Sat Aug 15 08:00:23 MSK 2015	Sport	Girl, interrupted: unsinkable Vicky Duval, 19 and cancer-free, begins road back	[Tennis, Wimbledon 2014, Wimbledon, Sport, US sports, US Open tennis]
Sat Aug 15 08:00:22 MSK 2015	Music	Foals: ‘Being self-destructive brings out your best art'	[Music, Culture, Foals]
Sat Aug 15 08:00:22 MSK 2015	Technology	Windows 10: should privacy problems worry me?	[Windows 10, Technology, Microsoft, Computing]
Sat Aug 15 08:00:21 MSK 2015	Film	Trump: What’s The Deal?: a distinctly 90s takedown	[DVD and video reviews, Culture, Donald Trump]
Sat Aug 15 08:00:21 MSK 2015	Television & radio	Philip Glass is rose-tinted when reminiscing about the 70s	[Radio, Television & radio, Culture, Philip Glass, The Beatles, George Orwell, Music, Television]
Sat Aug 15 08:00:21 MSK 2015	Television & radio	The new Premier League advert: a convenient airbrushing of reality	[Advertising, Television, Television industry, Television & radio, Media, Culture, Football, Premier League, Sergio Agüero, Luis Suárez, John Terry, Sol Campbell]
Sat Aug 15 08:00:20 MSK 2015	Children's books	Love, Rosie: Where Rainbows End by Cecelia Ahern – review	[Children and teenagers, Books, Culture, Teen books, Friendship (children and teens), Teen romance (childrens and teens)]
Sat Aug 15 08:00:20 MSK 2015	US news	'I dream about it every night': what happens to Americans who film police violence?	[Walter Scott shooting, US news, Michael Brown shooting, Digital media, US policing, Citizen media, Ferguson, Race issues, Freddie Gray, Civil rights movement, Eric Garner, Social media]
Sat Aug 15 07:01:19 MSK 2015	Comment is free	Paisley really could be the UK’s third city of culture – it’s been unjustly neglected for too long	[UK city of culture, Festivals, Culture, Arts funding, Arts policy, Communities, Society, Music, Books]
Sat Aug 15 07:00:19 MSK 2015	Cities	Introducing 'treeconomics': how street trees can save our cities	[Cities, Environment, Trees and forests, Local government, Society, UK news, Wildlife, Sheffield, London, Health & wellbeing, Life and style, Pollution, Politics]
Sat Aug 15 07:00:19 MSK 2015	Teacher Network	Secret Teacher: should school holidays be shorter? I'm in favour	[Teacher Network, Education, Teaching, Schools, Teachers' workload, Health & wellbeing, Primary schools, Secondary schools, Sixth form, Mental health]
Sat Aug 15 07:00:19 MSK 2015	Life and style	The weekend cook: Thomasina Miers’ recipes for roast chicken Marseille-style, and lime and ginger posset	[Food & drink, Life and style, Chicken, Meat, French food and drink, Main course, Vegetables, Dessert, Fruit, Baking]
Sat Aug 15 07:00:19 MSK 2015	Television & radio	Mountain Goats review – ‘Who are these people, who’ll laugh at anything?’	[Television & radio, Television, Culture, BBC1, Comedy, Comedy]
Sat Aug 15 06:50:19 MSK 2015	Guardian Small Business Network	Small business in the spotlight ... Pubs on Wheels	[Guardian Small Business Network, Business, Small business, Entrepreneurs, Pubs, Food & drink]
Sat Aug 15 06:24:47 MSK 2015	Australia news	Tony Abbott says Liberal party must become less 'blokey' but rules out quota	[Tony Abbott, Women, Australian politics, Australia news, Liberal party, Adelaide, Labor party, Bill Shorten, Coalition]
Sat Aug 15 06:20:53 MSK 2015	Sport	Diamonds set up dream Netball World Cup final clash | Erin Delahunty	[Netball, Australia sport, Sport]
Sat Aug 15 06:00:22 MSK 2015	Money	Dear Jeremy – your work issues solved	[Work & careers, Money]
Sat Aug 15 06:00:21 MSK 2015	Money	How do I deal with my husband's credit card black hole?	[Money, Credit cards, Borrowing & debt]
Sat Aug 15 06:00:21 MSK 2015	Money	‘Disruption’, the buzzword as I join the City scambusters	[Scams, Consumer affairs, Money]
Sat Aug 15 06:00:21 MSK 2015	Travel	Inn on the Square, Keswick, Cumbria: hotel review	[Lake District holidays, Hotels, Food and drink, Travel, United Kingdom holidays, England holidays]
Sat Aug 15 06:00:20 MSK 2015	Money	British Gas broke into my home to change the meter – but I’m not even a customer	[Energy bills, Money, Consumer affairs, Consumer rights, Household bills]
Sat Aug 15 06:00:20 MSK 2015	Travel	Family fun: kids attractions here for one summer only	[Family holidays, Travel, England holidays, Wales holidays, United Kingdom holidays, Europe, Scotland holidays]
Sat Aug 15 06:00:19 MSK 2015	Money	Frozen pensions: why I believe the rules are unfair	[Pensions, Money, Retirement planning, Family finances, Moving overseas, Expat finance, Keith Vaz, Politics, UK news]
Sat Aug 15 06:00:18 MSK 2015	Travel	The great Eastern European road trip, part two: road trip across Albania	[Albania, Road trips, Europe, Food and drink, Travel, Bed and breakfasts]
Sat Aug 15 06:00:18 MSK 2015	Money	Hope for expats in UK pensions ‘lottery’	[Pensions, Moving overseas, Retirement planning, Expat finance, Family finances, Money, UK news]
Sat Aug 15 05:59:17 MSK 2015	Money	‘I blocked a bailiff – and paid the price’	[Consumer rights, Consumer affairs, Borrowing & debt, Work & careers, Money, Police, UK news]
Sat Aug 15 05:53:22 MSK 2015	Sport	Jamaica v Australia: Netball World Cup semi-final – as it happened	[Netball, Australia sport, Sport]
Sat Aug 15 05:45:17 MSK 2015	Life and style	Martin’s gone from sizzling hot to icy cold – what’s going on?	[Family, Online dating, Relationships, Dating]
Sat Aug 15 05:45:17 MSK 2015	Life and style	Avoid the competitive parent trap	[Family, Life and style, Parents and parenting, Children, Society, Education, Schools]
Sat Aug 15 05:30:17 MSK 2015	Life and style	Fishing casts its spell on my girl	[Family, Life and style, Parents and parenting, Fishing, Sport]
Sat Aug 15 05:30:17 MSK 2015	Life and style	We’re at a wedding and I’m seated at the baby table!	[Family, Parents and parenting, Weddings, Life and style]
Sat Aug 15 05:30:17 MSK 2015	Books	PostCapitalism by Paul Mason review – a worthy successor to Marx?	[Economics, Politics, Books, Culture]
Sat Aug 15 05:29:17 MSK 2015	Life and style	Family life: Driving a pretend train on a Guernsey beach, I Still Pray by Kasey Chambers and Grandma’s famous parkin	[Family, Life and style, Photography, Art and design, Music, Culture, Food & drink]
Sat Aug 15 05:15:17 MSK 2015	Life and style	Jesus saved my mother	[Family, Life and style, Philosophy, Christianity, Sikhism, Parents and parenting]
Sat Aug 15 05:15:16 MSK 2015	Life and style	A letter to … the friend who raped me	[Family, Rape]
Sat Aug 15 05:00:22 MSK 2015	Life and style	Blind date	[Dating, Relationships, Life and style]
Sat Aug 15 05:00:22 MSK 2015	News	The Weekend quiz	[Life and style]
Sat Aug 15 05:00:21 MSK 2015	Life and style	Tim Dowling: lost in Greece	[Family, Life and style, Greece holidays]
Sat Aug 15 05:00:21 MSK 2015	Life and style	Is it worth it? Edge Cycle	[Fitness, Health & wellbeing, Life and style, Yoga, Cycling]
Sat Aug 15 05:00:20 MSK 2015	Fashion	From pyjamas to ironing: what’s hot and what’s not this week	[Fashion, Life and style]
Sat Aug 15 05:00:20 MSK 2015	Life and style	Gardens: what to do this week	[Gardens, Life and style]
Sat Aug 15 05:00:20 MSK 2015	Life and style	Sophie Heawood: my life as a trainwreck	[Life and style]
Sat Aug 15 05:00:19 MSK 2015	Life and style	Breakfast of champions: Frank Lloyd Wright’s porridge with cream and butter	[Breakfast, Life and style, Food & drink]
Sat Aug 15 05:00:19 MSK 2015	Life and style	Crush of the week: Jennifer Aniston	[Jennifer Aniston, Friends, Comedy, Culture, Television, Comedy]
Sat Aug 15 05:00:19 MSK 2015	Life and style	Modern tribes: the life peer	[House of Lords, Politics]
Sat Aug 15 05:00:19 MSK 2015	Life and style	A zingy blackberry cheesecake recipe | Ruby Tandoh	[Baking, Food & drink, Life and style]
Sat Aug 15 05:00:19 MSK 2015	Life and style	Readers’ recipe swap: honey | Eve O’Sullivan	[Food & drink, Life and style]
Sat Aug 15 05:00:18 MSK 2015	Life and style	Alys Fowler: foraging at the seaside	[Gardening advice, Foraging, Gardens, Life and style]
Sat Aug 15 05:00:18 MSK 2015	Life and style	How does your garden grow? Kate Savill, Beeston, Nottingham	[Gardens, Life and style]
Sat Aug 15 05:00:17 MSK 2015	Fashion	Beauty: summer lipsticks	[Lipstick, Makeup, Beauty, Fashion, Life and style]
Sat Aug 15 05:00:17 MSK 2015	Life and style	Ask Alys: my comfrey plants have rust	[Gardening advice, Gardens, Life and style]
Sat Aug 15 05:00:17 MSK 2015	Music	Cerys Matthews: music for barbecues	[Music, Barbecue, Culture, Django Reinhardt]
Sat Aug 15 05:00:17 MSK 2015	Life and style	What I’m really thinking: the student adviser	[Higher education, Education]
Sat Aug 15 05:00:17 MSK 2015	Life and style	Your view	[]
Sat Aug 15 05:00:16 MSK 2015	Technology	On the road: VW Polo GTi – car review	[Motoring, Technology, Volkswagen (VW)]
Sat Aug 15 04:59:16 MSK 2015	Life and style	Who do you think you are? Now you can find out with a do-it-yourself DNA test	[Family, Life and style, Parents and parenting, Science]
Sat Aug 15 04:30:16 MSK 2015	Environment	Insects that may come to those who wait	[Environment, Butterflies, New Forest, Rural affairs, UK news, Insects, Wildlife, Summer]
Sat Aug 15 04:05:25 MSK 2015	US news	Hillary Clinton mocks email scandal as Democrat hopefuls meet the faithful	[Hillary Clinton, US news]
Sat Aug 15 02:26:41 MSK 2015	World news	Unlocking Maori identity: keeping New Zealand’s indigenous people out of jail	[New Zealand, Indigenous peoples, Asia Pacific]
Sat Aug 15 01:44:15 MSK 2015	Environment	Climate Change Authority head says Coalition's $600bn carbon bill claim 'weird'	[Climate change, Australia news, Australian politics, Greg Hunt, Coalition, Labor party, Greenhouse gas emissions, Carbon tax, Australian economy, Environment]
Sat Aug 15 01:40:27 MSK 2015	Sport	Michael Sam says he's stepping away from football citing 'mental health'	[Michael Sam, CFL (Canadian Football League), Sport, NFL, US sports]
Sat Aug 15 00:16:59 MSK 2015	US news	Missouri police officer brags about spending 'annual Michael Brown bonus'	[US policing, Ferguson, Michael Brown shooting, US news, World news]
Sat Aug 15 00:10:44 MSK 2015	Australia news	Victoria’s royal commission into family violence to extend hearings	[Royal commission into family violence (Victoria), Victoria, Melbourne, Australia news, Australian police and policing, Crime - Australia]
Fri Aug 14 23:55:00 MSK 2015	Sport	Jordan Spieth makes shockwaves at US PGA before lightning stops play	[Rory McIlroy, US PGA Championship 2015, Jordan Spieth, Golf, Sport, US sports]
Fri Aug 14 23:51:12 MSK 2015	US news	US launches secret bid to stop release of hunger-striking Guantánamo detainee	[Guantánamo Bay, US news, Obama administration, Barack Obama, World news, US national security]
Fri Aug 14 23:30:10 MSK 2015	Sport	Steve Smith calls on Australian public to back team after Ashes defeat	[Australia cricket team, Steve Smith, Michael Clarke, Ashes 2015, The Ashes, Cricket, Australia sport, Sport]
Fri Aug 14 23:07:35 MSK 2015	Sport	Bradley Wiggins’ return to track continues with stunning performance	[Sir Bradley Wiggins, Cycling, Sport]
Fri Aug 14 23:03:45 MSK 2015	Sport	US PGA Championship 2015: second round – as it happened	[US PGA, Golf, US sports, Sport]
Fri Aug 14 23:01:09 MSK 2015	Education	David Cameron: I want every school to become an academy	[Schools, Academies, Education, David Cameron, Education policy, Politics, Free schools, Conservatives, Labour, UK news]
Fri Aug 14 23:01:09 MSK 2015	Sport	Talking Horses: Saturday’s best bets plus the latest racing news	[Horse racing, Sport]
Fri Aug 14 23:01:09 MSK 2015	Media	Katie Derham becomes fifth celebrity to join Strictly Come Dancing	[BBC1, Media, Strictly Come Dancing, Television, Television & radio, BBC, Culture, Entertainment, Reality TV]
Fri Aug 14 23:00:09 MSK 2015	Australia news	Federal police unable to track all child sex offenders who go to south-east Asia	[Australian federal police, Australian police and policing, Crime - Australia, Australia news, Asia Pacific, Sex offenders register]
Fri Aug 14 23:00:00 MSK 2015	Crosswords	Quick crossword No 14,124	[Crosswords]
Fri Aug 14 23:00:00 MSK 2015	Crosswords	Prize crossword No 26,651	[Crosswords]
Fri Aug 14 22:51:55 MSK 2015	Football	Pedro rethinks Manchester United move over fears about Louis van Gaal	[Louis van Gaal, Manchester United, Barcelona, Football, Transfer window, Sport]
Fri Aug 14 22:39:11 MSK 2015	Business	Eurozone finance ministers agree to third Greek bailout - as it happened	[Eurozone crisis, Business, Greece, Alexis Tsipras, Europe, Economics, Euro, France, Germany, European monetary union]
Fri Aug 14 22:31:12 MSK 2015	Football	Athletic Bilbao 4-0 Barcelona | Super Cup first-leg match report	[La Liga, Barcelona, Athletic Bilbao, Football, Sport]
Fri Aug 14 22:24:07 MSK 2015	US news	BuzzFeed founder says unionizing would not be 'great' for company	[US unions, BuzzFeed, Digital media, Media, Jonah Peretti, US news]
Fri Aug 14 22:20:05 MSK 2015	Business	Greece secures third bailout after Germany backs down on opposition	[Eurozone crisis, Greece, Germany, World news, Financial sector, European monetary union, European Union, Euro, Business, Europe, Economics, Currencies, Banking, European Central Bank, Alexis Tsipras]
Fri Aug 14 22:11:39 MSK 2015	Football	Manchester United manager stuns Aston Villa with his frontline shuffle | Jamie Jackson	[Manchester United, Aston Villa, Louis van Gaal, Football, Sport]
Fri Aug 14 21:43:14 MSK 2015	Law	Bush torture comments worry human rights groups over possible resurgence	[Torture, US politics, US news, Human rights, US elections 2016, Jeb Bush, Donald Trump]
Fri Aug 14 21:37:38 MSK 2015	US news	US government investigated journalists 14 times during 2014	[Obama administration, US press and publishing, US justice system, US news, Media, New York Times, Newspapers]
Fri Aug 14 21:30:08 MSK 2015	Football	Major overhaul would harm Everton’s identity, warns Roberto Martínez	[Everton, Roberto Martínez, Football, Sport]
Fri Aug 14 21:30:08 MSK 2015	Football	Steve McClaren lauds Garry Monk but warns Swansea manager off England	[Garry Monk, Newcastle United, Swansea City, Football, Sport]
Fri Aug 14 21:30:07 MSK 2015	Football	Everton’s Arouna Koné: ‘I promised myself I’d show the fans what I can do’	[Everton, Football, Sport]
Fri Aug 14 21:30:07 MSK 2015	Football	Mauricio Pochettino puts faith in Hugo Lloris as Tottenham captain	[Tottenham Hotspur, Mauricio Pochettino, Manchester United, Football, Sport]
Fri Aug 14 21:30:07 MSK 2015	Football	Danny Welbeck’s long lay-off from Arsenal leaves Arsène Wenger baffled	[Arsenal, Danny Welbeck, Arsène Wenger, Football, Sport]
Fri Aug 14 21:30:07 MSK 2015	Football	Dick Advocaat urges Yann M’Vila to stay away from trouble at Sunderland	[Sunderland, Football, Sport]
Fri Aug 14 21:30:07 MSK 2015	Football	Manuel Pellegrini says Raheem Sterling can improve at Manchester City	[Manchester City, Raheem Sterling, Manuel Pellegrini, Chelsea, Football, Sport]
Fri Aug 14 21:08:28 MSK 2015	Sport	Leeds 25-18 Wigan | Super League Super 8s match report	[Super League XX, Leeds Rhinos, Wigan Warriors, Super League, Rugby league, Sport]
Fri Aug 14 21:06:41 MSK 2015	US news	Jeb Bush visits Iowa state fair looking for a larger bite of Republican caucusgoers	[Jeb Bush, Iowa, US elections 2016, US politics, US news, Republicans, Democrats, George Bush]
Fri Aug 14 21:00:06 MSK 2015	Sport	Andy Farrell backs Sam Burgess to impress for England against France	[Sam Burgess, England rugby union team, Rugby union, Sport]
Fri Aug 14 20:58:59 MSK 2015	Football	Aston Villa 0-1 Manchester United | Premier League match report	[Premier League, Aston Villa, Manchester United, Football, Sport]
Fri Aug 14 20:48:17 MSK 2015	US news	High gun ownership linked to high rate of police officer deaths, study shows	[US news, Gun crime, US policing]
Fri Aug 14 20:46:45 MSK 2015	Football	Aston Villa v Manchester United: Premier League – as it happened	[Premier League, Aston Villa, Manchester United, Football, Sport]
Fri Aug 14 20:43:29 MSK 2015	Music	Potus playlist: Barack Obama shares his favorite summer tracks on Spotify	[Music, Barack Obama, Pop and rock, Soul, Sly Stone, Bob Dylan, Erykah Badu, Aretha Franklin, Beyoncé, John Legend, Stevie Wonder, Talib Kweli, Bob Marley, Culture, Spotify, US news]
Fri Aug 14 20:29:00 MSK 2015	Football	West Ham fans told they must leave Boleyn Ground - but I don’t want to	[West Ham United, Football, Sport]
Fri Aug 14 20:00:05 MSK 2015	News	Corrections and clarifications	[]
Fri Aug 14 20:00:05 MSK 2015	Global development	Surfers paradise: Cody Simpson among humanitarian social media 'donors'	[Global development, Humanitarian response, Refugees, United Nations, Syria, Middle East and North Africa, World news]
Fri Aug 14 20:00:04 MSK 2015	Sport	Jordan Spieth says he will not feel fatigue as he chases third major	[Jordan Spieth, Rory McIlroy, US PGA Championship 2015, Golf, Sport, US sports]
Fri Aug 14 19:31:52 MSK 2015	World news	From hostage crisis to nuclear deal: prisoner and captor look back at the Iran-US cold war	[Iran, Middle East and North Africa, US news, World news, Iran's nuclear programme, The Iranian revolution, Mahmoud Ahmadinejad, Hassan Rouhani]
Fri Aug 14 19:31:52 MSK 2015	US news	Same-sex marriage ruling backlash losing steam as judges uphold the law	[Same-sex marriage (US), US news, LGBT rights, Kentucky, Texas, Ohio]
Fri Aug 14 19:23:02 MSK 2015	US news	Two children camping at Yosemite killed after tree limb falls on tent	[California, National parks, US news]
Fri Aug 14 19:21:38 MSK 2015	Politics	Gordon Brown to speak on Labour leadership as poll gives boost to Corbyn	[Labour party leadership, Jeremy Corbyn, Labour, Politics, UK news, Gordon Brown, Ed Miliband]
Fri Aug 14 19:20:48 MSK 2015	Television & radio	Sesame Street at HBO: do the pros outweigh the cons?	[Sesame Street, HBO, Television, Children's TV, Culture, Television & radio]
Fri Aug 14 19:04:06 MSK 2015	Politics	The Labour party stands at a crossroads | Letters	[Labour party leadership, Labour, Politics, UK news, Jeremy Corbyn, Yvette Cooper, Andy Burnham, Tony Blair]
Fri Aug 14 19:03:59 MSK 2015	Comment is free	Reggie Perrin – a suburban everyman who captured the essence of his era | Jonathan Freedland	[Comedy, Comedy, Television, Culture, UK news]
Fri Aug 14 18:55:18 MSK 2015	Environment	McDonald's, Wrigley and others call on government to fight £1bn litter problem	[Environment, UK news, McDonald's, Business, Food & drink industry, Waste, Communities, Society]
Fri Aug 14 18:54:22 MSK 2015	Comment is free	The Janner hearings will be awful but the case must proceed | Hugh Muir	[Law, Child protection, Children, Social care, Society, Crime, UK news]
Fri Aug 14 18:53:42 MSK 2015	Business	Sainsbury's cuts short British Athletics sponsorship deal	[J Sainsbury, Supermarkets, UK news, Athletics, Business, Retail industry, Sport]
Fri Aug 14 18:50:04 MSK 2015	Politics	The Jeremy Corbyn effect reflects failures on the left | Letters	[Labour party leadership, Labour, Politics, Jeremy Corbyn, Austerity, Economics, Gordon Brown, Scottish National party (SNP), UK news]
Fri Aug 14 18:47:18 MSK 2015	Politics	Labour party leadership: political dreams and nightmares | Letters	[Labour, Labour party leadership, Politics, Tony Blair, Jeremy Corbyn, Scotland, UK news]
Fri Aug 14 18:43:26 MSK 2015	Global	Taking pizzas to Pizzaborough | Brief letters	[]
Fri Aug 14 18:34:38 MSK 2015	Comment is free	The Guardian view on global currencies: it’s the economy, stupid | Editorial	[Global economy, Chinese economy, China, Business, Asia Pacific, World news, Dollar, Currencies, US news, US politics, Economics, Greece, Euro, Euro, Economic policy, Yuan]
Fri Aug 14 18:31:45 MSK 2015	World news	UN employed more than 4,000 unpaid interns in 2012-13, figures show	[United Nations, World news, Europe, Careers, Work & careers, Switzerland]
Fri Aug 14 18:31:10 MSK 2015	Sport	Leonard Barden on Chess	[Chess, Sport]
Fri Aug 14 18:23:05 MSK 2015	Comment is free	The Guardian view on Hamlet: time to cool the hysteria | Editorial	[Theatre, Stage, Benedict Cumberbatch, Culture, Barbican, William Shakespeare]
Fri Aug 14 18:19:16 MSK 2015	UK news	Dungeness: where the wild west meets the post-apocalyptic	[British identity and society, Kent holidays, UK news, Property, Money, Society, Derek Jarman]
