Mon Sep 07 11:05:28 MSK 2015	Technology	Meet Mark, the crazy genius who designed an airplane while drunk	[Engineering, Twitter, Technology, Internet, Aeronautics, Science, Mathematics]
Mon Sep 07 11:04:47 MSK 2015	Cities	'I’ve known this tree all my life': your photos of urban trees around the world	[Cities, Environment, Trees and forests]
Mon Sep 07 11:03:32 MSK 2015	World news	The UN at 70: does the United Nations have a future?	[United Nations, Ebola, Ban Ki-moon, World news]
Mon Sep 07 11:01:57 MSK 2015	Music	The Spooky Men’s Chorale – silly, thoughtful and in perfect harmony	[Folk music, World music, Music, Culture]
Mon Sep 07 11:00:08 MSK 2015	Global development	Nigeria's staunch belief in new president Muhammadu Buhari being sorely tested	[Governance, Global development, Muhammadu Buhari, Nigeria, Africa, Boko Haram]
Mon Sep 07 11:00:07 MSK 2015	US news	Shop Jeen: teen site conquers social media but faces customer backlash	[Los Angeles, Fashion, Life and style, US news, Social media, Digital media, Media, Internet, Technology]
Mon Sep 07 11:00:06 MSK 2015	Money	Why is America so afraid to take a vacation?	[US work & careers, Money, US news]
Mon Sep 07 11:00:05 MSK 2015	US news	California police killings database reveals 'clear racial disparities'	[US policing, US news, California, Texas, US crime, Gun crime, Race issues, World news]
Mon Sep 07 11:00:05 MSK 2015	Television & radio	Michaela Strachan’s favourite TV	[Television, Television & radio, Culture]
Mon Sep 07 11:00:05 MSK 2015	Children's books	Triangle At Rhodes by Agatha Christie – review	[Children and teenagers, Books, Culture, Teen books, Adventure (children and teens), Historical fiction (children and teens), Agatha Christie]
Mon Sep 07 10:59:14 MSK 2015	World news	70 years and half a trillion dollars later: what has the UN achieved?	[United Nations, Dag Hammarskjöld, World news, Ban Ki-moon]
Mon Sep 07 10:55:51 MSK 2015	Public Leaders Network	Slash police budgets – it will stop officers doing other people's jobs	[Public Leaders Network, Criminal justice, Efficiency and risk, Collaboration, Police, Crime, UK criminal justice, Society, Public sector cuts, Public services policy, Public finance, Law, Politics]
Mon Sep 07 10:53:29 MSK 2015	World news	What's the best bit of the UN? No 2: the ICC	[United Nations, International criminal court, International criminal justice, World news]
Mon Sep 07 10:51:32 MSK 2015	World news	What's the best bit of the UN? No 1: the UNHCR	[Refugees, Africa, World news, United Nations]
Mon Sep 07 10:46:48 MSK 2015	Australia news	#LightTheDark: share your photos and videos	[Australian immigration and asylum, Australia news, Refugees, Australian politics, Sydney, Melbourne, Adelaide, Perth]
Mon Sep 07 10:45:49 MSK 2015	Community	#OpenComics: untold stories – your GuardianWitness contributions	[]
Mon Sep 07 10:45:04 MSK 2015	Comment is free	Rentboy.com was closed because the government thinks I need to be saved | David	[Sex trade, Sexuality, Sex, Prostitution, Gender]
Mon Sep 07 10:44:07 MSK 2015	Media Network	What will it take to keep London number one in Europe for foreign investors?	[Media & Tech Network, Technology sector, Technology startups]
Mon Sep 07 10:34:34 MSK 2015	Technology	Spotify data reveals boom in sleep and relaxation albums	[Spotify, Digital music and audio, Internet, Music industry, Technology, Sleep, Health & wellbeing]
Mon Sep 07 10:31:13 MSK 2015	World news	Syrian refugees in Hungary: 'This is the so-called developed Europe?'	[Hungary, Refugees, Migration, Europe, World news, Syria, Middle East and North Africa, Serbia]
Mon Sep 07 10:29:30 MSK 2015	Children's books	Laura Carlin wins the Bratislava children's books illustration award 2015	[Children and teenagers, Books, Culture, Awards and prizes, Illustration, Design, Children's books: 7 and under, Picture books, Children's books: 8-12 years, Art and design, Ted Hughes]
Mon Sep 07 10:28:19 MSK 2015	Technology	Hackers can trick self-driving cars into taking evasive action	[Hacking, Self-driving cars, Data and computer security, Technology, Automotive industry, Business]
Mon Sep 07 10:27:23 MSK 2015	Music	John Wilson Orchestra review – magnificently showcasing Bernstein's variety and creativity	[BBC Proms 2015, Classical music, Culture, Music]
Mon Sep 07 10:25:44 MSK 2015	Media	Strictly Come Dancing returns with record audience of nearly 9 million	[TV ratings, Media, Television industry, BBC1, BBC, ITV channel, Simon Cowell, ITV plc, Strictly Come Dancing, Entertainment, Television, The X Factor]
Mon Sep 07 10:25:33 MSK 2015	Film	Meryl Streep's equal opportunities plea virtually ignored by Congress	[Film, Meryl Streep, Telluride film festival 2015, Suffragette, Culture, Abi Morgan, US political lobbying, Stage, US news, World news, Feminism, Women, Life and style, US Congress, Telluride film festival]
Mon Sep 07 10:20:27 MSK 2015	World news	Pakistani army claims it has killed three militants using its Burraq drone	[Pakistan, Drones (military), South and Central Asia, World news]
Mon Sep 07 10:07:04 MSK 2015	Media	Tony Hall: 'inevitable' that BBC services will have to be closed or cut	[BBC, Tony Hall, Television industry, Radio industry, Media, UK news]
Mon Sep 07 10:01:12 MSK 2015	Life and style	Lest we forget: memorising is useful | Katharine Whitehorn	[Memory, Life and style]
Mon Sep 07 10:00:04 MSK 2015	Science	Peer review, preprints and the speed of science	[Peer review and scientific publishing, Science, Research]
Mon Sep 07 09:56:11 MSK 2015	World news	France considers Isis strikes as Hollande calls for engagement on refugee crisis	[France, Islamic State, Europe, World news, Syria, François Hollande, UK news, European Union, Middle East and North Africa, Refugees, Migration, Migration and development, Global development]
Mon Sep 07 09:55:20 MSK 2015	UK news	What mayors say matters less than what they do	[UK news, David Lammy, Politics, London politics, London, Diane Abbott, Boris Johnson, Ken Livingstone, Zac Goldsmith, Tessa Jowell, Air transport, World news, Mayoral elections, Local government, Local politics, Society]
Mon Sep 07 09:52:31 MSK 2015	World news	UN security council is failing Syria, Ban Ki-moon admits	[United Nations, Ban Ki-moon, World news, Syria, Middle East and North Africa, Russia, China]
Mon Sep 07 09:44:15 MSK 2015	Media	Tony Hall's speech on his future vision for the BBC - full text	[BBC, Tony Hall, Television industry, Radio industry, Media, UK news]
Mon Sep 07 09:44:05 MSK 2015	Politics	Labour leadership campaign enters final stage with half of members yet to vote	[Jeremy Corbyn, UK news, Labour party leadership, Yvette Cooper, Andy Burnham, Liz Kendall, Labour, Politics, Tom Watson]
Mon Sep 07 09:32:43 MSK 2015	Music	How to put on a mega-gig: the insurer’s story	[Pop and rock, Music, Culture]
Mon Sep 07 09:30:05 MSK 2015	Football	Harry Kane shows the way as walking football’s popularity takes off | Gregg Bakowski	[Football, Sport, Alan Shearer, Fabrice Muamba]
Mon Sep 07 09:30:04 MSK 2015	Media Network	What will the privacy and security landscape look like in 2025?	[Media & Tech Network, Cybercrime, Privacy, Technology, Internet, Business, Hacking, Internet of things]
Mon Sep 07 09:28:36 MSK 2015	Media	Lady Chatterley’s Lover adaptation watched by nearly 5 million	[TV ratings, Media, Television industry, BBC1, ITV channel, BBC, ITV plc]
Mon Sep 07 09:24:30 MSK 2015	Healthcare Professionals Network	Moving to Canada to work as a GP was the best decision I've ever made	[Healthcare Network, GPs and primary care, Work practices, Workforce, GPs, Doctors, Health, NHS, Society]
Mon Sep 07 09:16:56 MSK 2015	Stage	Immersive theatre production of The Goonies planned by film's director	[Stage, Theatre, Immersive theatre, Off-Broadway, Culture, Film]
Mon Sep 07 09:15:24 MSK 2015	Technology	Fiat Chrysler recalls 8,000 more Jeeps over wireless hacking	[Technology, Jeep, Hacking, Data and computer security, Business, Automotive industry, Fiat, Chrysler]
Mon Sep 07 09:14:25 MSK 2015	Media	Open BBC will display 'excellence without arrogance', says Tony Hall	[BBC, Tony Hall, BBC licence fee, Television industry, Radio industry, Media, UK news]
Mon Sep 07 09:07:46 MSK 2015	Sport	Rugby World Cup: talking points from the latest warm-up matches	[Rugby World Cup 2015, Rugby World Cup, Rugby union, Wales rugby union team, Ireland rugby union team, England rugby union team, Italy rugby union team, France rugby union team, Scotland rugby union team, USA rugby union team, Australia rugby union team, Australia sport, US sports, Sport, Samoa rugby union team, Argentina rugby union team, Georgia rugby union team]
Mon Sep 07 09:05:31 MSK 2015	Television & radio	If You Are the One: call for Australian lonely hearts on Chinese dating show	[Reality TV, Television, Television & radio, China, Australia news, Culture, Relationships, SBS]
Mon Sep 07 09:04:06 MSK 2015	Cities	Honolulu solves traffic – with protected bike lanes	[Cities, Hawaii, US news, Cycling, Life and style, Housing, Architecture, Los Angeles, Ghana, Culture, Art and design, World news]
Mon Sep 07 09:00:06 MSK 2015	Sport	The Didier Drogba era is officially under way in Montreal	[MLS, San Jose Earthquakes, Philadelphia Union, US sports, Sport, Football, Didier Drogba, Montreal Impact, FC Dallas, Seattle Sounders, New England Revolution]
Mon Sep 07 09:00:05 MSK 2015	Sport	AFC North preview: on putting your fate in the hands of Andy Dalton	[NFL, Pittsburgh Steelers, Cincinnati Bengals, Cleveland Browns, Baltimore Ravens, US sports, Sport]
Mon Sep 07 09:00:04 MSK 2015	Sport	How Matt Harvey caused the destruction of Citi Field by an insane supervillain	[New York Mets, Baseball, MLB, US sports, Sport]
Mon Sep 07 09:00:02 MSK 2015	Environment	What Emma Thompson got right and wrong on climate change | Dana Nuccitelli	[Climate change, Environment, Climate change scepticism, Climate change, Science, Emma Thompson]
Mon Sep 07 08:54:08 MSK 2015	Music	Ornstein: Piano Quintet; Quartet No 2 CD review – repeated rhythmic passages end in monotony	[Classical music, Music, Culture]
Mon Sep 07 08:49:57 MSK 2015	Australia news	Canning byelection: Labor launches broadside with pledge to back WA shipbuilders	[Canning byelection 2015, Western Australia, Liberal party, Labor party, Western Australian politics, Australian defence force, Australian politics, Australia news, Perth, South Australia, Coalition]
Mon Sep 07 08:44:37 MSK 2015	Books	New Zealand bans award-winning teenage novel after outcry from Christian group	[Books, Fiction, New Zealand, Censorship, Asia Pacific, Culture, World news]
Mon Sep 07 08:38:16 MSK 2015	Comment is free	There’s nothing good about the rise in zero-hours contracts – ban them now | Peter Fleming	[Zero-hours contracts, Business, UK news, Poverty, Social exclusion, Society, Work & careers, Money]
Mon Sep 07 08:28:57 MSK 2015	Comment is free	M.anifest: Art may not feed us but to be young, restless and creative is still a joy | M.anifest	[Ghana, Africa, World news, Music, Culture]
Mon Sep 07 08:24:23 MSK 2015	Children's books	Why young people need to talk about organ donation	[Children and teenagers, Books, Culture, Teen books, Children's books: 8-12 years, Organ donation, Health, Death and dying, Children]
Mon Sep 07 08:23:59 MSK 2015	World news	David Cameron to unveil UK response to refugee crisis before parliament	[Refugees, Migration, David Cameron, Politics, UK news, World news]
Mon Sep 07 08:22:34 MSK 2015	Music	Images of Radiohead in the studio emerge	[Radiohead, Music, Culture, Pop and rock, Indie]
Mon Sep 07 08:18:59 MSK 2015	Football	Football transfer rumours: Raphael Varane to Manchester United?	[Football, Sport]
Mon Sep 07 08:18:22 MSK 2015	Media	Refugee crisis: national newspapers start to rattle the sabres	[Media, Syria, Refugees, David Cameron, Politics, George Osborne, Jeremy Corbyn, Andy Burnham, Yvette Cooper, Liz Kendall, National newspapers, Newspapers, The Guardian, The Independent, The Times, Daily Telegraph, Daily Mail, Daily Express, The Sun, Daily Mirror, Hungary, European Union, Bashar al-Assad, UK news, Europe, World news]
Mon Sep 07 08:04:46 MSK 2015	Film	War Room fights its way to top of US box office	[Film, Culture, Straight Outta Compton, Robert Redford, Nick Nolte, Mission: Impossible - Rogue Nation, Tom Cruise, Action and adventure, Animation, US news, Film industry, Business, World news]
Mon Sep 07 08:00:01 MSK 2015	Film	In Cold Blood: why isn’t the movie of Capote’s bestseller a masterpiece?	[Film, Culture, Truman Capote]
Mon Sep 07 08:00:01 MSK 2015	Children's books	We Were Liars by E. Lockhart – review	[Children and teenagers, Books, Culture, Teen books, Friendship (children and teens), Teen romance (childrens and teens)]
Mon Sep 07 08:00:01 MSK 2015	Music	Little Simz: ‘I’m not a UK female MC, I’m an artist'	[Music, Culture, Rap, Hip-hop]
Mon Sep 07 07:59:01 MSK 2015	Television & radio	Catch-up TV guide: from Limmy to The Scandalous Lady W	[Television, Television & radio, Culture]
Mon Sep 07 07:59:01 MSK 2015	Film	In Cold Blood: why isn’t the movie of Capote’s best-seller a masterpiece?	[Film, Truman Capote, Culture]
