Sun Aug 02 07:00:10 MSK 2015	Voluntary Sector Network	We hospice CEOs shouldn't stay silent – the sector must accept assisted dying	[Voluntary Sector Network, Voluntary sector network blog, Social Care Network, Charities, Society, Voluntary sector, Assisted dying, Law, Work practices, Work practices]
Sun Aug 02 07:00:09 MSK 2015	Stage	Edinburgh art festival 2015 review – a great year for sculpture	[Edinburgh festival 2015, Edinburgh festival, Sculpture, Art, Art and design, Exhibitions, Culture]
Sun Aug 02 07:00:09 MSK 2015	Music	Three Choirs festival; Saul – review	[Classical music, Music, Culture]
Sun Aug 02 07:00:09 MSK 2015	Film	Beyond the Reach review – a hunting trip turns sour and silly	[Thriller, Film, Culture, Michael Douglas]
Sun Aug 02 07:00:08 MSK 2015	Music	Tami Neilson: Dynamite! review – a 50s-friendly blast	[Country, Music, Culture]
Sun Aug 02 07:00:08 MSK 2015	World news	Hiroshima’s fate, 70 years ago this week, must not be forgotten	[Nuclear weapons, World news, Second world war, Foreign policy, Politics, Books, Culture]
Sun Aug 02 07:00:07 MSK 2015	Music	Lianne La Havas: Blood review – from classy soul-jazz to sultry rock	[Lianne La Havas, Soul, Music, Culture]
Sun Aug 02 07:00:07 MSK 2015	Film	Hot Pursuit review – flat female buddy movie	[Hot Pursuit, Comedy, Reese Witherspoon, Film, Culture]
Sun Aug 02 07:00:07 MSK 2015	Film	Man With a Movie Camera review – pure cinema, still unparalleled	[Man With a Movie Camera, Documentary, World cinema, Film, Culture]
Sun Aug 02 07:00:07 MSK 2015	Music	Prokofiev Symphonies 4 (Op 47) & 5 CD review – shadows and sparks	[Classical music, Music, Culture]
Sun Aug 02 06:59:07 MSK 2015	Film	Cub review – visually stylish Belgian chiller	[Horror, World cinema, Film, Culture]
Sun Aug 02 06:59:07 MSK 2015	Film	Iris review – vibrant sartorial documentary	[Documentary, Albert Maysles, Film, Fashion, Culture]
Sun Aug 02 06:59:07 MSK 2015	Music	Jacob Fischer: In New York City review – great virtuosity and harmonic awareness	[Jazz, Music, Culture]
Sun Aug 02 06:59:06 MSK 2015	Stage	Confusions review – tour de force of ensemble playing	[Theatre, Stage, Culture, Alan Ayckbourn]
Sun Aug 02 06:30:06 MSK 2015	Music	Albert Hammond Jr: Momentary Masters review – wears its influences on its sleeve	[Pop and rock, Indie, The Strokes, Music, Culture]
Sun Aug 02 06:01:05 MSK 2015	Money	Don’t try to wing it with an airmiles flight – plan ahead for the best deal	[Credit cards, Consumer affairs, Airline industry, British Airways, Money, Travel, Business]
Sun Aug 02 06:00:10 MSK 2015	Money	Amazon is deaf to my Furby problem	[Online shopping, Consumer rights, Consumer affairs, Money, Amazon.com, Technology]
Sun Aug 02 06:00:09 MSK 2015	Television & radio	The week in TV: Life in Squares, Partners in Crime; Parks and Recreation; Taskmaster; Atlantic	[Television & radio, Documentary, Factual TV, Historical drama, Drama, Comedy, Comedy, Period drama, Books, Virginia Woolf, Television, Parks and Recreation, Culture, David Walliams]
Sun Aug 02 06:00:09 MSK 2015	Television & radio	The week in radio: Night Shift; Radio 1’s Ibiza Prom	[Factual radio, Sleep, Sarah Montague, BBC Proms 2015, Dance music, Classical music, Proms, Radio 1, Radio, Television & radio, Culture]
Sun Aug 02 06:00:08 MSK 2015	Travel	Holiday guide to Sardinia’s best beaches, plus restaurants and hotels	[Sardinia, Italy holidays, Europe, Beach holidays, Food and drink, Hotels, Summer holidays, Travel]
Sun Aug 02 06:00:08 MSK 2015	Books	Ich bin ein Berliner…	[Publishing, Ebooks, Books, Culture, Technology]
Sun Aug 02 06:00:08 MSK 2015	Education	The 'granny cloud': the network of volunteers helping poorer children learn	[Education, Technology, Skype, Slumdog Millionaire]
Sun Aug 02 06:00:07 MSK 2015	Travel	Train wrecked: take the (non) sleeper to Germany’s Melt! festival	[Festivals, Germany holidays, Rail travel, Europe, Travel, Festivals, Culture, Electronic music, Music]
Sun Aug 02 06:00:07 MSK 2015	Music	Haiku Salut: Etch and Etch Deep review – folktronica at its most mysterious	[Electronic music, Pop and rock, Music, Culture]
Sun Aug 02 06:00:07 MSK 2015	Life and style	How can I stop someone snoring?	[Sleep, Health & wellbeing, Life and style]
Sun Aug 02 06:00:06 MSK 2015	Travel	Travel tips: the magical island of Noirmoutier, plus bargains of the week | Joanne O’Connor	[France holidays, Europe, Travel]
Sun Aug 02 06:00:06 MSK 2015	Books	Naked at Lunch review – the funny thing about nudism	[Health, mind and body, Society, Books, Culture, Health]
Sun Aug 02 06:00:06 MSK 2015	Film	White God; Good Kill; Woman in Gold; Insurgent; La Jetée; Sans Soleil; Level Five; The Case of the Grinning Cat – review	[Thriller, Drama, Science fiction and fantasy, Ethan Hawke, Helen Mirren, Naomi Watts, Kate Winslet, DVD and video reviews, Film, Culture]
Sun Aug 02 06:00:06 MSK 2015	Teacher Network	Science of stress: how neuroscience can help teachers switch off this summer	[Teacher Network, Education, Schools, Primary schools, Secondary schools, Private schools, Teaching, Teachers' workload, Neuroscience, Science, Work-life balance, Work & careers]
Sun Aug 02 06:00:05 MSK 2015	Music	Grieg/Saint-Saëns: Piano Concertos CD review – youthful fire lifts old favourites	[Edvard Grieg, Classical music, Music, Culture]
Sun Aug 02 05:59:06 MSK 2015	Football	How science is fine-tuning our elite footballers	[Football, Sport, Sports science, Technology, Fifa, Health & wellbeing, Fitness]
Sun Aug 02 05:30:11 MSK 2015	Books	The Angel and the Cad: Love, Loss and Scandal in Regency England review	[Biography, History, Books, Culture]
Sun Aug 02 05:00:06 MSK 2015	Life and style	Learning to love our bodies | Eva Wiseman	[Women, Life and style, Obesity, Society, Body image, Health & wellbeing, Health]
Sun Aug 02 05:00:06 MSK 2015	Technology	Mazda MX-5: car review | Martin Love	[Motoring, Technology, Automotive industry, Motor sport, Military]
Sun Aug 02 05:00:05 MSK 2015	Environment	Is wild red grouse more ethical than chicken? | Lucy Siegle	[Ethical and green living, Environment, Life and style]
Sun Aug 02 05:00:05 MSK 2015	Life and style	Amoul’s Hideaway: restaurant review | Jay Rayner	[Food & drink, Restaurants, Restaurants, Life and style, Travel]
Sun Aug 02 05:00:04 MSK 2015	Life and style	Gardens: the August checklist | Dan Pearson	[Gardening advice, Gardens, Life and style]
Sun Aug 02 05:00:04 MSK 2015	Life and style	Alix McAlister and her mother, Sarah, on how their roles swapped	[Relationships, Life and style]
Sun Aug 02 04:59:04 MSK 2015	Life and style	The best new nude nail varnishes	[Beauty, Life and style]
Sun Aug 02 04:59:04 MSK 2015	Fashion	Think pink: re-embrace this fun shade this season | Alice Fisher	[Fashion, Life and style]
Sun Aug 02 04:25:54 MSK 2015	Australia news	Manus Island: rejected asylum seekers to be deported by Papua New Guinea	[Manus Island, Australian immigration and asylum, Australia news, Papua New Guinea, Asia Pacific, Refugees, Australian politics]
Sun Aug 02 04:10:41 MSK 2015	Australia news	Bronwyn Bishop splashed $1,000 on limousines in one day, reports say	[Bronwyn Bishop, Coalition, Australian politicians' expenses, Australian politics, Liberal party, Sydney, Australia news, News Corporation, Bill Shorten, Labor party]
Sun Aug 02 03:07:13 MSK 2015	Football	Wright-Phillips brothers combine to give New York Red Bulls victory	[MLS, New York Red Bulls, Philadelphia Union, Football, US sports, Sport]
Sun Aug 02 03:00:01 MSK 2015	Television & radio	Hannibal episode nine recap: And the Woman Clothed with the Sun	[Hannibal, Hannibal Lecter, US television, Television, Television & radio, Culture]
Sun Aug 02 02:23:40 MSK 2015	Australia news	Galarrwuy Yunupingu presented with honorary doctorate at Garma festival	[Indigenous Australians, Northern Territory, Australia news, Indigenous peoples, Australian politics, Melbourne, Australian universities]
Sun Aug 02 00:00:06 MSK 2015	Film	The Jammed rewatched: indie thriller that became a runaway Aussie success	[Australian film, Film, Drama, Culture]
Sat Aug 01 23:49:03 MSK 2015	Sport	Athletics faces new doping crisis after ‘biggest leak’ of test results	[Drugs in sport, Athletics, Sport]
Sat Aug 01 23:10:05 MSK 2015	From the Observer	Museum fees: charging for entry is a pointless, retrograde step | the big issue	[Museums, Culture, UK news]
Sat Aug 01 23:09:05 MSK 2015	Comment is free	There can be no amnesty for those who buy sex – not even if women ‘consent’ | Esohe Aghatise	[Sex trade, Amnesty International, Society, World news, UK news]
Sat Aug 01 23:08:05 MSK 2015	Comment is free	Why Jeremy Corbyn seems like the real deal | Sonia Sodha	[Jeremy Corbyn, Politics, UK news, Labour party leadership, Labour, Nigel Farage, UK Independence party (Ukip)]
Sat Aug 01 23:05:07 MSK 2015	US news	Bring on the debate: the faces hoping to star in the Republican TV showdown	[US elections 2016, Republicans, Donald Trump, Jeb Bush, Scott Walker, Mike Huckabee, Ben Carson, Rand Paul, Ted Cruz, Marco Rubio, Chris Christie, Rick Perry, Rick Santorum, Carly Fiorina, US news, World news]
Sat Aug 01 23:05:07 MSK 2015	Environment	Creepy-crawly celebrity contest will highlight UK’s threatened species	[Insects, Wildlife, Animals, Environment, Climate change, Cop 20: UN climate change conference | Lima, Pesticides, Farming, UK news]
Sat Aug 01 23:05:06 MSK 2015	US news	‘Don’t call me a crypto-Nazi!’ The lost heart of political debate	[US politics, Politics, Best of Enemies, Documentary, Film, UK news, US news, Gore Vidal]
Sat Aug 01 23:05:06 MSK 2015	Comment is free	Why Obama doesn’t understand the lust for power of our African leaders | Patience Akumu	[Barack Obama, Africa, Democratic Republic of the Congo, Ethiopia, Burundi, Zimbabwe, Yoweri Museveni]
Sat Aug 01 23:05:06 MSK 2015	News	For the record	[]
Sat Aug 01 23:05:05 MSK 2015	Global development	Lawyers Leigh Day: troublemakers who are a thorn in the side of multinationals	[Global development, Law, World news]
Sat Aug 01 23:05:05 MSK 2015	Comment is free	The Observer view on global mining regulation	[Mining, Environment, Mining, Business, Africa, World news, Zambia]
Sat Aug 01 23:05:05 MSK 2015	Comment is free	The Observer view on the future of the BBC | Observer editorial	[BBC, Television, Media, BBC licence fee, Top Gear, UK news]
Sat Aug 01 23:05:00 MSK 2015	Life and style	Teenage girls are skipping meals as weight anxiety soars	[Body image, Children, UK news, Society, Health & wellbeing, Health, Life and style]
Sat Aug 01 23:04:07 MSK 2015	Comment is free	Labour is really two parties. And they simply can’t stand each other | Andrew Rawnsley	[Politics, Labour, Electoral reform, UK news, Jeremy Corbyn]
Sat Aug 01 23:04:06 MSK 2015	Travel	Floating tents, drowned festivals, rivers of mud … so are we still happy campers?	[Camping, UK news, Travel, Weather, Womad, Music festivals, Culture, Life and style]
Sat Aug 01 23:04:05 MSK 2015	Comment is free	Britain’s carpetbagger PM is a national embarrassment | Jonathan Eyal	[David Cameron, Asia Pacific, Politics, UK news, World news, Foreign policy]
Sat Aug 01 23:04:05 MSK 2015	US news	Trump turns US politics into a (bad) reality show	[Donald Trump, Republicans, US politics, US news, Rick Santorum, Jeb Bush, Ted Cruz, Mike Huckabee, Chris Christie, John McCain, Marco Rubio, Rand Paul, Ben Carson, Rick Perry]
